A1: PROFESYONEL DERBY 45 KLASMAN LÝSTESÝ
A7: BENZING SÝSTEMÝNDE UÇUM HIZI ÝLE YAPILAN KLASMAN HESAPLAMASINDA 1 GÜNLÜK - 2 GÜNLÜK VE 3 GÜNLÜK YARIÞLARDA LÝSTEYE GÝREN BÜTÜN KUÞLAR DEÐERLENDÝRMEYE ALINIR
D8: 1 GÜNLÜK | F8: 1 GÜNLÜK | H8: 1 GÜNLÜK
D9: KULA | F9: UÞAK | H9: DUMLUPINAR | N9: ETAP | O9: ORTALAMA HIZ
A10: NO | B10: AD SOYAD | C10: KÜNYE | D10: SIRA | E10: HIZ | F10: SIRA | G10: HIZ | H10: SIRA | I10: HIZ | J10: SIRA | K10: HIZ | L10: SIRA | M10: HIZ
A11: 1 | B11: TRAKYA POSTA OGUN CEM KOSE | C11: TR 207001 | D11: 16 | E11: 1409.9401 | F11: 14 | G11: 1358.3150000000001 | H11: 30 | I11: 1406.4937 | N11: 3X3 | O11: =+(E11+G11+I11)/(3) -> 1391.5829333333334
A12: 2 | B12: TRAKYA POSTA OGUN CEM KOSE | C12: TR 207002 | D12: 76 | E12: 1387.71 | F12: 7 | G12: 1362.5177000000001 | H12: 16 | I12: 1408.4447 | N12: 3X3 | O12: =+(E12+G12+I12)/(3) -> 1386.2241333333334
A13: 3 | B13: OSMAN ALTAS | C13: TR 34810 | D13: 45 | E13: 1398.2624000000001 | F13: 9 | G13: 1361.9571000000001 | H13: 45 | I13: 1397.0353 | N13: 3X3 | O13: =+(E13+G13+I13)/(3) -> 1385.7516000000003
A14: 4 | B14: CAGLAYAN INSAAT | C14: TR 114310 | D14: 64 | E14: 1393.0356999999999 | F14: 31 | G14: 1340.6305 | H14: 4 | I14: 1419.6266000000001 | N14: 3X3 | O14: =+(E14+G14+I14)/(3) -> 1384.4309333333331
A15: 5 | B15: GUR KARDESLER | C15: TR 135402 | D15: 51 | E15: 1395.6052 | F15: 38 | G15: 1339.9699000000001 | H15: 11 | I15: 1410.9286999999999 | N15: 3X3 | O15: =+(E15+G15+I15)/(3) -> 1382.1679333333334
A16: 6 | B16: MEHMET TUNCAY | C16: TR 135274 | D16: 121 | E16: 1369.2940000000001 | F16: 5 | G16: 1363.1696999999999 | H16: 12 | I16: 1410.7431999999999 | N16: 3X3 | O16: =+(E16+G16+I16)/(3) -> 1381.0689666666667
A17: 7 | B17: KENAN EMRAH KARATAS | C17: TR 171182 | D17: 53 | E17: 1395.4981 | F17: 40 | G17: 1339.9287999999999 | H17: 24 | I17: 1407.6366 | N17: 3X3 | O17: =+(E17+G17+I17)/(3) -> 1381.0211666666667
A18: 8 | B18: TAMER SEMERCILER | C18: TR 172004 | D18: 127 | E18: 1366.0175999999999 | F18: 8 | G18: 1362.1369 | H18: 10 | I18: 1411.1986999999999 | N18: 3X3 | O18: =+(E18+G18+I18)/(3) -> 1379.7843999999998
A19: 9 | B19: SANATCI HACI SEVINC | C19: TR 246701 | D19: 10 | E19: 1411.0574999999999 | F19: 83 | G19: 1305.231 | H19: 21 | I19: 1407.9579000000001 | N19: 3X3 | O19: =+(E19+G19+I19)/(3) -> 1374.7488000000001
A20: 10 | B20: MEHMET BULDUK | C20: TR 77319 | D20: 137 | E20: 1363.3853999999999 | F20: 16 | G20: 1352.4327000000001 | H20: 41 | I20: 1400.1472000000001 | N20: 3X3 | O20: =+(E20+G20+I20)/(3) -> 1371.9884333333332
A21: 11 | B21: MEHMET KIR | C21: TR 9912 | D21: 21 | E21: 1408.3185000000001 | F21: 104 | G21: 1296.4126000000001 | H21: 25 | I21: 1407.4204999999999 | N21: 3X3 | O21: =+(E21+G21+I21)/(3) -> 1370.7172
A22: 12 | B22: TEK ATAR ETEM | C22: TR 33421 | D22: 68 | E22: 1390.9947 | F22: 43 | G22: 1339.7474 | H22: 59 | I22: 1380.2825 | N22: 3X3 | O22: =+(E22+G22+I22)/(3) -> 1370.3415333333332
A23: 13 | B23: SANATCI HACI SEVINC | C23: TR 246707 | D23: 66 | E23: 1392.0273999999999 | F23: 35 | G23: 1340.2692 | H23: 66 | I23: 1378.1885 | N23: 3X3 | O23: =+(E23+G23+I23)/(3) -> 1370.1616999999999
A24: 14 | B24: MURAT OYNAR | C24: TR 212514 | D24: 6 | E24: 1416.0930000000001 | F24: 145 | G24: 1285.9118000000001 | H24: 17 | I24: 1408.3395 | N24: 3X3 | O24: =+(E24+G24+I24)/(3) -> 1370.1147666666668
A25: 15 | B25: EDIP BEKIL BULENT YILMAZ | C25: TR 11008 | D25: 82 | E25: 1385.2526 | F25: 69 | G25: 1312.3951999999999 | H25: 7 | I25: 1412.0486000000001 | N25: 3X3 | O25: =+(E25+G25+I25)/(3) -> 1369.8987999999999
A26: 16 | B26: UGUR UFUK KARDESLER | C26: TR 137524 | D26: 60 | E26: 1394.3469 | F26: 80 | G26: 1305.9856 | H26: 37 | I26: 1402.0537999999999 | N26: 3X3 | O26: =+(E26+G26+I26)/(3) -> 1367.4621
A27: 17 | B27: HUSEYIN NURCAN | C27: TR 163950 | D27: 34 | E27: 1402.318 | F27: 130 | G27: 1288.2239999999999 | H27: 27 | I27: 1407.326 | N27: 3X3 | O27: =+(E27+G27+I27)/(3) -> 1365.9560000000001
A28: 18 | B28: BACO FARUK YILDIZ | C28: TR 78518 | D28: 49 | E28: 1396.3848 | F28: 2 | G28: 1368.7849000000001 | H28: 120 | I28: 1332.3240000000001 | N28: 3X3 | O28: =+(E28+G28+I28)/(3) -> 1365.8312333333336
A29: 19 | B29: KAMET GIDA | C29: TR 49168 | D29: 5 | E29: 1419.0369000000001 | F29: 42 | G29: 1339.8127999999999 | H29: 133 | I29: 1330.6519000000001 | N29: 3X3 | O29: =+(E29+G29+I29)/(3) -> 1363.1671999999999
A30: 20 | B30: HASAN ALTINBULAK | C30: TR 135655 | D30: 207 | E30: 1342.7594999999999 | F30: 56 | G30: 1338.3447000000001 | H30: 35 | I30: 1402.5603000000001 | N30: 3X3 | O30: =+(E30+G30+I30)/(3) -> 1361.2214999999999
A31: 21 | B31: TAYYAR BASARAN | C31: TR 206915 | D31: 132 | E31: 1364.4892 | F31: 60 | G31: 1337.6528000000001 | H31: 56 | I31: 1381.4337 | N31: 3X3 | O31: =+(E31+G31+I31)/(3) -> 1361.1919
A32: 22 | B32: MALAZGIRT BORU TEAM | C32: TR 90114 | D32: 30 | E32: 1403.4628 | F32: 46 | G32: 1339.4875 | H32: 101 | I32: 1340.0893000000001 | N32: 3X3 | O32: =+(E32+G32+I32)/(3) -> 1361.0132000000001
A33: 23 | B33: SAMPIYON GOKHAN TUNCA MIKI | C33: TR 42830 | D33: 36 | E33: 1402.2720999999999 | F33: 54 | G33: 1338.7198000000001 | H33: 103 | I33: 1339.1932999999999 | N33: 3X3 | O33: =+(E33+G33+I33)/(3) -> 1360.0617333333332
A34: 24 | B34: ERCAN KOC | C34: TR 74601 | D34: 279 | E34: 1331.5431000000001 | F34: 32 | G34: 1340.6286 | H34: 31 | I34: 1406.1836000000001 | N34: 3X3 | O34: =+(E34+G34+I34)/(3) -> 1359.4517666666668
A35: 25 | B35: UMIT ZEYBEK | C35: TR 270694 | D35: 104 | E35: 1373.8590999999999 | F35: 101 | G35: 1296.7926 | H35: 26 | I35: 1407.4024999999999 | N35: 3X3 | O35: =+(E35+G35+I35)/(3) -> 1359.3513999999998
A36: 26 | B36: IBRAHIM TOPCU | C36: TR 9885 | D36: 18 | E36: 1409.0461 | F36: 100 | G36: 1297.8778 | H36: 80 | I36: 1350.4527 | N36: 3X3 | O36: =+(E36+G36+I36)/(3) -> 1352.4588666666666
A37: 27 | B37: TEK ATAR ETEM | C37: TR 33423 | D37: 98 | E37: 1378.116 | F37: 99 | G37: 1297.9445000000001 | H37: 69 | I37: 1376.9837 | N37: 3X3 | O37: =+(E37+G37+I37)/(3) -> 1351.0147333333334
A38: 28 | B38: MALAZGIRT BORU TEAM | C38: TR 90101 | D38: 215 | E38: 1342.1226999999999 | F38: 86 | G38: 1304.0041000000001 | H38: 29 | I38: 1406.4952000000001 | N38: 3X3 | O38: =+(E38+G38+I38)/(3) -> 1350.874
A39: 29 | B39: NATURAL YEM | C39: TR 73308 | D39: 22 | E39: 1408.173 | F39: 67 | G39: 1313.4976999999999 | H39: 139 | I39: 1329.9386 | N39: 3X3 | O39: =+(E39+G39+I39)/(3) -> 1350.5364333333332
A40: 30 | B40: IBRAHIM UZUN | C40: TR 89312 | D40: 106 | E40: 1373.5445999999999 | F40: 217 | G40: 1275.2035000000001 | H40: 36 | I40: 1402.2727 | N40: 3X3 | O40: =+(E40+G40+I40)/(3) -> 1350.3402666666666
A41: 31 | B41: TAYYAR BASARAN | C41: TR 206909 | D41: 31 | E41: 1402.5736999999999 | F41: 57 | G41: 1338.1823999999999 | H41: 213 | I41: 1309.6953000000001 | N41: 3X3 | O41: =+(E41+G41+I41)/(3) -> 1350.1504666666667
A42: 32 | B42: IHSAN SARIYER | C42: TR 90129 | D42: 275 | E42: 1332.2527 | F42: 98 | G42: 1298.0217 | H42: 5 | I42: 1419.5182 | N42: 3X3 | O42: =+(E42+G42+I42)/(3) -> 1349.9308666666668
A43: 33 | B43: FERHAT GULEZ | C43: TR 210739 | D43: 407 | E43: 1293.2148999999999 | F43: 1 | G43: 1371.1288999999999 | H43: 54 | I43: 1382.3307 | N43: 3X3 | O43: =+(E43+G43+I43)/(3) -> 1348.8915
A44: 34 | B44: TEAM KGY | C44: TR 226895 | D44: 67 | E44: 1391.0301999999999 | F44: 62 | G44: 1336.7941000000001 | H44: 190 | I44: 1318.4284 | N44: 3X3 | O44: =+(E44+G44+I44)/(3) -> 1348.7509
A45: 35 | B45: GUNEY KEBAP MURAT YILDIRIM | C45: TR 102422 | D45: 105 | E45: 1373.5698 | F45: 114 | G45: 1292.4558 | H45: 63 | I45: 1379.5020999999999 | N45: 3X3 | O45: =+(E45+G45+I45)/(3) -> 1348.5092333333332
A46: 36 | B46: MEHMET BULDUK | C46: TR 77314 | D46: 86 | E46: 1381.3649 | F46: 235 | G46: 1259.9798000000001 | H46: 39 | I46: 1401.3542 | N46: 3X3 | O46: =+(E46+G46+I46)/(3) -> 1347.5663000000002
A47: 37 | B47: KENAN YURDEM | C47: TR 97222 | D47: 116 | E47: 1370.6452999999999 | F47: 39 | G47: 1339.9475 | H47: 122 | I47: 1331.8629000000001 | N47: 3X3 | O47: =+(E47+G47+I47)/(3) -> 1347.4852333333333
A48: 38 | B48: HUSEYIN BAKIRCI | C48: TR 174108 | D48: 335 | E48: 1318.8987 | F48: 87 | G48: 1303.2517 | H48: 3 | I48: 1419.7501999999999 | N48: 3X3 | O48: =+(E48+G48+I48)/(3) -> 1347.3001999999999
A49: 39 | B49: MEHMET TUNCAY | C49: TR 135276 | D49: 37 | E49: 1401.4958999999999 | F49: 263 | G49: 1235.6134999999999 | H49: 40 | I49: 1401.0492999999999 | N49: 3X3 | O49: =+(E49+G49+I49)/(3) -> 1346.0528999999999
A50: 40 | B50: MEHMET BULDUK | C50: TR 77326 | D50: 308 | E50: 1326.961 | F50: 121 | G50: 1291.3015 | H50: 6 | I50: 1415.0473 | N50: 3X3 | O50: =+(E50+G50+I50)/(3) -> 1344.4366
A51: 41 | B51: CEMALETTIN DAG | C51: TR 90732 | D51: 65 | E51: 1392.79 | F51: 72 | G51: 1309.0576000000001 | H51: 129 | I51: 1331.1578 | N51: 3X3 | O51: =+(E51+G51+I51)/(3) -> 1344.3351333333333
A52: 42 | B52: SAMPIYON GOKHAN TUNCA MIKI | C52: TR 42827 | D52: 288 | E52: 1329.7519 | F52: 124 | G52: 1290.1751999999999 | H52: 13 | I52: 1410.6015 | N52: 3X3 | O52: =+(E52+G52+I52)/(3) -> 1343.5095333333331
A53: 43 | B53: www.turbopýgeon.com | C53: TR 45003 | D53: 103 | E53: 1374.8507999999999 | F53: 210 | G53: 1277.4722999999999 | H53: 68 | I53: 1377.8332 | N53: 3X3 | O53: =+(E53+G53+I53)/(3) -> 1343.3854333333331
A54: 44 | B54: MEHMET KIR | C54: TR 9913 | D54: 296 | E54: 1328.6034999999999 | F54: 110 | G54: 1292.6994999999999 | H54: 22 | I54: 1407.7102 | N54: 3X3 | O54: =+(E54+G54+I54)/(3) -> 1343.0044
A55: 45 | B55: CAGLAYAN INSAAT | C55: TR 114317 | D55: 165 | E55: 1349.8039000000001 | F55: 158 | G55: 1284.4648 | H55: 51 | I55: 1389.3172 | N55: 3X3 | O55: =+(E55+G55+I55)/(3) -> 1341.1953000000001
A56: 46 | B56: HUSEYIN NURCAN | C56: TR 163978 | D56: 187 | E56: 1345.6052999999999 | F56: 4 | G56: 1367.1202000000001 | H56: 221 | I56: 1307.5884000000001 | N56: 3X3 | O56: =+(E56+G56+I56)/(3) -> 1340.1046333333334
A57: 47 | B57: F.CANKAYA E.ALTAN E.FIDAN | C57: TR 202106 | D57: 282 | E57: 1330.7221999999999 | F57: 47 | G57: 1339.4857 | H57: 84 | I57: 1349.2655999999999 | N57: 3X3 | O57: =+(E57+G57+I57)/(3) -> 1339.8244999999999
A58: 48 | B58: MEHMET TUNCAY | C58: TR 135292 | D58: 292 | E58: 1329.2246 | F58: 3 | G58: 1368.2035000000001 | H58: 167 | I58: 1321.0806 | N58: 3X3 | O58: =+(E58+G58+I58)/(3) -> 1339.5029000000002
A59: 49 | B59: ONDER KARDESLER | C59: TR 100582 | D59: 73 | E59: 1388.6895999999999 | F59: 133 | G59: 1287.5934 | H59: 94 | I59: 1341.9489000000001 | N59: 3X3 | O59: =+(E59+G59+I59)/(3) -> 1339.4106333333332
A60: 50 | B60: RECEP OZTURK | C60: TR 225089 | D60: 230 | E60: 1340.1413 | F60: 225 | G60: 1266.3822 | H60: 9 | I60: 1411.2636 | N60: 3X3 | O60: =+(E60+G60+I60)/(3) -> 1339.2623666666668
A61: 51 | B61: MEHMET DAVAZ | C61: TR 202016 | D61: 90 | E61: 1380.6148000000001 | F61: 176 | G61: 1283.0245 | H61: 77 | I61: 1353.1356000000001 | N61: 3X3 | O61: =+(E61+G61+I61)/(3) -> 1338.9249666666667
A62: 52 | B62: CAN KARDESLER KADIR | C62: TR 119062 | D62: 54 | E62: 1395.0600999999999 | F62: 122 | G62: 1291.0306 | H62: 140 | I62: 1329.7953 | N62: 3X3 | O62: =+(E62+G62+I62)/(3) -> 1338.6286666666665
A63: 53 | B63: FATIH ISMAIL OZPIRINCI | C63: TR 93214 | D63: 218 | E63: 1341.6756 | F63: 53 | G63: 1338.8188 | H63: 115 | I63: 1334.1473000000001 | N63: 3X3 | O63: =+(E63+G63+I63)/(3) -> 1338.2139
A64: 54 | B64: TAMER ERHAN YAY | C64: TR 95403 | D64: 323 | E64: 1322.7047 | F64: 137 | G64: 1287.1065000000001 | H64: 33 | I64: 1404.6333999999999 | N64: 3X3 | O64: =+(E64+G64+I64)/(3) -> 1338.1481999999999
A65: 55 | B65: SELAHADDIN BAKAR | C65: TR 21090 | D65: 129 | E65: 1365.7564 | F65: 70 | G65: 1311.3912 | H65: 111 | I65: 1336.261 | N65: 3X3 | O65: =+(E65+G65+I65)/(3) -> 1337.8028666666667
A66: 56 | B66: BACO FARUK YILDIZ | C66: TR 78512 | D66: 48 | E66: 1396.3913 | F66: 128 | G66: 1289.3175000000001 | H66: 146 | I66: 1327.5698 | N66: 3X3 | O66: =+(E66+G66+I66)/(3) -> 1337.7595333333336
A67: 57 | B67: BABUSLAR | C67: TR 85706 | D67: 110 | E67: 1372.0745999999999 | F67: 112 | G67: 1292.4802 | H67: 89 | I67: 1348.0735999999999 | N67: 3X3 | O67: =+(E67+G67+I67)/(3) -> 1337.5427999999999
A68: 58 | B68: FESIH UNAL | C68: TR 127508 | D68: 330 | E68: 1320.3557000000001 | F68: 116 | G68: 1292.2088000000001 | H68: 42 | I68: 1399.4405999999999 | N68: 3X3 | O68: =+(E68+G68+I68)/(3) -> 1337.3350333333335
A69: 59 | B69: GUR KARDESLER | C69: TR 135405 | D69: 59 | E69: 1394.4246000000001 | F69: 189 | G69: 1281.5704000000001 | H69: 128 | I69: 1331.2517 | N69: 3X3 | O69: =+(E69+G69+I69)/(3) -> 1335.7488999999998
A70: 60 | B70: ERCAN KOC | C70: TR 74606 | D70: 315 | E70: 1325.2844 | F70: 96 | G70: 1298.8507 | H70: 62 | I70: 1379.5641000000001 | N70: 3X3 | O70: =+(E70+G70+I70)/(3) -> 1334.5663999999999
A71: 61 | B71: BACO FARUK YILDIZ | C71: TR 78504 | D71: 295 | E71: 1328.73 | F71: 107 | G71: 1295.2896000000001 | H71: 61 | I71: 1379.5669 | N71: 3X3 | O71: =+(E71+G71+I71)/(3) -> 1334.5288333333335
A72: 62 | B72: TANER DERBY 17 | C72: TR 16122 | D72: 27 | E72: 1404.3892000000001 | F72: 118 | G72: 1291.8418999999999 | H72: 225 | I72: 1307.0252 | N72: 3X3 | O72: =+(E72+G72+I72)/(3) -> 1334.4187666666667
A73: 63 | B73: SINAN BAYRAKTAR OGUN KOSE | C73: TR 207162 | D73: 353 | E73: 1311.3837000000001 | F73: 41 | G73: 1339.9268999999999 | H73: 79 | I73: 1351.7001 | N73: 3X3 | O73: =+(E73+G73+I73)/(3) -> 1334.3369
A74: 64 | B74: ADEM AHMET | C74: TR 166243 | D74: 128 | E74: 1365.9522999999999 | F74: 172 | G74: 1283.6334999999999 | H74: 78 | I74: 1352.5545999999999 | N74: 3X3 | O74: =+(E74+G74+I74)/(3) -> 1334.0467999999998
A75: 65 | B75: YUSUF KARAKURT | C75: TR 27230 | D75: 80 | E75: 1385.9277999999999 | F75: 131 | G75: 1287.9682 | H75: 145 | I75: 1327.5832 | N75: 3X3 | O75: =+(E75+G75+I75)/(3) -> 1333.8263999999999
A76: 66 | B76: ZAFER ZAFER | C76: TR 7001 | D76: 239 | E76: 1339.3605 | F76: 198 | G76: 1280.087 | H76: 55 | I76: 1381.6433999999999 | N76: 3X3 | O76: =+(E76+G76+I76)/(3) -> 1333.6969666666666
A77: 67 | B77: SEYIT MUSTAFA YILDIZ | C77: TR 93205 | D77: 310 | E77: 1326.7497000000001 | F77: 51 | G77: 1339.0485000000001 | H77: 131 | I77: 1330.8154999999999 | N77: 3X3 | O77: =+(E77+G77+I77)/(3) -> 1332.2045666666666
A78: 68 | B78: SERKAN CIFTCI | C78: TR 114842 | D78: 345 | E78: 1315.0482999999999 | F78: 52 | G78: 1338.8991000000001 | H78: 97 | I78: 1341.0328 | N78: 3X3 | O78: =+(E78+G78+I78)/(3) -> 1331.6600666666666
A79: 69 | B79: ENGIN KAPTAN | C79: TR 270403 | D79: 88 | E79: 1380.9580000000001 | F79: 178 | G79: 1282.8598999999999 | H79: 150 | I79: 1325.4368999999999 | N79: 3X3 | O79: =+(E79+G79+I79)/(3) -> 1329.7515999999998
A80: 70 | B80: IBRAHIM HUSEYIN | C80: TR 161141 | D80: 19 | E80: 1408.5300999999999 | F80: 326 | G80: 1172.3715999999999 | H80: 23 | I80: 1407.6516999999999 | N80: 3X3 | O80: =+(E80+G80+I80)/(3) -> 1329.5177999999999
A81: 71 | B81: IBRAHIM HUSEYIN | C81: TR 161143 | D81: 136 | E81: 1363.5217 | F81: 75 | G81: 1306.5509 | H81: 191 | I81: 1318.3190999999999 | N81: 3X3 | O81: =+(E81+G81+I81)/(3) -> 1329.4639
A82: 72 | B82: MEHMET SARIAYVAZ | C82: TR 216976 | D82: 56 | E82: 1394.7455 | F82: 209 | G82: 1277.7647999999999 | H82: 197 | I82: 1315.6255000000001 | N82: 3X3 | O82: =+(E82+G82+I82)/(3) -> 1329.3786
A83: 73 | B83: BULENT SAFAK CIT | C83: TR 115867 | D83: 122 | E83: 1369.1159 | F83: 150 | G83: 1285.2557999999999 | H83: 117 | I83: 1332.8594000000001 | N83: 3X3 | O83: =+(E83+G83+I83)/(3) -> 1329.0770333333332
A84: 74 | B84: CEM MERKOZLU | C84: TR 260000 | D84: 487 | E84: 1239.8923 | F84: 55 | G84: 1338.4548 | H84: 20 | I84: 1408.1232 | N84: 3X3 | O84: =+(E84+G84+I84)/(3) -> 1328.8234333333332
A85: 75 | B85: TAMER SANLI | C85: TR 50061 | D85: 278 | E85: 1331.8831 | F85: 13 | G85: 1358.5784000000001 | H85: 250 | I85: 1295.6483000000001 | N85: 3X3 | O85: =+(E85+G85+I85)/(3) -> 1328.7032666666667
A86: 76 | B86: KASAP OSMAN | C86: TR 66511 | D86: 12 | E86: 1410.7224000000001 | F86: 171 | G86: 1283.6867 | H86: 256 | I86: 1291.1278 | N86: 3X3 | O86: =+(E86+G86+I86)/(3) -> 1328.5123000000001
A87: 77 | B87: TEK ATAR ETEM | C87: TR 33407 | D87: 370 | E87: 1306.4949999999999 | F87: 27 | G87: 1345.5365999999999 | H87: 137 | I87: 1330.0565999999999 | N87: 3X3 | O87: =+(E87+G87+I87)/(3) -> 1327.3627333333332
A88: 78 | B88: ASMEL BAYRAKLI | C88: TR 216199 | D88: 350 | E88: 1313.2004999999999 | F88: 17 | G88: 1352.2193 | H88: 200 | I88: 1315.2362000000001 | N88: 3X3 | O88: =+(E88+G88+I88)/(3) -> 1326.8853333333334
A89: 79 | B89: BEYKOZ ARENA POSTA TAHIR AK | C89: TR 137002 | D89: 360 | E89: 1309.4861000000001 | F89: 59 | G89: 1337.7759000000001 | H89: 125 | I89: 1331.3081 | N89: 3X3 | O89: =+(E89+G89+I89)/(3) -> 1326.1900333333333
A90: 80 | B90: KIRKPINAR ARENA | C90: TR 63027 | D90: 505 | E90: 1203.9248 | F90: 6 | G90: 1362.9065000000001 | H90: 14 | I90: 1410.1569999999999 | N90: 3X3 | O90: =+(E90+G90+I90)/(3) -> 1325.6627666666666
A91: 81 | B91: SEYIT MUSTAFA YILDIZ | C91: TR 136148 | D91: 123 | E91: 1368.635 | F91: 147 | G91: 1285.6259 | H91: 169 | I91: 1320.8348000000001 | N91: 3X3 | O91: =+(E91+G91+I91)/(3) -> 1325.0319000000002
A92: 82 | B92: YASAR AYGOR | C92: TR 85915 | D92: 392 | E92: 1298.5636 | F92: 222 | G92: 1270.9845 | H92: 34 | I92: 1404.4241 | N92: 3X3 | O92: =+(E92+G92+I92)/(3) -> 1324.6574000000001
A93: 83 | B93: MUHARREM IBRAHIM SEN KARDESLER | C93: TR 199905 | D93: 138 | E93: 1363.184 | F93: 186 | G93: 1281.8851999999999 | H93: 144 | I93: 1328.076 | N93: 3X3 | O93: =+(E93+G93+I93)/(3) -> 1324.3817333333334
A94: 84 | B94: BOYACI BERBER | C94: TR 95789 | D94: 244 | E94: 1337.9178999999999 | F94: 89 | G94: 1302.2017000000001 | H94: 126 | I94: 1331.2946999999999 | N94: 3X3 | O94: =+(E94+G94+I94)/(3) -> 1323.8047666666666
A95: 85 | B95: MUSTAFA ISMET | C95: TR 96108 | D95: 1 | E95: 1426.5640000000001 | F95: 272 | G95: 1222.8131000000001 | H95: 164 | I95: 1321.5382999999999 | N95: 3X3 | O95: =+(E95+G95+I95)/(3) -> 1323.6384666666665
A96: 86 | B96: BATIN ERAY & TASKAN TENEKE | C96: TR 270529 | D96: 42 | E96: 1399.1591000000001 | F96: 340 | G96: 1147.3167000000001 | H96: 1 | I96: 1422.748 | N96: 3X3 | O96: =+(E96+G96+I96)/(3) -> 1323.0746000000001
A97: 87 | B97: SELAHADDIN BAKAR | C97: TR 21148 | D97: 141 | E97: 1359.4713999999999 | F97: 127 | G97: 1289.5546999999999 | H97: 186 | I97: 1318.6378 | N97: 3X3 | O97: =+(E97+G97+I97)/(3) -> 1322.5546333333334
A98: 88 | B98: BAKI SEKER | C98: TR 7941 | D98: 503 | E98: 1204.2293 | F98: 18 | G98: 1351.9584 | H98: 8 | I98: 1411.3661999999999 | N98: 3X3 | O98: =+(E98+G98+I98)/(3) -> 1322.5179666666666
A99: 89 | B99: DURALI BALIM | C99: TR 211900 | D99: 84 | E99: 1383.4384 | F99: 262 | G99: 1236.0509999999999 | H99: 90 | I99: 1347.4915000000001 | N99: 3X3 | O99: =+(E99+G99+I99)/(3) -> 1322.3269666666667
A100: 90 | B100: FATIH ISMAIL OZPIRINCI | C100: TR 93210 | D100: 242 | E100: 1338.1715999999999 | F100: 258 | G100: 1238.2574999999999 | H100: 53 | I100: 1387.0587 | N100: 3X3 | O100: =+(E100+G100+I100)/(3) -> 1321.1625999999999
A101: 91 | B101: TASKAN TENEKE | C101: TR 10902 | D101: 150 | E101: 1357.3279 | F101: 181 | G101: 1282.7057 | H101: 155 | I101: 1323.0841 | N101: 3X3 | O101: =+(E101+G101+I101)/(3) -> 1321.0392333333332
A102: 92 | B102: SEYIT MUSTAFA YILDIZ | C102: TR 136144 | D102: 126 | E102: 1366.5091 | F102: 174 | G102: 1283.2748999999999 | H102: 207 | I102: 1311.5953 | N102: 3X3 | O102: =+(E102+G102+I102)/(3) -> 1320.4597666666666
A103: 93 | B103: KIRKPINAR ARENA | C103: TR 63034 | D103: 355 | E103: 1311.1487 | F103: 216 | G103: 1275.3848 | H103: 73 | I103: 1374.6120000000001 | N103: 3X3 | O103: =+(E103+G103+I103)/(3) -> 1320.3818333333334
A104: 94 | B104: SEDAT AYDIN | C104: TR 93108 | D104: 208 | E104: 1342.6633999999999 | F104: 90 | G104: 1301.8679 | H104: 195 | I104: 1316.1895999999999 | N104: 3X3 | O104: =+(E104+G104+I104)/(3) -> 1320.2402999999997
A105: 95 | B105: TEK ATAR ETEM | C105: TR 33417 | D105: 212 | E105: 1342.3989999999999 | F105: 188 | G105: 1281.5721000000001 | H105: 110 | I105: 1336.376 | N105: 3X3 | O105: =+(E105+G105+I105)/(3) -> 1320.1157000000001
A106: 96 | B106: SINAN KARATAS | C106: TR 228701 | D106: 102 | E106: 1376.2446 | F106: 211 | G106: 1276.7706000000001 | H106: 223 | I106: 1307.2076999999999 | N106: 3X3 | O106: =+(E106+G106+I106)/(3) -> 1320.0743
A107: 97 | B107: FATIH CAGLAR | C107: TR 135378 | D107: 4 | E107: 1422.5932 | F107: 119 | G107: 1291.7340999999999 | H107: 325 | I107: 1245.7425000000001 | N107: 3X3 | O107: =+(E107+G107+I107)/(3) -> 1320.0232666666668
A108: 98 | B108: OSMAN ALTAS | C108: TR 34802 | D108: 166 | E108: 1349.6096 | F108: 135 | G108: 1287.4449 | H108: 156 | I108: 1323.0072 | N108: 3X3 | O108: =+(E108+G108+I108)/(3) -> 1320.0205666666668
A109: 99 | B109: AHMET TIMUR KOCDEMIR | C109: TR 135336 | D109: 78 | E109: 1386.9209000000001 | F109: 239 | G109: 1258.8348000000001 | H109: 203 | I109: 1314.0775000000001 | N109: 3X3 | O109: =+(E109+G109+I109)/(3) -> 1319.9444000000001
A110: 100 | B110: SANATCI HACI SEVINC | C110: TR 246712 | D110: 83 | E110: 1384.2394999999999 | F110: 241 | G110: 1257.8732 | H110: 204 | I110: 1313.4811999999999 | N110: 3X3 | O110: =+(E110+G110+I110)/(3) -> 1318.5312999999999
A111: 101 | B111: GUNOL & FATIH AYAS YILMAZ | C111: TR 271548 | D111: 85 | E111: 1382.6764000000001 | F111: 168 | G111: 1283.8619000000001 | H111: 263 | I111: 1288.4132999999999 | N111: 3X3 | O111: =+(E111+G111+I111)/(3) -> 1318.3172000000002
A112: 102 | B112: BEYDAGLI KARDESLER | C112: TR 10340 | D112: 508 | E112: 1202.6650999999999 | F112: 11 | G112: 1361.1885 | H112: 50 | I112: 1390.9568999999999 | N112: 3X3 | O112: =+(E112+G112+I112)/(3) -> 1318.2701666666665
A113: 103 | B113: ISA KIRTAY | C113: TR 90003 | D113: 143 | E113: 1358.5295000000001 | F113: 213 | G113: 1275.9154000000001 | H113: 187 | I113: 1318.6351999999999 | N113: 3X3 | O113: =+(E113+G113+I113)/(3) -> 1317.6933666666666
A114: 104 | B114: TRAKYA POSTA OGUN CEM KOSE | C114: TR 207084 | D114: 20 | E114: 1408.3185000000001 | F114: 275 | G114: 1222.2276999999999 | H114: 160 | I114: 1322.2040999999999 | N114: 3X3 | O114: =+(E114+G114+I114)/(3) -> 1317.5834333333332
A115: 105 | B115: FIRAT TIMURTAS | C115: TR 98602 | D115: 258 | E115: 1335.7109 | F115: 159 | G115: 1284.4493 | H115: 121 | I115: 1332.1733999999999 | N115: 3X3 | O115: =+(E115+G115+I115)/(3) -> 1317.4445333333333
A116: 106 | B116: SERDAR AYDIN EGE POSTA | C116: TR 141880 | D116: 170 | E116: 1349.0391 | F116: 170 | G116: 1283.7623000000001 | H116: 183 | I116: 1318.788 | N116: 3X3 | O116: =+(E116+G116+I116)/(3) -> 1317.1964666666668
A117: 107 | B117: TAYYAR BASARAN | C117: TR 206920 | D117: 44 | E117: 1398.4743000000001 | F117: 36 | G117: 1340.2636 | H117: 339 | I117: 1211.9241999999999 | N117: 3X3 | O117: =+(E117+G117+I117)/(3) -> 1316.8873666666666
A118: 108 | B118: TEK ATAR ETEM | C118: TR 33428 | D118: 285 | E118: 1330.4034999999999 | F118: 153 | G118: 1284.8206 | H118: 113 | I118: 1335.3444 | N118: 3X3 | O118: =+(E118+G118+I118)/(3) -> 1316.8561666666667
A119: 109 | B119: YUNUS DEMIR | C119: TR 93202 | D119: 418 | E119: 1289.0528999999999 | F119: 129 | G119: 1289.2967000000001 | H119: 74 | I119: 1371.5369000000001 | N119: 3X3 | O119: =+(E119+G119+I119)/(3) -> 1316.6288333333334
A120: 110 | B120: BASLARSAN INSAAT MURAT COSKUN | C120: TR 115502 | D120: 313 | E120: 1325.4103 | F120: 111 | G120: 1292.6264000000001 | H120: 123 | I120: 1331.6023 | N120: 3X3 | O120: =+(E120+G120+I120)/(3) -> 1316.5463333333335
A121: 111 | B121: ONER KAHRAMAN | C121: TR 59030 | D121: 229 | E121: 1340.2311 | F121: 236 | G121: 1259.4342999999999 | H121: 83 | I121: 1349.6739 | N121: 3X3 | O121: =+(E121+G121+I121)/(3) -> 1316.4464333333333
A122: 112 | B122: ERCAN KOC | C122: TR 74605 | D122: 111 | E122: 1372.0244 | F122: 125 | G122: 1289.8909000000001 | H122: 276 | I122: 1285.4009000000001 | N122: 3X3 | O122: =+(E122+G122+I122)/(3) -> 1315.7720666666667
A123: 113 | B123: DEVRIM AZMAN | C123: TR 76682 | D123: 397 | E123: 1297.5722000000001 | F123: 58 | G123: 1338.0332000000001 | H123: 210 | I123: 1310.7512999999999 | N123: 3X3 | O123: =+(E123+G123+I123)/(3) -> 1315.4522333333334
A124: 114 | B124: SEYIT MUSTAFA YILDIZ | C124: TR 136147 | D124: 297 | E124: 1328.4917 | F124: 257 | G124: 1242.6927000000001 | H124: 72 | I124: 1374.8753999999999 | N124: 3X3 | O124: =+(E124+G124+I124)/(3) -> 1315.3532666666667
A125: 115 | B125: MEHMET BULDUK | C125: TR 77318 | D125: 396 | E125: 1297.8697999999999 | F125: 261 | G125: 1236.2737999999999 | H125: 19 | I125: 1408.1457 | N125: 3X3 | O125: =+(E125+G125+I125)/(3) -> 1314.0964333333334
A126: 116 | B126: TEK CINAR INSAAT GOKHAN | C126: TR 46614 | D126: 139 | E126: 1361.3252 | F126: 190 | G126: 1281.4899 | H126: 242 | I126: 1297.6415999999999 | N126: 3X3 | O126: =+(E126+G126+I126)/(3) -> 1313.4855666666665
A127: 117 | B127: ONBASI POSTA | C127: TR 16864 | D127: 144 | E127: 1358.2497000000001 | F127: 243 | G127: 1257.5056999999999 | H127: 157 | I127: 1322.8759 | N127: 3X3 | O127: =+(E127+G127+I127)/(3) -> 1312.8770999999999
A128: 118 | B128: KIVILCIM 1 | C128: TR 90171 | D128: 186 | E128: 1345.6143 | F128: 157 | G128: 1284.5542 | H128: 222 | I128: 1307.3967 | N128: 3X3 | O128: =+(E128+G128+I128)/(3) -> 1312.5217333333333
A129: 119 | B129: MUHARREM IBRAHIM SEN KARDESLER | C129: TR 199904 | D129: 55 | E129: 1394.8978999999999 | F129: 140 | G129: 1286.4304 | H129: 317 | I129: 1255.9657999999999 | N129: 3X3 | O129: =+(E129+G129+I129)/(3) -> 1312.4313666666667
A130: 120 | B130: METIN GUMEC | C130: TR 96983 | D130: 193 | E130: 1344.9537 | F130: 191 | G130: 1281.3223 | H130: 208 | I130: 1310.9284 | N130: 3X3 | O130: =+(E130+G130+I130)/(3) -> 1312.4014666666665
A131: 121 | B131: TURGUTLU - TUR SUT MANDIRA | C131: TR 155033 | D131: 448 | E131: 1277.1066000000001 | F131: 34 | G131: 1340.2879 | H131: 180 | I131: 1319.3443 | N131: 3X3 | O131: =+(E131+G131+I131)/(3) -> 1312.2462666666668
A132: 122 | B132: GUNOL & FATIH AYAS YILMAZ | C132: TR 271554 | D132: 337 | E132: 1317.9802999999999 | F132: 105 | G132: 1296.4091000000001 | H132: 201 | I132: 1314.6808000000001 | N132: 3X3 | O132: =+(E132+G132+I132)/(3) -> 1309.6900666666668
A133: 123 | B133: BAYRAKLI ASMEL | C133: TR 216164 | D133: 309 | E133: 1326.9081000000001 | F133: 164 | G133: 1284.0936999999999 | H133: 192 | I133: 1317.9637 | N133: 3X3 | O133: =+(E133+G133+I133)/(3) -> 1309.6551666666667
A134: 124 | B134: BEYKOZ ARENA POSTA ORTAKLAR PIGEONS | C134: TR 137530 | D134: 416 | E134: 1289.1913999999999 | F134: 123 | G134: 1290.7737 | H134: 85 | I134: 1348.4894999999999 | N134: 3X3 | O134: =+(E134+G134+I134)/(3) -> 1309.4848666666667
A135: 125 | B135: ERKAN SIMSEK | C135: TR 82518 | D135: 3 | E135: 1423.9267 | F135: 298 | G135: 1184.9599000000001 | H135: 179 | I135: 1319.4564 | N135: 3X3 | O135: =+(E135+G135+I135)/(3) -> 1309.4476666666667
A136: 126 | B136: YUNUS CIRMAN | C136: TR 97708 | D136: 232 | E136: 1339.8510000000001 | F136: 180 | G136: 1282.7074 | H136: 227 | I136: 1305.5424 | N136: 3X3 | O136: =+(E136+G136+I136)/(3) -> 1309.3669333333335
A137: 127 | B137: YILDIRAY RECEP | C137: TR 96511 | D137: 294 | E137: 1329.0391 | F137: 143 | G137: 1285.9893 | H137: 205 | I137: 1312.1442 | N137: 3X3 | O137: =+(E137+G137+I137)/(3) -> 1309.0575333333334
A138: 128 | B138: MEHMET BULDUK | C138: TR 77320 | D138: 433 | E138: 1284.1668999999999 | F138: 88 | G138: 1302.7424000000001 | H138: 102 | I138: 1339.8661999999999 | N138: 3X3 | O138: =+(E138+G138+I138)/(3) -> 1308.9251666666667
A139: 129 | B139: MURAT OYNAR | C139: TR 212539 | D139: 112 | E139: 1371.7045000000001 | F139: 273 | G139: 1222.6697999999999 | H139: 132 | I139: 1330.7109 | N139: 3X3 | O139: =+(E139+G139+I139)/(3) -> 1308.3617333333334
A140: 130 | B140: MUSTAFA ENSOY | C140: TR 534 | D140: 354 | E140: 1311.2089000000001 | F140: 215 | G140: 1275.3882000000001 | H140: 109 | I140: 1336.6858 | N140: 3X3 | O140: =+(E140+G140+I140)/(3) -> 1307.7609666666667
A141: 131 | B141: MEZOPOTAMYA YEM | C141: TR 246074 | D141: 336 | E141: 1318.3770999999999 | F141: 218 | G141: 1274.1305 | H141: 136 | I141: 1330.3661999999999 | N141: 3X3 | O141: =+(E141+G141+I141)/(3) -> 1307.6245999999999
A142: 132 | B142: SINAN KARATAS | C142: TR 228704 | D142: 481 | E142: 1249.3077000000001 | F142: 152 | G142: 1284.8653999999999 | H142: 52 | I142: 1387.4466 | N142: 3X3 | O142: =+(E142+G142+I142)/(3) -> 1307.2065666666667
A143: 133 | B143: ONER KAHRAMAN | C143: TR 59029 | D143: 317 | E143: 1324.3162 | F143: 179 | G143: 1282.7228 | H143: 202 | I143: 1314.5381 | N143: 3X3 | O143: =+(E143+G143+I143)/(3) -> 1307.1923666666664
A144: 134 | B144: KAMET GIDA | C144: TR 49165 | D144: 343 | E144: 1316.0491999999999 | F144: 151 | G144: 1284.9943000000001 | H144: 171 | I144: 1320.4239 | N144: 3X3 | O144: =+(E144+G144+I144)/(3) -> 1307.1557999999998
A145: 135 | B145: ERCAN GUMUS | C145: TR 155015 | D145: 57 | E145: 1394.5543 | F145: 295 | G145: 1196.3824 | H145: 138 | I145: 1330.0256999999999 | N145: 3X3 | O145: =+(E145+G145+I145)/(3) -> 1306.9874666666667
A146: 136 | B146: ISMAIL UNALDI | C146: TR 98388 | D146: 346 | E146: 1314.7083 | F146: 139 | G146: 1286.7253000000001 | H146: 188 | I146: 1318.5009 | N146: 3X3 | O146: =+(E146+G146+I146)/(3) -> 1306.6448333333335
A147: 137 | B147: ISMAIL YUNUS TASCI | C147: TR 91611 | D147: 426 | E147: 1286.4991 | F147: 195 | G147: 1280.6267 | H147: 82 | I147: 1350.0287000000001 | N147: 3X3 | O147: =+(E147+G147+I147)/(3) -> 1305.7181666666665
A148: 138 | B148: ZAFER ZAFER | C148: TR 7055 | D148: 202 | E148: 1343.1984 | F148: 149 | G148: 1285.4933000000001 | H148: 268 | I148: 1287.7973 | N148: 3X3 | O148: =+(E148+G148+I148)/(3) -> 1305.4963333333335
A149: 139 | B149: ISMAIL TOLON | C149: TR 210558 | D149: 348 | E149: 1314.1208999999999 | F149: 197 | G149: 1280.3022000000001 | H149: 170 | I149: 1320.6392000000001 | N149: 3X3 | O149: =+(E149+G149+I149)/(3) -> 1305.0207666666668
A150: 140 | B150: MALAZGIRT BORU TEAM | C150: TR 90113 | D150: 89 | E150: 1380.7927 | F150: 154 | G150: 1284.8035 | H150: 322 | I150: 1247.9613999999999 | N150: 3X3 | O150: =+(E150+G150+I150)/(3) -> 1304.5192
A151: 141 | B151: ESREF METIN | C151: TR 57587 | D151: 428 | E151: 1285.0442 | F151: 45 | G151: 1339.6427000000001 | H151: 265 | I151: 1288.2699 | N151: 3X3 | O151: =+(E151+G151+I151)/(3) -> 1304.3189333333332
A152: 142 | B152: MUSTAFA ENSOY | C152: TR 557 | D152: 135 | E152: 1364.1293000000001 | F152: 244 | G152: 1256.7978000000001 | H152: 253 | I152: 1291.8897999999999 | N152: 3X3 | O152: =+(E152+G152+I152)/(3) -> 1304.2722999999999
A153: 143 | B153: ONBASI POSTA | C153: TR 16876 | D153: 291 | E153: 1329.2569000000001 | F153: 220 | G153: 1272.4063000000001 | H153: 209 | I153: 1310.8776 | N153: 3X3 | O153: =+(E153+G153+I153)/(3) -> 1304.1802666666665
A154: 144 | B154: NAZIM AKUZUM | C154: TR 148835 | D154: 326 | E154: 1320.7452000000001 | F154: 162 | G154: 1284.2827 | H154: 224 | I154: 1307.1415999999999 | N154: 3X3 | O154: =+(E154+G154+I154)/(3) -> 1304.0564999999999
A155: 145 | B155: YUSUF KARAKURT | C155: TR 27165 | D155: 302 | E155: 1327.6597999999999 | F155: 228 | G155: 1262.5117 | H155: 165 | I155: 1321.4866999999999 | N155: 3X3 | O155: =+(E155+G155+I155)/(3) -> 1303.8860666666667
A156: 146 | B156: BESIR TEYFIK | C156: TR 219010 | D156: 260 | E156: 1335.3897999999999 | F156: 203 | G156: 1279.4217000000001 | H156: 249 | I156: 1296.3176000000001 | N156: 3X3 | O156: =+(E156+G156+I156)/(3) -> 1303.7097000000001
A157: 147 | B157: SAMPIYON POSTA 46 | C157: TR 517 | D157: 509 | E157: 1199.5514000000001 | F157: 68 | G157: 1313.0934999999999 | H157: 44 | I157: 1398.2651000000001 | N157: 3X3 | O157: =+(E157+G157+I157)/(3) -> 1303.6366666666668
A158: 148 | B158: IHSAN SARIYER | C158: TR 90177 | D158: 225 | E158: 1340.89 | F158: 84 | G158: 1304.8194000000001 | H158: 307 | I158: 1263.3658 | N158: 3X3 | O158: =+(E158+G158+I158)/(3) -> 1303.0250666666668
A159: 149 | B159: TAMER ERHAN YAY | C159: TR 95409 | D159: 159 | E159: 1351.7684999999999 | F159: 238 | G159: 1259.2393 | H159: 248 | I159: 1296.7225000000001 | N159: 3X3 | O159: =+(E159+G159+I159)/(3) -> 1302.5767666666668
A160: 150 | B160: HIMER GIDA | C160: TR 64406 | D160: 266 | E160: 1334.5818999999999 | F160: 113 | G160: 1292.461 | H160: 280 | I160: 1280.6469999999999 | N160: 3X3 | O160: =+(E160+G160+I160)/(3) -> 1302.5633
A161: 151 | B161: CAG KARDESLER | C161: TR 162284 | D161: 272 | E161: 1333.2384999999999 | F161: 247 | G161: 1254.3199 | H161: 182 | I161: 1318.7999 | N161: 3X3 | O161: =+(E161+G161+I161)/(3) -> 1302.1194333333333
A162: 152 | B162: SULEYMAN OZTURK | C162: TR 212450 | D162: 195 | E162: 1344.6794 | F162: 109 | G162: 1293.5302999999999 | H162: 304 | I162: 1264.9991 | N162: 3X3 | O162: =+(E162+G162+I162)/(3) -> 1301.0696
A163: 153 | B163: UC KARDESLER | C163: TR 78803 | D163: 415 | E163: 1290.4697000000001 | F163: 173 | G163: 1283.3263999999999 | H163: 149 | I163: 1325.8829000000001 | N163: 3X3 | O163: =+(E163+G163+I163)/(3) -> 1299.893
A164: 154 | B164: KIVANC KARDESLER | C164: TR 170441 | D164: 276 | E164: 1332.1492000000001 | F164: 205 | G164: 1278.8984 | H164: 264 | I164: 1288.3264999999999 | N164: 3X3 | O164: =+(E164+G164+I164)/(3) -> 1299.7913666666666
A165: 155 | B165: FIRAT TIMURTAS | C165: TR 98601 | D165: 331 | E165: 1319.8213000000001 | F165: 242 | G165: 1257.5222000000001 | H165: 166 | I165: 1321.1401000000001 | N165: 3X3 | O165: =+(E165+G165+I165)/(3) -> 1299.4945333333333
A166: 156 | B166: HALIL TANSEL HOCA | C166: TR 114006 | D166: 235 | E166: 1339.7521999999999 | F166: 224 | G166: 1266.5994000000001 | H166: 254 | I166: 1291.6749 | N166: 3X3 | O166: =+(E166+G166+I166)/(3) -> 1299.3421666666666
A167: 157 | B167: GULUM KARDESLER | C167: TR 258022 | D167: 213 | E167: 1342.393 | F167: 249 | G167: 1253.7760000000001 | H167: 234 | I167: 1301.6532 | N167: 3X3 | O167: =+(E167+G167+I167)/(3) -> 1299.2740666666666
A168: 158 | B168: BACO FARUK YILDIZ | C168: TR 78509 | D168: 456 | E168: 1272.8152 | F168: 183 | G168: 1282.4948999999999 | H168: 96 | I168: 1341.1186 | N168: 3X3 | O168: =+(E168+G168+I168)/(3) -> 1298.8095666666666
A169: 159 | B169: MEHMET TUNCAY | C169: TR 135275 | D169: 413 | E169: 1290.8722 | F169: 141 | G169: 1286.2374 | H169: 181 | I169: 1318.9093 | N169: 3X3 | O169: =+(E169+G169+I169)/(3) -> 1298.6729666666668
A170: 160 | B170: NECO YILDIZ | C170: TR 95020 | D170: 277 | E170: 1332.0072 | F170: 237 | G170: 1259.4326000000001 | H170: 231 | I170: 1302.9367 | N170: 3X3 | O170: =+(E170+G170+I170)/(3) -> 1298.1255000000001
A171: 161 | B171: KADIR CAN | C171: TR 272235 | D171: 52 | E171: 1395.5436 | F171: 246 | G171: 1254.5707 | H171: 330 | I171: 1243.1357 | N171: 3X3 | O171: =+(E171+G171+I171)/(3) -> 1297.75
A172: 162 | B172: NIYAZI AYDIN | C172: TR 157562 | D172: 504 | E172: 1203.9585999999999 | F172: 22 | G172: 1349.8843999999999 | H172: 105 | I172: 1338.9570000000001 | N172: 3X3 | O172: =+(E172+G172+I172)/(3) -> 1297.6
A173: 163 | B173: NEVZAT CILENTI | C173: TR 270310 | D173: 172 | E173: 1347.9511 | F173: 226 | G173: 1264.7004999999999 | H173: 283 | I173: 1275.1849 | N173: 3X3 | O173: =+(E173+G173+I173)/(3) -> 1295.9455
A174: 164 | B174: TEAM KGY | C174: TR 226884 | D174: 408 | E174: 1292.8945000000001 | F174: 136 | G174: 1287.2550000000001 | H174: 226 | I174: 1305.8059000000001 | N174: 3X3 | O174: =+(E174+G174+I174)/(3) -> 1295.3184666666668
A175: 165 | B175: ARIF KARADAGLAR BULENT SAFAK CIT | C175: TR 113013 | D175: 286 | E175: 1329.8786 | F175: 254 | G175: 1250.3403000000001 | H175: 228 | I175: 1305.4766 | N175: 3X3 | O175: =+(E175+G175+I175)/(3) -> 1295.2318333333333
A176: 166 | B176: ERCAN KOC | C176: TR 74602 | D176: 475 | E176: 1257.3897999999999 | F176: 148 | G176: 1285.4951000000001 | H176: 93 | I176: 1342.6410000000001 | N176: 3X3 | O176: =+(E176+G176+I176)/(3) -> 1295.1753000000001
A177: 167 | B177: TEK ATAR ETEM | C177: TR 33426 | D177: 32 | E177: 1402.5442 | F177: 71 | G177: 1310.1759999999999 | H177: 354 | I177: 1168.7715000000001 | N177: 3X3 | O177: =+(E177+G177+I177)/(3) -> 1293.8305666666665
A178: 168 | B178: FIRAT TIMURTAS | C178: TR 98607 | D178: 358 | E178: 1310.5473 | F178: 73 | G178: 1307.2162000000001 | H178: 309 | I178: 1261.9973 | N178: 3X3 | O178: =+(E178+G178+I178)/(3) -> 1293.2536
A179: 169 | B179: MAHMUT MADEN | C179: TR 162342 | D179: 443 | E179: 1280.6748 | F179: 194 | G179: 1280.9582 | H179: 193 | I179: 1317.6441 | N179: 3X3 | O179: =+(E179+G179+I179)/(3) -> 1293.0923666666665
A180: 170 | B180: HIMER GIDA | C180: TR 64404 | D180: 251 | E180: 1336.7285999999999 | F180: 248 | G180: 1253.9087 | H180: 271 | I180: 1287.0716 | N180: 3X3 | O180: =+(E180+G180+I180)/(3) -> 1292.5696333333333
A181: 171 | B181: KASAP OSMAN | C181: TR 66505 | D181: 169 | E181: 1349.2272 | F181: 293 | G181: 1197.8842 | H181: 141 | I181: 1329.2382 | N181: 3X3 | O181: =+(E181+G181+I181)/(3) -> 1292.1165333333331
A182: 172 | B182: SELAHADDIN BAKAR | C182: TR 21142 | D182: 421 | E182: 1288.5436 | F182: 49 | G182: 1339.1475 | H182: 326 | I182: 1245.5451 | N182: 3X3 | O182: =+(E182+G182+I182)/(3) -> 1291.0787333333335
A183: 173 | B183: FATIH ISMAIL OZPIRINCI | C183: TR 113108 | D183: 453 | E183: 1274.1206999999999 | F183: 202 | G183: 1279.4558 | H183: 184 | I183: 1318.7458999999999 | N183: 3X3 | O183: =+(E183+G183+I183)/(3) -> 1290.7741333333333
A184: 174 | B184: SANATCI HACI SEVINC | C184: TR 246713 | D184: 502 | E184: 1205.3905 | F184: 64 | G184: 1317.3441 | H184: 88 | I184: 1348.2334000000001 | N184: 3X3 | O184: =+(E184+G184+I184)/(3) -> 1290.3226666666667
A185: 175 | B185: BOYACI BERBER | C185: TR 95790 | D185: 216 | E185: 1342.0327 | F185: 297 | G185: 1185.1413 | H185: 104 | I185: 1339.1267 | N185: 3X3 | O185: =+(E185+G185+I185)/(3) -> 1288.7668999999999
A186: 176 | B186: OMER DURAK MAHMUT AKKOYUN | C186: TR 222468 | D186: 507 | E186: 1203.4853000000001 | F186: 167 | G186: 1283.922 | H186: 65 | I186: 1378.3957 | N186: 3X3 | O186: =+(E186+G186+I186)/(3) -> 1288.6009999999999
A187: 177 | B187: RECEP OZTURK | C187: TR 225094 | D187: 496 | E187: 1223.2191 | F187: 77 | G187: 1306.1953000000001 | H187: 112 | I187: 1336.0824 | N187: 3X3 | O187: =+(E187+G187+I187)/(3) -> 1288.4989333333333
A188: 178 | B188: HALIL TANSEL HOCA | C188: TR 114003 | D188: 441 | E188: 1281.3422 | F188: 177 | G188: 1282.9131 | H188: 237 | I188: 1300.6668999999999 | N188: 3X3 | O188: =+(E188+G188+I188)/(3) -> 1288.3073999999999
A189: 179 | B189: TRAKYA POSTA OGUN CEM KOSE | C189: TR 207083 | D189: 269 | E189: 1333.5673999999999 | F189: 352 | G189: 1120.6207999999999 | H189: 15 | I189: 1409.8949 | N189: 3X3 | O189: =+(E189+G189+I189)/(3) -> 1288.0276999999999
A190: 180 | B190: MURAT OYNAR | C190: TR 212528 | D190: 299 | E190: 1328.2447 | F190: 199 | G190: 1280.0631000000001 | H190: 318 | I190: 1255.7388000000001 | N190: 3X3 | O190: =+(E190+G190+I190)/(3) -> 1288.0155333333335
A191: 181 | B191: FERIT DEMIR | C191: TR 92723 | D191: 518 | E191: 1162.1826000000001 | F191: 24 | G191: 1349.5219999999999 | H191: 86 | I191: 1348.3215 | N191: 3X3 | O191: =+(E191+G191+I191)/(3) -> 1286.6753666666666
A192: 182 | B192: BOYABATLI SAIM | C192: TR 37951 | D192: 423 | E192: 1287.2084 | F192: 223 | G192: 1267.0424 | H192: 240 | I192: 1299.7934 | N192: 3X3 | O192: =+(E192+G192+I192)/(3) -> 1284.6813999999999
A193: 183 | B193: MUSTAFA HALIL IBO TEAM | C193: TR 65601 | D193: 495 | E193: 1228.5893000000001 | F193: 85 | G193: 1304.3514 | H193: 168 | I193: 1321.0039999999999 | N193: 3X3 | O193: =+(E193+G193+I193)/(3) -> 1284.6482333333333
A194: 184 | B194: SINAN KARATAS | C194: TR 228706 | D194: 483 | E194: 1246.8309999999999 | F194: 266 | G194: 1232.7479000000001 | H194: 75 | I194: 1369.4665 | N194: 3X3 | O194: =+(E194+G194+I194)/(3) -> 1283.0151333333333
A195: 185 | B195: UMUT YILMAZ | C195: TR 99601 | D195: 14 | E195: 1410.4671000000001 | F195: 353 | G195: 1109.5546999999999 | H195: 142 | I195: 1328.9946 | N195: 3X3 | O195: =+(E195+G195+I195)/(3) -> 1283.0054666666667
A196: 186 | B196: SURETLI KARDESLER | C196: TR 114206 | D196: 429 | E196: 1285.0360000000001 | F196: 251 | G196: 1251.1795 | H196: 217 | I196: 1309.0083 | N196: 3X3 | O196: =+(E196+G196+I196)/(3) -> 1281.7412666666667
A197: 187 | B197: KAMET GIDA | C197: TR 49174 | D197: 446 | E197: 1277.7483999999999 | F197: 212 | G197: 1276.6958999999999 | H197: 277 | I197: 1285.3056999999999 | N197: 3X3 | O197: =+(E197+G197+I197)/(3) -> 1279.9166666666667
A198: 188 | B198: BOYABATLI SAIM | C198: TR 37947 | D198: 151 | E198: 1356.9073000000001 | F198: 333 | G198: 1162.0278000000001 | H198: 175 | I198: 1319.6687999999999 | N198: 3X3 | O198: =+(E198+G198+I198)/(3) -> 1279.5346333333334
A199: 189 | B199: BILAL AYSEN OZDEMIR | C199: TR 90730 | D199: 226 | E199: 1340.86 | F199: 322 | G199: 1173.9673 | H199: 161 | I199: 1321.9538 | N199: 3X3 | O199: =+(E199+G199+I199)/(3) -> 1278.9270333333334
A200: 190 | B200: KENAN SIMSEK | C200: TR 137959 | D200: 319 | E200: 1323.9392 | F200: 277 | G200: 1221.9384 | H200: 257 | I200: 1290.7792999999999 | N200: 3X3 | O200: =+(E200+G200+I200)/(3) -> 1278.8856333333333
A201: 191 | B201: DEVRIM AZMAN | C201: TR 76681 | D201: 450 | E201: 1276.9843000000001 | F201: 102 | G201: 1296.5771999999999 | H201: 308 | I201: 1262.4536000000001 | N201: 3X3 | O201: =+(E201+G201+I201)/(3) -> 1278.6716999999999
A202: 192 | B202: HUSEYIN NURCAN | C202: TR 163941 | D202: 191 | E202: 1345.3910000000001 | F202: 117 | G202: 1292.0418 | H202: 349 | I202: 1195.5363 | N202: 3X3 | O202: =+(E202+G202+I202)/(3) -> 1277.6563666666668
A203: 193 | B203: ISIK PETROL | C203: TR 166001 | D203: 438 | E203: 1282.1252999999999 | F203: 253 | G203: 1250.7784999999999 | H203: 238 | I203: 1299.8880999999999 | N203: 3X3 | O203: =+(E203+G203+I203)/(3) -> 1277.5973000000001
A204: 194 | B204: NATURAL YEM | C204: TR 73336 | D204: 120 | E204: 1369.4159 | F204: 214 | G204: 1275.6712 | H204: 352 | I204: 1186.9595999999999 | N204: 3X3 | O204: =+(E204+G204+I204)/(3) -> 1277.3489
A205: 195 | B205: F.CANKAYA E.ALTAN E.FIDAN | C205: TR 202155 | D205: 375 | E205: 1304.6626000000001 | F205: 200 | G205: 1279.8891000000001 | H205: 327 | I205: 1245.357 | N205: 3X3 | O205: =+(E205+G205+I205)/(3) -> 1276.6362333333334
A206: 196 | B206: SOSYETE KUAFOR | C206: TR 163158 | D206: 219 | E206: 1341.4926 | F206: 328 | G206: 1167.8008 | H206: 174 | I206: 1319.8495 | N206: 3X3 | O206: =+(E206+G206+I206)/(3) -> 1276.3809666666666
A207: 197 | B207: F.CANKAYA E.ALTAN E.FIDAN | C207: TR 202141 | D207: 525 | E207: 1107.0376000000001 | F207: 44 | G207: 1339.71 | H207: 57 | I207: 1380.6967999999999 | N207: 3X3 | O207: =+(E207+G207+I207)/(3) -> 1275.8148000000001
A208: 198 | B208: KOSAVALI SALIH YILMAZ | C208: TR 93703 | D208: 217 | E208: 1341.9395999999999 | F208: 274 | G208: 1222.5156999999999 | H208: 311 | I208: 1261.116 | N208: 3X3 | O208: =+(E208+G208+I208)/(3) -> 1275.1904333333332
A209: 199 | B209: MURAT OYNAR | C209: TR 202 | D209: 184 | E209: 1345.8558 | F209: 269 | G209: 1230.5845999999999 | H209: 321 | I209: 1248.3579999999999 | N209: 3X3 | O209: =+(E209+G209+I209)/(3) -> 1274.9327999999998
A210: 200 | B210: BAYRAM KARDESLER | C210: TR 92811 | D210: 2 | E210: 1424.3864000000001 | F210: 347 | G210: 1124.4009000000001 | H210: 284 | I210: 1275.0445 | N210: 3X3 | O210: =+(E210+G210+I210)/(3) -> 1274.6106
A211: 201 | B211: KADRI VATANSEVER | C211: DV 382 | D211: 152 | E211: 1356.7018 | F211: 79 | G211: 1306.1047000000001 | H211: 359 | I211: 1160.0041000000001 | N211: 3X3 | O211: =+(E211+G211+I211)/(3) -> 1274.2702000000002
A212: 202 | B212: ISMAIL MURAT OLGUNER | C212: TR 271968 | D212: 133 | E212: 1364.3216 | F212: 229 | G212: 1262.4369999999999 | H212: 348 | I212: 1195.9425000000001 | N212: 3X3 | O212: =+(E212+G212+I212)/(3) -> 1274.2337
A213: 203 | B213: DADAS 1453 | C213: TR 51812 | D213: 72 | E213: 1388.6959999999999 | F213: 348 | G213: 1123.9322999999999 | H213: 216 | I213: 1309.1965 | N213: 3X3 | O213: =+(E213+G213+I213)/(3) -> 1273.9415999999999
A214: 204 | B214: ZAFER ZAFER | C214: TR 7060 | D214: 306 | E214: 1327.0197000000001 | F214: 264 | G214: 1233.4338 | H214: 313 | I214: 1260.0145 | N214: 3X3 | O214: =+(E214+G214+I214)/(3) -> 1273.4893333333332
A215: 205 | B215: SURETLI KARDESLER | C215: TR 114212 | D215: 383 | E215: 1302.4762000000001 | F215: 267 | G215: 1230.6998000000001 | H215: 270 | I215: 1287.1155000000001 | N215: 3X3 | O215: =+(E215+G215+I215)/(3) -> 1273.4305000000002
A216: 206 | B216: TURGUTLU - TUR SUT MANDIRA | C216: TR 155029 | D216: 357 | E216: 1310.7991999999999 | F216: 260 | G216: 1236.5428999999999 | H216: 291 | I216: 1271.789 | N216: 3X3 | O216: =+(E216+G216+I216)/(3) -> 1273.0436999999999
A217: 207 | B217: NECIP YILDIZ | C217: TR 73257 | D217: 63 | E217: 1393.8901000000001 | F217: 355 | G217: 1092.7233000000001 | H217: 127 | I217: 1331.2544 | N217: 3X3 | O217: =+(E217+G217+I217)/(3) -> 1272.6225999999999
A218: 208 | B218: IMAMOGLU | C218: TR 93464 | D218: 267 | E218: 1333.8343 | F218: 10 | G218: 1361.3449000000001 | H218: 364 | I218: 1120.511 | N218: 3X3 | O218: =+(E218+G218+I218)/(3) -> 1271.8967333333333
A219: 209 | B219: ONBASI POSTA | C219: TR 16871 | D219: 356 | E219: 1310.9482 | F219: 182 | G219: 1282.6027999999999 | H219: 338 | I219: 1217.8064999999999 | N219: 3X3 | O219: =+(E219+G219+I219)/(3) -> 1270.4525000000001
A220: 210 | B220: FESIH UNAL | C220: TR 127506 | D220: 389 | E220: 1299.9816000000001 | F220: 292 | G220: 1197.9604999999999 | H220: 206 | I220: 1311.9434000000001 | N220: 3X3 | O220: =+(E220+G220+I220)/(3) -> 1269.9618333333335
A221: 211 | B221: ALPAY NIHAT | C221: TR 135101 | D221: 97 | E221: 1378.2236 | F221: 363 | G221: 1050.7674 | H221: 60 | I221: 1379.7529999999999 | N221: 3X3 | O221: =+(E221+G221+I221)/(3) -> 1269.5813333333333
A222: 212 | B222: MURAT OYNAR | C222: TR 212511 | D222: 506 | E222: 1203.8113000000001 | F222: 207 | G222: 1278.3789999999999 | H222: 148 | I222: 1326.0853999999999 | N222: 3X3 | O222: =+(E222+G222+I222)/(3) -> 1269.4252333333334
A223: 213 | B223: MEHMET BULDUK | C223: TR 77309 | D223: 524 | E223: 1107.2275999999999 | F223: 12 | G223: 1360.5404000000001 | H223: 106 | I223: 1338.4966999999999 | N223: 3X3 | O223: =+(E223+G223+I223)/(3) -> 1268.7548999999999
A224: 214 | B224: SANATCI HACI SEVINC | C224: TR 64028 | D224: 405 | E224: 1293.53 | F224: 219 | G224: 1273.3683000000001 | H224: 335 | I224: 1234.2228 | N224: 3X3 | O224: =+(E224+G224+I224)/(3) -> 1267.0403666666666
A225: 215 | B225: BURHAN BILIR | C225: TR 271502 | D225: 368 | E225: 1307.3462 | F225: 323 | G225: 1173.4808 | H225: 178 | I225: 1319.5065 | N225: 3X3 | O225: =+(E225+G225+I225)/(3) -> 1266.7778333333333
A226: 216 | B226: SULEYMAN OZTURK | C226: TR 212441 | D226: 387 | E226: 1300.5987 | F226: 270 | G226: 1229.4042999999999 | H226: 297 | I226: 1269.7557999999999 | N226: 3X3 | O226: =+(E226+G226+I226)/(3) -> 1266.5862666666665
A227: 217 | B227: SERKAN AYDOGAN | C227: TR 155103 | D227: 463 | E227: 1270.1692 | F227: 289 | G227: 1198.3149000000001 | H227: 143 | I227: 1328.9572000000001 | N227: 3X3 | O227: =+(E227+G227+I227)/(3) -> 1265.8137666666669
A228: 218 | B228: SEZER KULTUK | C228: TR 232872 | D228: 484 | E228: 1245.3714 | F228: 268 | G228: 1230.5878 | H228: 185 | I228: 1318.655 | N228: 3X3 | O228: =+(E228+G228+I228)/(3) -> 1264.8714
A229: 219 | B229: SAMPIYON GOKHAN TUNCA MIKI | C229: TR 42822 | D229: 513 | E229: 1189.5816 | F229: 120 | G229: 1291.6576 | H229: 211 | I229: 1310.5015000000001 | N229: 3X3 | O229: =+(E229+G229+I229)/(3) -> 1263.9135666666668
A230: 220 | B230: ELEKTRIKCI OZCAN | C230: TR 188646 | D230: 222 | E230: 1341.2257 | F230: 315 | G230: 1176.2745 | H230: 289 | I230: 1272.2891999999999 | N230: 3X3 | O230: =+(E230+G230+I230)/(3) -> 1263.2631333333331
A231: 221 | B231: ERCAN KOC | C231: TR 74607 | D231: 376 | E231: 1304.0473 | F231: 343 | G231: 1139.0251000000001 | H231: 91 | I231: 1345.127 | N231: 3X3 | O231: =+(E231+G231+I231)/(3) -> 1262.7331333333334
A232: 222 | B232: BABUSLAR | C232: TR 85709 | D232: 318 | E232: 1324.0707 | F232: 106 | G232: 1296.2304999999999 | H232: 356 | I232: 1167.8842 | N232: 3X3 | O232: =+(E232+G232+I232)/(3) -> 1262.7284666666667
A233: 223 | B233: FETIH 1454 | C233: TR 210557 | D233: 382 | E233: 1303.0108 | F233: 283 | G233: 1212.8516999999999 | H233: 295 | I233: 1269.9450999999999 | N233: 3X3 | O233: =+(E233+G233+I233)/(3) -> 1261.9358666666667
A234: 224 | B234: IHSAN SARIYER | C234: TR 90131 | D234: 332 | E234: 1319.0581999999999 | F234: 341 | G234: 1141.3788 | H234: 159 | I234: 1322.5751 | N234: 3X3 | O234: =+(E234+G234+I234)/(3) -> 1261.0040333333334
A235: 225 | B235: KARA MURAT | C235: TR 90160 | D235: 527 | E235: 1100.5903000000001 | F235: 201 | G235: 1279.5239999999999 | H235: 48 | I235: 1396.0438999999999 | N235: 3X3 | O235: =+(E235+G235+I235)/(3) -> 1258.7194
A236: 226 | B236: OMER DURAK MAHMUT AKKOYUN | C236: TR 222467 | D236: 359 | E236: 1309.489 | F236: 284 | G236: 1206.3969 | H236: 315 | I236: 1258.0043000000001 | N236: 3X3 | O236: =+(E236+G236+I236)/(3) -> 1257.9634000000001
A237: 227 | B237: YUSUF KARAKURT | C237: TR 27216 | D237: 28 | E237: 1403.7879 | F237: 365 | G237: 1050.0123000000001 | H237: 176 | I237: 1319.6186 | N237: 3X3 | O237: =+(E237+G237+I237)/(3) -> 1257.8062666666667
A238: 228 | B238: HUSEYIN NURCAN | C238: TR 163946 | D238: 412 | E238: 1291.3668 | F238: 296 | G238: 1185.2496000000001 | H238: 247 | I238: 1296.7874999999999 | N238: 3X3 | O238: =+(E238+G238+I238)/(3) -> 1257.8012999999999
A239: 229 | B239: ZABITA MURAT | C239: TR 93681 | D239: 325 | E239: 1320.7800999999999 | F239: 317 | G239: 1175.5702000000001 | H239: 286 | I239: 1273.8878 | N239: 3X3 | O239: =+(E239+G239+I239)/(3) -> 1256.7460333333333
A240: 230 | B240: MESUT ATMACA | C240: TR 170567 | D240: 231 | E240: 1339.9407000000001 | F240: 335 | G240: 1157.9952000000001 | H240: 296 | I240: 1269.9292 | N240: 3X3 | O240: =+(E240+G240+I240)/(3) -> 1255.9550333333334
A241: 231 | B241: DADAS 1454 | C241: TR 51813 | D241: 223 | E241: 1341.0698 | F241: 327 | G241: 1170.3792000000001 | H241: 328 | I241: 1244.6255000000001 | N241: 3X3 | O241: =+(E241+G241+I241)/(3) -> 1252.0248333333334
A242: 232 | B242: MEKKELI MEHMET GUCLU | C242: TR 92213 | D242: 431 | E242: 1284.626 | F242: 320 | G242: 1174.6438000000001 | H242: 251 | I242: 1295.2655999999999 | N242: 3X3 | O242: =+(E242+G242+I242)/(3) -> 1251.5118
A243: 233 | B243: TEAM OZKAN EYMEN | C243: TR 16217 | D243: 512 | E243: 1191.6537000000001 | F243: 165 | G243: 1284.0283999999999 | H243: 300 | I243: 1269.2893999999999 | N243: 3X3 | O243: =+(E243+G243+I243)/(3) -> 1248.3238333333331
A244: 234 | B244: KENAN YIRAL | C244: TR 272201 | D244: 401 | E244: 1294.6772000000001 | F244: 312 | G244: 1176.7806 | H244: 290 | I244: 1272.1531 | N244: 3X3 | O244: =+(E244+G244+I244)/(3) -> 1247.8703
A245: 235 | B245: MELIH CAGAN TEZCAN | C245: TR 88849 | D245: 402 | E245: 1294.4146000000001 | F245: 287 | G245: 1199.3118999999999 | H245: 320 | I245: 1248.5150000000001 | N245: 3X3 | O245: =+(E245+G245+I245)/(3) -> 1247.4138333333333
A246: 236 | B246: CAKIR NIHAT | C246: TR 95502 | D246: 178 | E246: 1347.2308 | F246: 358 | G246: 1086.4792 | H246: 218 | I246: 1308.3855000000001 | N246: 3X3 | O246: =+(E246+G246+I246)/(3) -> 1247.3651666666667
A247: 237 | B247: SEYIT MUSTAFA YILDIZ | C247: TR 93206 | D247: 274 | E247: 1332.5516 | F247: 360 | G247: 1075.7134000000001 | H247: 116 | I247: 1333.2889 | N247: 3X3 | O247: =+(E247+G247+I247)/(3) -> 1247.1846333333335
A248: 238 | B248: YILDIRAY RECEP | C248: TR 96506 | D248: 410 | E248: 1292.4014999999999 | F248: 290 | G248: 1198.2491 | H248: 323 | I248: 1247.3576 | N248: 3X3 | O248: =+(E248+G248+I248)/(3) -> 1246.0027333333335
A249: 239 | B249: MUSTAFA YILDIRIM | C249: TR 64203 | D249: 154 | E249: 1354.57 | F249: 362 | G249: 1051.2874999999999 | H249: 135 | I249: 1330.4358999999999 | N249: 3X3 | O249: =+(E249+G249+I249)/(3) -> 1245.4311333333333
A250: 240 | B250: 15 RECION FRANCE OZKAN KRDSLR | C250: FR 148803 | D250: 289 | E250: 1329.3777 | F250: 354 | G250: 1109.1585 | H250: 274 | I250: 1286.0156999999999 | N250: 3X3 | O250: =+(E250+G250+I250)/(3) -> 1241.5173
A251: 241 | B251: METIN GUMEC | C251: TR 96984 | D251: 385 | E251: 1300.7791999999999 | F251: 344 | G251: 1135.6848 | H251: 269 | I251: 1287.5963999999999 | N251: 3X3 | O251: =+(E251+G251+I251)/(3) -> 1241.3534666666667
A252: 242 | B252: SALIH CALISKAN | C252: TR 115513 | D252: 449 | E252: 1277.0441000000001 | F252: 321 | G252: 1174.3535999999999 | H252: 287 | I252: 1272.5651 | N252: 3X3 | O252: =+(E252+G252+I252)/(3) -> 1241.3209333333334
A253: 243 | B253: FATIH ISMAIL OZPIRINCI | C253: TR 113102 | D253: 395 | E253: 1297.9456 | F253: 336 | G253: 1151.5057999999999 | H253: 302 | I253: 1266.0632000000001 | N253: 3X3 | O253: =+(E253+G253+I253)/(3) -> 1238.5048666666667
A254: 244 | B254: LEVENT BACAKOGLU | C254: TR 272026 | D254: 399 | E254: 1295.8655000000001 | F254: 233 | G254: 1260.6548 | H254: 360 | I254: 1151.3412000000001 | N254: 3X3 | O254: =+(E254+G254+I254)/(3) -> 1235.9538333333333
A255: 245 | B255: HUSEYIN DEMIR KIRAZ | C255: TR 162108 | D255: 173 | E255: 1347.8571999999999 | F255: 357 | G255: 1089.3098 | H255: 294 | I255: 1270.3692000000001 | N255: 3X3 | O255: =+(E255+G255+I255)/(3) -> 1235.8453999999999
A256: 246 | B256: ALPAY GULER | C256: TR 135703 | D256: 329 | E256: 1320.4109000000001 | F256: 330 | G256: 1166.4571000000001 | H256: 337 | I256: 1220.0565999999999 | N256: 3X3 | O256: =+(E256+G256+I256)/(3) -> 1235.6415333333334
A257: 247 | B257: BULENT SAFAK CIT | C257: TR 115875 | D257: 425 | E257: 1286.9571000000001 | F257: 361 | G257: 1070.3879999999999 | H257: 87 | I257: 1348.3200999999999 | N257: 3X3 | O257: =+(E257+G257+I257)/(3) -> 1235.2217333333333
A258: 248 | B258: TAMER SEMERCILER | C258: TR 172009 | D258: 196 | E258: 1344.5740000000001 | F258: 368 | G258: 1016.1569 | H258: 92 | I258: 1342.671 | N258: 3X3 | O258: =+(E258+G258+I258)/(3) -> 1234.4673
A259: 249 | B259: MURAT OYNAR | C259: TR 212533 | D259: 511 | E259: 1195.3453 | F259: 265 | G259: 1232.7637999999999 | H259: 293 | I259: 1271.0737999999999 | N259: 3X3 | O259: =+(E259+G259+I259)/(3) -> 1233.0609666666667
A260: 250 | B260: KASAP OSMAN | C260: TR 66508 | D260: 161 | E260: 1351.3543999999999 | F260: 303 | G260: 1182.1146000000001 | H260: 357 | I260: 1163.8087 | N260: 3X3 | O260: =+(E260+G260+I260)/(3) -> 1232.4259
A261: 251 | B261: BILGIN KASAP KACAK | C261: TR 1099 | D261: 384 | E261: 1302.3743999999999 | F261: 350 | G261: 1122.3909000000001 | H261: 288 | I261: 1272.3259 | N261: 3X3 | O261: =+(E261+G261+I261)/(3) -> 1232.3637333333334
A262: 252 | B262: ENGIN KAPTAN | C262: TR 270408 | D262: 284 | E262: 1330.6070999999999 | F262: 367 | G262: 1045.64 | H262: 172 | I262: 1320.1294 | N262: 3X3 | O262: =+(E262+G262+I262)/(3) -> 1232.1255000000001
A263: 253 | B263: GUNEY KEBAP MURAT YILDIRIM | C263: TR 102413 | D263: 236 | E263: 1339.6745000000001 | F263: 397 | G263: 956.49639999999999 | H263: 43 | I263: 1398.3879999999999 | N263: 3X3 | O263: =+(E263+G263+I263)/(3) -> 1231.5196333333333
A264: 254 | B264: SERDAR AYDIN EGE POSTA | C264: TR 141868 | D264: 520 | E264: 1148.0968 | F264: 245 | G264: 1256.0791999999999 | H264: 266 | I264: 1288.2095999999999 | N264: 3X3 | O264: =+(E264+G264+I264)/(3) -> 1230.7951999999998
A265: 255 | B265: KASAP AHMET | C265: TR 158113 | D265: 414 | E265: 1290.6557 | F265: 305 | G265: 1181.2070000000001 | H265: 341 | I265: 1211.8530000000001 | N265: 3X3 | O265: =+(E265+G265+I265)/(3) -> 1227.9052333333334
A266: 256 | B266: HUSEYIN NURCAN | C266: TR 163943 | D266: 79 | E266: 1386.7221 | F266: 377 | G266: 992.32809999999995 | H266: 236 | I266: 1300.7515000000001 | N266: 3X3 | O266: =+(E266+G266+I266)/(3) -> 1226.6005666666667
A267: 257 | B267: EMRE KARAN | C267: TR 93584 | D267: 305 | E267: 1327.1283000000001 | F267: 163 | G267: 1284.1487 | H267: 371 | I267: 1067.6925000000001 | N267: 3X3 | O267: =+(E267+G267+I267)/(3) -> 1226.3231666666668
A268: 258 | B268: TAMER ERHAN YAY | C268: TR 95407 | D268: 149 | E268: 1357.5920000000001 | F268: 376 | G268: 993.00760000000002 | H268: 194 | I268: 1317.5796 | N268: 3X3 | O268: =+(E268+G268+I268)/(3) -> 1222.7264
A269: 259 | B269: NECO YILDIZ | C269: TR 95018 | D269: 459 | E269: 1272.3995 | F269: 240 | G269: 1258.2655999999999 | H269: 362 | I269: 1134.6776 | N269: 3X3 | O269: =+(E269+G269+I269)/(3) -> 1221.7809
A270: 260 | B270: FERIT DEMIR | C270: TR 92722 | D270: 11 | E270: 1410.8716999999999 | F270: 399 | G270: 955.13930000000005 | H270: 244 | I270: 1297.5562 | N270: 3X3 | O270: =+(E270+G270+I270)/(3) -> 1221.1890666666666
A271: 261 | B271: KENAN USLU | C271: TR 214135 | D271: 100 | E271: 1377.7299 | F271: 166 | G271: 1283.9631999999999 | H271: 380 | I271: 994.83510000000001 | N271: 3X3 | O271: =+(E271+G271+I271)/(3) -> 1218.8427333333332
A272: 262 | B272: BY CULIYAS GUZELDEMIRCI KRDSLR | C272: TR 200330 | D272: 91 | E272: 1380.4401 | F272: 386 | G272: 979.52089999999998 | H272: 267 | I272: 1288.1416999999999 | N272: 3X3 | O272: =+(E272+G272+I272)/(3) -> 1216.0342333333335
A273: 263 | B273: AKUCU HUSEYIN | C273: TR 96284 | D273: 497 | E273: 1217.8142 | F273: 308 | G273: 1177.7465 | H273: 324 | I273: 1247.1489999999999 | N273: 3X3 | O273: =+(E273+G273+I273)/(3) -> 1214.2365666666667
A274: 264 | B274: SOSYETE KUAFOR | C274: TR 116436 | D274: 486 | E274: 1243.4744000000001 | F274: 334 | G274: 1160.5864999999999 | H274: 336 | I274: 1231.3489999999999 | N274: 3X3 | O274: =+(E274+G274+I274)/(3) -> 1211.8032999999998
A275: 265 | B275: ALI AKBAY | C275: TR 92901 | D275: 523 | E275: 1117.2103 | F275: 232 | G275: 1260.9114999999999 | H275: 316 | I275: 1255.9742000000001 | N275: 3X3 | O275: =+(E275+G275+I275)/(3) -> 1211.3653333333334
A276: 266 | B276: ISMAIL YUNUS TASCI | C276: TR 91613 | D276: 490 | E276: 1233.2509 | F276: 316 | G276: 1175.7732000000001 | H276: 340 | I276: 1211.8652999999999 | N276: 3X3 | O276: =+(E276+G276+I276)/(3) -> 1206.9631333333334
A277: 267 | B277: SEDAT CERIT | C277: TR 64112 | D277: 228 | E277: 1340.3417999999999 | F277: 390 | G277: 975.42439999999999 | H277: 230 | I277: 1303.7642000000001 | N277: 3X3 | O277: =+(E277+G277+I277)/(3) -> 1206.5101333333334
A278: 268 | B278: MUHARREM HUSEYIN | C278: TR 40002 | D278: 265 | E278: 1334.665 | F278: 385 | G278: 979.59879999999998 | H278: 229 | I278: 1304.2575999999999 | N278: 3X3 | O278: =+(E278+G278+I278)/(3) -> 1206.1737999999998
A279: 269 | B279: CIMBOMLU SECO | C279: TR 172514 | D279: 283 | E279: 1330.6660999999999 | F279: 389 | G279: 976.62710000000004 | H279: 212 | I279: 1310.3570999999999 | N279: 3X3 | O279: =+(E279+G279+I279)/(3) -> 1205.8834333333334
A280: 270 | B280: SANATCI HACI SEVINC | C280: TR 246704 | D280: 164 | E280: 1349.9619 | F280: 383 | G280: 982.50120000000004 | H280: 278 | I280: 1284.9829 | N280: 3X3 | O280: =+(E280+G280+I280)/(3) -> 1205.8153333333332
A281: 271 | B281: CAN KARDESLER KADIR | C281: TR 119074 | D281: 205 | E281: 1343.018 | F281: 256 | G281: 1243.4702 | H281: 374 | I281: 1027.9604999999999 | N281: 3X3 | O281: =+(E281+G281+I281)/(3) -> 1204.8162333333332
A282: 272 | B282: FIRAT TIMURTAS | C282: TR 98631 | D282: 194 | E282: 1344.7185999999999 | F282: 155 | G282: 1284.6762000000001 | H282: 381 | I282: 978.78769999999997 | N282: 3X3 | O282: =+(E282+G282+I282)/(3) -> 1202.7275
A283: 273 | B283: TANJU AHMET ONUR | C283: TR 73085 | D283: 153 | E283: 1356.6986999999999 | F283: 392 | G283: 959.79169999999999 | H283: 259 | I283: 1290.4475 | N283: 3X3 | O283: =+(E283+G283+I283)/(3) -> 1202.3126333333332
A284: 274 | B284: SANATCI HACI SEVINC | C284: TR 64017 | D284: 422 | E284: 1287.2526 | F284: 375 | G284: 995.31060000000002 | H284: 199 | I284: 1315.4944 | N284: 3X3 | O284: =+(E284+G284+I284)/(3) -> 1199.3525333333334
A285: 275 | B285: TEAM OZKAN EYMEN | C285: TR 16211 | D285: 352 | E285: 1311.9141 | F285: 374 | G285: 997.89710000000002 | H285: 279 | I285: 1283.8269 | N285: 3X3 | O285: =+(E285+G285+I285)/(3) -> 1197.8793666666668
A286: 276 | B286: CEM BEDEL | C286: TR 112013 | D286: 532 | E286: 916.48810000000003 | F286: 25 | G286: 1349.0934 | H286: 154 | I286: 1323.5153 | N286: 3X3 | O286: =+(E286+G286+I286)/(3) -> 1196.3656000000001
A287: 277 | B287: ERKAN DORUK | C287: TR 217148 | D287: 393 | E287: 1298.3584000000001 | F287: 379 | G287: 987.73159999999996 | H287: 243 | I287: 1297.5880999999999 | N287: 3X3 | O287: =+(E287+G287+I287)/(3) -> 1194.5593666666666
A288: 278 | B288: TRAKYA POSTA OGUN CEM KOSE | C288: TR 207102 | D288: 140 | E288: 1359.9121 | F288: 382 | G288: 982.68830000000003 | H288: 331 | I288: 1241.0482 | N288: 3X3 | O288: =+(E288+G288+I288)/(3) -> 1194.5495333333336
A289: 279 | B289: KENAN SIMSEK | C289: TR 137937 | D289: 259 | E289: 1335.4730999999999 | F289: 405 | G289: 902.8768 | H289: 99 | I289: 1340.5492999999999 | N289: 3X3 | O289: =+(E289+G289+I289)/(3) -> 1192.9664
A290: 280 | B290: TEK ATAR ETEM | C290: TR 33430 | D290: 243 | E290: 1338.1059 | F290: 108 | G290: 1294.6904 | H290: 384 | I290: 946.0806 | N290: 3X3 | O290: =+(E290+G290+I290)/(3) -> 1192.9589666666668
A291: 281 | B291: AHMET MALTAS | C291: TR 92525 | D291: 493 | E291: 1229.5535 | F291: 369 | G291: 1015.3079 | H291: 130 | I291: 1331.0316 | N291: 3X3 | O291: =+(E291+G291+I291)/(3) -> 1191.9643333333333
A292: 282 | B292: ALPER KURSAT | C292: TR 72132 | D292: 25 | E292: 1407.4793 | F292: 26 | G292: 1347.9057 | H292: 389 | I292: 819.64359999999999 | N292: 3X3 | O292: =+(E292+G292+I292)/(3) -> 1191.6762000000001
A293: 283 | B293: KENAN YURDEM | C293: TR 97201 | D293: 340 | E293: 1316.4187999999999 | F293: 396 | G293: 957.39779999999996 | H293: 245 | I293: 1297.0971999999999 | N293: 3X3 | O293: =+(E293+G293+I293)/(3) -> 1190.3046000000002
A294: 284 | B294: RIDVAN MOLLAOGLU | C294: TR 211641 | D294: 197 | E294: 1344.4052999999999 | F294: 404 | G294: 903.51919999999996 | H294: 163 | I294: 1321.6971000000001 | N294: 3X3 | O294: =+(E294+G294+I294)/(3) -> 1189.8738666666668
A295: 285 | B295: RESUL APO | C295: TR 89543 | D295: 252 | E295: 1336.6660999999999 | F295: 408 | G295: 889.97170000000006 | H295: 98 | I295: 1340.8856000000001 | N295: 3X3 | O295: =+(E295+G295+I295)/(3) -> 1189.1744666666666
A296: 286 | B296: NECO YILDIZ | C296: TR 95017 | D296: 185 | E296: 1345.7018 | F296: 395 | G296: 957.56590000000006 | H296: 305 | I296: 1263.9380000000001 | N296: 3X3 | O296: =+(E296+G296+I296)/(3) -> 1189.0685666666668
A297: 287 | B297: FERUDUN KILINC | C297: TR 212650 | D297: 250 | E297: 1336.8536999999999 | F297: 281 | G297: 1215.7130999999999 | H297: 376 | I297: 1007.8113 | N297: 3X3 | O297: =+(E297+G297+I297)/(3) -> 1186.7926999999997
A298: 288 | B298: CEZMI ATILLA OZCAN | C298: TR 97241 | D298: 436 | E298: 1282.8543999999999 | F298: 401 | G298: 953.94529999999997 | H298: 196 | I298: 1315.6713999999999 | N298: 3X3 | O298: =+(E298+G298+I298)/(3) -> 1184.1570333333332
A299: 289 | B299: ZABITA MURAT | C299: TR 95265 | D299: 489 | E299: 1236.5168000000001 | F299: 388 | G299: 977.42550000000006 | H299: 134 | I299: 1330.4789000000001 | N299: 3X3 | O299: =+(E299+G299+I299)/(3) -> 1181.4737333333335
A300: 290 | B300: NEVZAT CILENTI | C300: TR 270313 | D300: 457 | E300: 1272.6424 | F300: 370 | G300: 1012.5119 | H300: 319 | I300: 1255.6433 | N300: 3X3 | O300: =+(E300+G300+I300)/(3) -> 1180.2658666666666
A301: 291 | B301: ENGIN YILDIZ | C301: TR 216012 | D301: 241 | E301: 1338.8076000000001 | F301: 78 | G301: 1306.1918000000001 | H301: 385 | I301: 895.77700000000004 | N301: 3X3 | O301: =+(E301+G301+I301)/(3) -> 1180.2588000000001
A302: 292 | B302: BATIN ERAY & TASKAN TENEKE | C302: TR 10907 | D302: 109 | E302: 1372.4575 | F302: 373 | G302: 999.35770000000002 | H302: 358 | I302: 1163.7985000000001 | N302: 3X3 | O302: =+(E302+G302+I302)/(3) -> 1178.5379
A303: 293 | B303: CEMIL OZTURK | C303: TR 215104 | D303: 290 | E303: 1329.2569000000001 | F303: 371 | G303: 1007.0103 | H303: 351 | I303: 1187.2180000000001 | N303: 3X3 | O303: =+(E303+G303+I303)/(3) -> 1174.4950666666666
A304: 294 | B304: SINAN KARATAS | C304: TR 228705 | D304: 58 | E304: 1394.5056 | F304: 93 | G304: 1300.2545 | H304: 391 | I304: 818.08720000000005 | N304: 3X3 | O304: =+(E304+G304+I304)/(3) -> 1170.9491
A305: 295 | B305: RIDVAN MOLLAOGLU ISMAIL HACIOGLU | C305: TR 233387 | D305: 432 | E305: 1284.4802999999999 | F305: 394 | G305: 958.745 | H305: 312 | I305: 1260.9340999999999 | N305: 3X3 | O305: =+(E305+G305+I305)/(3) -> 1168.0531333333333
A306: 296 | B306: MURAT ONDEROGLU | C306: TR 113116 | D306: 117 | E306: 1370.1851999999999 | F306: 37 | G306: 1340.0485000000001 | H306: 393 | I306: 790.36379999999997 | N306: 3X3 | O306: =+(E306+G306+I306)/(3) -> 1166.8658333333333
A307: 297 | B307: AYDIN ARENA FATIH | C307: TR 265620 | D307: 366 | E307: 1308.1899000000001 | F307: 412 | G307: 865.69159999999999 | H307: 153 | I307: 1324.7665 | N307: 3X3 | O307: =+(E307+G307+I307)/(3) -> 1166.2160000000001
A308: 298 | B308: CAN KARDESLER KADIR | C308: TR 172307 | D308: 468 | E308: 1263.2748999999999 | F308: 393 | G308: 958.97490000000005 | H308: 303 | I308: 1265.4781 | N308: 3X3 | O308: =+(E308+G308+I308)/(3) -> 1162.5759666666665
A309: 299 | B309: YILDIRAY RECEP | C309: TR 96510 | D309: 537 | E309: 867.65139999999997 | F309: 193 | G309: 1281.1377 | H309: 107 | I309: 1337.13 | N309: 3X3 | O309: =+(E309+G309+I309)/(3) -> 1161.9730333333334
A310: 300 | B310: OKAN EMEKLI | C310: TR 97303 | D310: 307 | E310: 1327.0166999999999 | F310: 406 | G310: 900.30690000000004 | H310: 314 | I310: 1258.3233 | N310: 3X3 | O310: =+(E310+G310+I310)/(3) -> 1161.8823
A311: 301 | B311: ISMAIL MURAT OLGUNER | C311: TR 271949 | D311: 510 | E311: 1197.9682 | F311: 234 | G311: 1260.5009 | H311: 378 | I311: 1002.0086 | N311: 3X3 | O311: =+(E311+G311+I311)/(3) -> 1153.4925666666668
A312: 302 | B312: KIRKPINAR ARENA | C312: TR 63014 | D312: 160 | E312: 1351.4609 | F312: 413 | G312: 860.87459999999999 | H312: 334 | I312: 1235.7548999999999 | N312: 3X3 | O312: =+(E312+G312+I312)/(3) -> 1149.3634666666667
A313: 303 | B313: SAMPIYON GOKHAN TUNCA MIKI | C313: TR 42831 | D313: 324 | E313: 1322.3024 | F313: 97 | G313: 1298.3184000000001 | H313: 390 | I313: 819.02419999999995 | N313: 3X3 | O313: =+(E313+G313+I313)/(3) -> 1146.5483333333334
A314: 304 | B314: E B SILVER | C314: TR 140416 | D314: 338 | E314: 1317.4043999999999 | F314: 91 | G314: 1301.7655 | H314: 392 | I314: 815.94809999999995 | N314: 3X3 | O314: =+(E314+G314+I314)/(3) -> 1145.0393333333334
A315: 305 | B315: KENAN EMRAH KARATAS | C315: TR 171199 | D315: 182 | E315: 1346.5807 | F315: 349 | G315: 1123.4956 | H315: 382 | I315: 965.02369999999996 | N315: 3X3 | O315: =+(E315+G315+I315)/(3) -> 1145.0333333333331
A316: 306 | B316: NEVZAT CILENTI | C316: TR 270307 | D316: 482 | E316: 1248.4706000000001 | F316: 313 | G316: 1176.6638 | H316: 377 | I316: 1006.67 | N316: 3X3 | O316: =+(E316+G316+I316)/(3) -> 1143.9348
A317: 307 | B317: ILKER ELMAS | C317: TR 270536 | D317: 434 | E317: 1283.3126999999999 | F317: 206 | G317: 1278.7247 | H317: 387 | I317: 852.92970000000003 | N317: 3X3 | O317: =+(E317+G317+I317)/(3) -> 1138.3223666666668
A318: 308 | B318: ALI IHSAN ARSLAN | C318: TR 115404 | D318: 342 | E318: 1316.2542000000001 | F318: 410 | G318: 883.33130000000006 | H318: 343 | I318: 1210.6138000000001 | N318: 3X3 | O318: =+(E318+G318+I318)/(3) -> 1136.7331000000001
A319: 309 | B319: TANCE BALOTA KARDESLER | C319: TR 136007 | D319: 530 | E319: 931.0915 | F319: 337 | G319: 1148.394 | H319: 220 | I319: 1307.8163999999999 | N319: 3X3 | O319: =+(E319+G319+I319)/(3) -> 1129.1006333333332
A320: 310 | B320: ALPAY NIHAT | C320: TR 135102 | D320: 39 | E320: 1400.3151 | F320: 132 | G320: 1287.7281 | H320: 396 | I320: 697.95069999999998 | N320: 3X3 | O320: =+(E320+G320+I320)/(3) -> 1128.6646333333333
A321: 311 | B321: YUSUF KARAKURT | C321: TR 27101 | D321: 373 | E321: 1305.9888000000001 | F321: 418 | G321: 756.18179999999995 | H321: 189 | I321: 1318.4586999999999 | N321: 3X3 | O321: =+(E321+G321+I321)/(3) -> 1126.8764333333331
A322: 312 | B322: POYRAZ DEMIR AHMEY YAHYA DEGIRMENCI | C322: TR 221890 | D322: 50 | E322: 1396.3489999999999 | F322: 414 | G322: 854.75869999999998 | H322: 366 | I322: 1118.9285 | N322: 3X3 | O322: =+(E322+G322+I322)/(3) -> 1123.3453999999999
A323: 313 | B323: ENGIN KAPTAN | C323: TR 270401 | D323: 75 | E323: 1387.848 | F323: 428 | G323: 637.27290000000005 | H323: 100 | I323: 1340.4104 | N323: 3X3 | O323: =+(E323+G323+I323)/(3) -> 1121.8437666666666
A324: 314 | B324: AYHAN BAYINDIR | C324: TR 162403 | D324: 351 | E324: 1312.0690999999999 | F324: 417 | G324: 760.01440000000002 | H324: 281 | I324: 1278.0146999999999 | N324: 3X3 | O324: =+(E324+G324+I324)/(3) -> 1116.6993999999997
A325: 315 | B325: AKUCU HUSEYIN | C325: TR 96283 | D325: 538 | E325: 762.76 | F325: 288 | G325: 1198.6590000000001 | H325: 58 | I325: 1380.5452 | N325: 3X3 | O325: =+(E325+G325+I325)/(3) -> 1113.9880666666668
A326: 316 | B326: CAGLAYAN INSAAT | C326: TR 114311 | D326: 271 | E326: 1333.2859000000001 | F326: 403 | G326: 936.06389999999999 | H326: 370 | I326: 1069.2978000000001 | N326: 3X3 | O326: =+(E326+G326+I326)/(3) -> 1112.8825333333334
A327: 317 | B327: KADIR TOPAL | C327: TR 234403 | D327: 404 | E327: 1294.0377000000001 | F327: 415 | G327: 827.71609999999998 | H327: 344 | I327: 1210.3574000000001 | N327: 3X3 | O327: =+(E327+G327+I327)/(3) -> 1110.7037333333335
A328: 318 | B328: ERCAN KOC | C328: TR 74604 | D328: 95 | E328: 1379.4974 | F328: 427 | G328: 637.75210000000004 | H328: 246 | I328: 1296.7900999999999 | N328: 3X3 | O328: =+(E328+G328+I328)/(3) -> 1104.6798666666666
A329: 319 | B329: CEMALETTIN DAG | C329: TR 10761 | D329: 473 | E329: 1258.1543999999999 | F329: 416 | G329: 766.31529999999998 | H329: 306 | I329: 1263.8315 | N329: 3X3 | O329: =+(E329+G329+I329)/(3) -> 1096.1004
A330: 320 | B330: EMRE KARAN | C330: TR 93582 | D330: 224 | E330: 1340.9319 | F330: 411 | G330: 882.93240000000003 | H330: 373 | I330: 1063.9464 | N330: 3X3 | O330: =+(E330+G330+I330)/(3) -> 1095.9368999999999
A331: 321 | B331: CAN KARDESLER KADIR | C331: TR 119075 | D331: 362 | E331: 1309.289 | F331: 346 | G331: 1124.6802 | H331: 388 | I331: 842.9 | N331: 3X3 | O331: =+(E331+G331+I331)/(3) -> 1092.2897333333333
A332: 322 | B332: TEK CINAR INSAAT GOKHAN | C332: TR 46001 | D332: 264 | E332: 1334.9293 | F332: 423 | G332: 667.41840000000002 | H332: 299 | I332: 1269.4554000000001 | N332: 3X3 | O332: =+(E332+G332+I332)/(3) -> 1090.6010333333334
A333: 323 | B333: ERKAN SIMSEK | C333: TR 82515 | D333: 522 | E333: 1121.4555 | F333: 338 | G333: 1147.9628 | H333: 379 | I333: 996.06780000000003 | N333: 3X3 | O333: =+(E333+G333+I333)/(3) -> 1088.4953666666668
A334: 324 | B334: AKSEVER AHMET | C334: TR 111203 | D334: 378 | E334: 1303.4467 | F334: 33 | G334: 1340.4302 | H334: 398 | I334: 596.38109999999995 | N334: 3X3 | O334: =+(E334+G334+I334)/(3) -> 1080.086
A335: 325 | B335: HASAN GUNDOGAN | C335: TR 270979 | D335: 273 | E335: 1332.9038 | F335: 433 | G335: 590.4633 | H335: 232 | I335: 1302.9072000000001 | N335: 3X3 | O335: =+(E335+G335+I335)/(3) -> 1075.4247666666668
A336: 326 | B336: HALIL TANSEL HOCA | C336: TR 114002 | D336: 189 | E336: 1345.4272000000001 | F336: 432 | G336: 594.76829999999995 | H336: 298 | I336: 1269.7460000000001 | N336: 3X3 | O336: =+(E336+G336+I336)/(3) -> 1069.9804999999999
A337: 327 | B337: TANCE BALOTA KARDESLER | C337: TR 136002 | D337: 494 | E337: 1228.7428 | F337: 300 | G337: 1183.1067 | H337: 394 | I337: 782.79840000000002 | N337: 3X3 | O337: =+(E337+G337+I337)/(3) -> 1064.8826333333334
A338: 328 | B338: HABIB AKIN | C338: TR 98305 | D338: 190 | E338: 1345.4241999999999 | F338: 424 | G338: 660.84119999999996 | H338: 363 | I338: 1132.3978999999999 | N338: 3X3 | O338: =+(E338+G338+I338)/(3) -> 1046.2211
A339: 329 | B339: HIMER GIDA | C339: TR 64405 | D339: 469 | E339: 1261.8906999999999 | F339: 384 | G339: 982.26400000000001 | H339: 386 | I339: 890.65340000000003 | N339: 3X3 | O339: =+(E339+G339+I339)/(3) -> 1044.9360333333334
A340: 330 | B340: TASKAN TENEKE | C340: TR 10910 | D340: 400 | E340: 1295.6193000000001 | F340: 438 | G340: 421.53089999999997 | H340: 47 | I340: 1396.1678999999999 | N340: 3X3 | O340: =+(E340+G340+I340)/(3) -> 1037.7727
A341: 331 | B341: BURAK SABAN | C341: TR 93003 | D341: 254 | E341: 1336.2255 | F341: 65 | G341: 1316.9628 | H341: 401 | I341: 455.27409999999998 | N341: 3X3 | O341: =+(E341+G341+I341)/(3) -> 1036.1541333333332
A342: 332 | B342: HUSEYIN NURCAN | C342: TR 163944 | D342: 113 | E342: 1370.7424000000001 | F342: 66 | G342: 1314.2547 | H342: 402 | I342: 396.14249999999998 | N342: 3X3 | O342: =+(E342+G342+I342)/(3) -> 1027.0465333333334
A343: 333 | B343: YILDIRAY RECEP | C343: TR 96507 | D343: 499 | E343: 1213.3835999999999 | F343: 425 | G343: 652.78679999999997 | H343: 347 | I343: 1196.7122999999999 | N343: 3X3 | O343: =+(E343+G343+I343)/(3) -> 1020.9609
A344: 334 | B344: SURETLI KARDESLER | C344: TR 114207 | D344: 334 | E344: 1318.9973 | F344: 29 | G344: 1341.7266 | H344: 404 | I344: 372.12290000000002 | N344: 3X3 | O344: =+(E344+G344+I344)/(3) -> 1010.9489333333332
A345: 335 | B345: RECEP USTA | C345: TR 115605 | D345: 40 | E345: 1399.8479 | F345: 204 | G345: 1279.1984 | H345: 409 | I345: 325.27839999999998 | N345: 3X3 | O345: =+(E345+G345+I345)/(3) -> 1001.4415666666667
A346: 336 | B346: BERKAN GOKHAN KARDESLER | C346: TR 97118 | D346: 181 | E346: 1346.9011 | F346: 227 | G346: 1262.8570999999999 | H346: 405 | I346: 355.87299999999999 | N346: 3X3 | O346: =+(E346+G346+I346)/(3) -> 988.54373333333342
A347: 337 | B347: TRAKYA POSTA OGUN CEM KOSE | C347: TR 207187 | D347: 280 | E347: 1331.038 | F347: 15 | G347: 1356.9864 | H347: 413 | I347: 275.2602 | N347: 3X3 | O347: =+(E347+G347+I347)/(3) -> 987.76153333333343
A348: 338 | B348: KABASAKAL | C348: TR 88007 | D348: 99 | E348: 1377.9513999999999 | F348: 446 | G348: 259.96850000000001 | H348: 215 | I348: 1309.2121 | N348: 3X3 | O348: =+(E348+G348+I348)/(3) -> 982.37733333333324
A349: 339 | B349: GOKHAN SOYTURK | C349: TR 34415 | D349: 211 | E349: 1342.4349999999999 | F349: 426 | G349: 639.50890000000004 | H349: 383 | I349: 963.04250000000002 | N349: 3X3 | O349: =+(E349+G349+I349)/(3) -> 981.66213333333326
A350: 340 | B350: MURAT OYNAR | C350: TR 212534 | D350: 255 | E350: 1335.9875 | F350: 451 | G350: 222.7576 | H350: 67 | I350: 1377.8533 | N350: 3X3 | O350: =+(E350+G350+I350)/(3) -> 978.86613333333332
A351: 341 | B351: MEKKELI MEHMET GUCLU | C351: TR 92214 | D351: 543 | E351: 442.24790000000002 | F351: 286 | G351: 1200.3255999999999 | H351: 255 | I351: 1291.3816999999999 | N351: 3X3 | O351: =+(E351+G351+I351)/(3) -> 977.98506666666663
A352: 342 | B352: OZKAN CAKAL | C352: TR 46004 | D352: 347 | E352: 1314.5182 | F352: 63 | G352: 1330.7642000000001 | H352: 411 | I352: 287.36040000000003 | N352: 3X3 | O352: =+(E352+G352+I352)/(3) -> 977.54759999999999
A353: 343 | B353: SENER KAYACAN | C353: TR 170452 | D353: 363 | E353: 1309.0433 | F353: 441 | G353: 397.05369999999999 | H353: 353 | I353: 1186.6907000000001 | N353: 3X3 | O353: =+(E353+G353+I353)/(3) -> 964.26256666666666
A354: 344 | B354: TAMER ERHAN YAY | C354: TR 95404 | D354: 514 | E354: 1185.0798 | F354: 95 | G354: 1299.3341 | H354: 403 | I354: 394.75510000000003 | N354: 3X3 | O354: =+(E354+G354+I354)/(3) -> 959.72299999999996
A355: 345 | B355: ISMAIL UNALDI | C355: TR 98385 | D355: 488 | E355: 1236.5958000000001 | F355: 92 | G355: 1300.9151999999999 | H355: 407 | I355: 336.91649999999998 | N355: 3X3 | O355: =+(E355+G355+I355)/(3) -> 958.14250000000004
A356: 346 | B356: BULENT SAFAK CIT | C356: TR 160984 | D356: 333 | E356: 1319.0320999999999 | F356: 449 | G356: 231.64940000000001 | H356: 158 | I356: 1322.8228999999999 | N356: 3X3 | O356: =+(E356+G356+I356)/(3) -> 957.83479999999997
A357: 347 | B357: TEK ATAR ETEM | C357: TR 33406 | D357: 270 | E357: 1333.3925999999999 | F357: 458 | G357: 198.76779999999999 | H357: 119 | I357: 1332.4545000000001 | N357: 3X3 | O357: =+(E357+G357+I357)/(3) -> 954.87163333333331
A358: 348 | B358: MIKAIL KARDESLER | C358: TR 101632 | D358: 287 | E358: 1329.8757000000001 | F358: 448 | G358: 246.12979999999999 | H358: 272 | I358: 1287.0603000000001 | N358: 3X3 | O358: =+(E358+G358+I358)/(3) -> 954.35526666666681
A359: 349 | B359: ENGIN KAPTAN | C359: TR 270402 | D359: 501 | E359: 1209.5018 | F359: 430 | G359: 614.04399999999998 | H359: 375 | I359: 1026.2518 | N359: 3X3 | O359: =+(E359+G359+I359)/(3) -> 949.93253333333325
A360: 350 | B360: IBRAHIM TOPCU | C360: TR 9886 | D360: 145 | E360: 1358.1759 | F360: 454 | G360: 210.7296 | H360: 285 | I360: 1274.6197 | N360: 3X3 | O360: =+(E360+G360+I360)/(3) -> 947.84173333333331
A361: 351 | B361: MUSTAFA TEZ | C361: TR 7781 | D361: 535 | E361: 871.24459999999999 | F361: 329 | G361: 1166.4967999999999 | H361: 395 | I361: 778.29780000000005 | N361: 3X3 | O361: =+(E361+G361+I361)/(3) -> 938.67973333333339
A362: 352 | B362: BABUSLAR | C362: TR 85707 | D362: 364 | E362: 1308.5094999999999 | F362: 437 | G362: 435.15170000000001 | H362: 372 | I362: 1065.5155 | N362: 3X3 | O362: =+(E362+G362+I362)/(3) -> 936.39223333333337
A363: 353 | B363: ISMAIL OZTURK | C363: TR 51105 | D363: 550 | E363: 273.85579999999999 | F363: 115 | G363: 1292.2297000000001 | H363: 332 | I363: 1240.5350000000001 | N363: 3X3 | O363: =+(E363+G363+I363)/(3) -> 935.54016666666666
A364: 354 | B364: www.turbopýgeon.com | C364: TR 45001 | D364: 552 | E364: 185.70480000000001 | F364: 250 | G364: 1252.1783 | H364: 81 | I364: 1350.3574000000001 | N364: 3X3 | O364: =+(E364+G364+I364)/(3) -> 929.4135
A365: 355 | B365: HUSEYIN DEMIR KIRAZ | C365: TR 162109 | D365: 452 | E365: 1275.1605 | F365: 440 | G365: 398.35759999999999 | H365: 369 | I365: 1113.258 | N365: 3X3 | O365: =+(E365+G365+I365)/(3) -> 928.92536666666672
A366: 356 | B366: TEK ATAR ETEM | C366: TR 33420 | D366: 556 | E366: 138.72749999999999 | F366: 50 | G366: 1339.1120000000001 | H366: 241 | I366: 1298.5608 | N366: 3X3 | O366: =+(E366+G366+I366)/(3) -> 925.46676666666679
A367: 357 | B367: ESREF METIN | C367: TR 57585 | D367: 311 | E367: 1326.7497000000001 | F367: 459 | G367: 189.42920000000001 | H367: 329 | I367: 1244.3661999999999 | N367: 3X3 | O367: =+(E367+G367+I367)/(3) -> 920.18170000000009
A368: 358 | B368: AHMET KILICARSLAN | C368: TR 73512 | D368: 465 | E368: 1266.9078999999999 | F368: 450 | G368: 227.83500000000001 | H368: 361 | I368: 1149.2932000000001 | N368: 3X3 | O368: =+(E368+G368+I368)/(3) -> 881.34536666666679
A369: 359 | B369: SINAN KARATAS | C369: TR 228702 | D369: 544 | E369: 399.95839999999998 | F369: 372 | G369: 1006.1606 | H369: 342 | I369: 1211.4927 | N369: 3X3 | O369: =+(E369+G369+I369)/(3) -> 872.53723333333346
A370: 360 | B370: CIMBOMLU SECO | C370: TR 172516 | D370: 386 | E370: 1300.6832999999999 | F370: 407 | G370: 890.25480000000005 | H370: 406 | I370: 341.9513 | N370: 3X3 | O370: =+(E370+G370+I370)/(3) -> 844.29646666666667
A371: 361 | B371: KARA MURAT | C371: TR 90150 | D371: 554 | E371: 154.68270000000001 | F371: 391 | G371: 962.45809999999994 | H371: 38 | I371: 1401.5834 | N371: 3X3 | O371: =+(E371+G371+I371)/(3) -> 839.57473333333326
A372: 362 | B372: BACO FARUK YILDIZ | C372: TR 78519 | D372: 547 | E372: 352.2441 | F372: 81 | G372: 1305.9217000000001 | H372: 400 | I372: 546.21789999999999 | N372: 3X3 | O372: =+(E372+G372+I372)/(3) -> 734.79456666666681
A373: 363 | B373: ALI ALPKAYA | C373: TR 64120 | D373: 548 | E373: 340.46820000000002 | F373: 331 | G373: 1166.1750999999999 | H373: 397 | I373: 689.57339999999999 | N373: 3X3 | O373: =+(E373+G373+I373)/(3) -> 732.07223333333332
A374: 364 | B374: SAMPIYON GOKHAN TUNCA MIKI | C374: TR 42835 | D374: 551 | E374: 228.96109999999999 | F374: 429 | G374: 637.25340000000006 | H374: 173 | I374: 1319.9722999999999 | N374: 3X3 | O374: =+(E374+G374+I374)/(3) -> 728.72893333333332
A375: 365 | B375: ERKAN BAYRAK | C375: TR 55529 | D375: 529 | E375: 931.92740000000003 | F375: 381 | G375: 982.79899999999998 | H375: 414 | I375: 268.39569999999998 | N375: 3X3 | O375: =+(E375+G375+I375)/(3) -> 727.70736666666664
A376: 366 | B376: ERKAN BAYRAK | C376: TR 55531 | D376: 546 | E376: 357.25729999999999 | F376: 439 | G376: 418.68490000000003 | H376: 70 | I376: 1376.5142000000001 | N376: 3X3 | O376: =+(E376+G376+I376)/(3) -> 717.48546666666664
A377: 367 | B377: TANER DERBY 19 | C377: TR 16142 | D377: 480 | E377: 1250.7973999999999 | F377: 456 | G377: 207.2998 | H377: 399 | I377: 559.04110000000003 | N377: 3X3 | O377: =+(E377+G377+I377)/(3) -> 672.3794333333334
A378: 368 | B378: MUSTAFA POLAT | C378: TR 269808 | D378: 542 | E378: 445.85230000000001 | F378: 460 | G378: 186.95419999999999 | H378: 310 | I378: 1261.5499 | N378: 3X3 | O378: =+(E378+G378+I378)/(3) -> 631.45213333333334
A379: 369 | B379: AYDOGAN MENGUL | C379: TR 96906 | D379: 540 | E379: 674.97260000000006 | F379: 444 | G379: 322.62529999999998 | H379: 408 | I379: 328.52659999999997 | N379: 3X3 | O379: =+(E379+G379+I379)/(3) -> 442.04149999999998