A1: PROFESYONEL DERBY 45 KLASMAN LÝSTESÝ
A7: BENZING SÝSTEMÝNDE UÇUM HIZI ÝLE YAPILAN KLASMAN HESAPLAMASINDA 1 GÜNLÜK - 2 GÜNLÜK VE 3 GÜNLÜK YARIÞLARDA LÝSTEYE GÝREN BÜTÜN KUÞLAR DEÐERLENDÝRMEYE ALINIR
D8: 1 GÜNLÜK | F8: 1 GÜNLÜK | H8: 1 GÜNLÜK | J8: 1 GÜNLÜK
D9: KULA | F9: UÞAK | H9: DUMLUPINAR | J9: AFYON ÇOBANLAR | N9: ETAP | O9: ORTALAMA HIZ
A10: NO | B10: AD SOYAD | C10: KÜNYE | D10: SIRA | E10: HIZ | F10: SIRA | G10: HIZ | H10: SIRA | I10: HIZ | J10: SIRA | K10: HIZ | L10: SIRA | M10: HIZ
A11: 1 | B11: KENAN EMRAH KARATAS | C11: TR 171182 | D11: 53 | E11: 1395.4981 | F11: 40 | G11: 1339.9287999999999 | H11: 24 | I11: 1407.6366 | J11: 10 | K11: 1530.9038 | N11: 4X4 | O11: =+(E11+G11+I11+K11)/(4) -> 1418.4918250000001
A12: 2 | B12: UMIT ZEYBEK | C12: TR 270694 | D12: 104 | E12: 1373.8590999999999 | F12: 101 | G12: 1296.7926 | H12: 26 | I12: 1407.4024999999999 | J12: 7 | K12: 1539.6958999999999 | N12: 4X4 | O12: =+(E12+G12+I12+K12)/(4) -> 1404.4375249999998
A13: 3 | B13: MEHMET TUNCAY | C13: TR 135274 | D13: 121 | E13: 1369.2940000000001 | F13: 5 | G13: 1363.1696999999999 | H13: 12 | I13: 1410.7431999999999 | J13: 46 | K13: 1450.4771000000001 | N13: 4X4 | O13: =+(E13+G13+I13+K13)/(4) -> 1398.421
A14: 4 | B14: SANATCI HACI SEVINC | C14: TR 246701 | D14: 10 | E14: 1411.0574999999999 | F14: 83 | G14: 1305.231 | H14: 21 | I14: 1407.9579000000001 | J14: 38 | K14: 1463.1957 | N14: 4X4 | O14: =+(E14+G14+I14+K14)/(4) -> 1396.8605250000001
A15: 5 | B15: IHSAN SARIYER | C15: TR 90129 | D15: 275 | E15: 1332.2527 | F15: 98 | G15: 1298.0217 | H15: 5 | I15: 1419.5182 | J15: 13 | K15: 1527.8683000000001 | N15: 4X4 | O15: =+(E15+G15+I15+K15)/(4) -> 1394.4152250000002
A16: 6 | B16: TAMER SEMERCILER | C16: TR 172004 | D16: 127 | E16: 1366.0175999999999 | F16: 8 | G16: 1362.1369 | H16: 10 | I16: 1411.1986999999999 | J16: 71 | K16: 1410.2647999999999 | N16: 4X4 | O16: =+(E16+G16+I16+K16)/(4) -> 1387.4044999999999
A17: 7 | B17: FESIH UNAL | C17: TR 127508 | D17: 330 | E17: 1320.3557000000001 | F17: 116 | G17: 1292.2088000000001 | H17: 42 | I17: 1399.4405999999999 | J17: 11 | K17: 1530.9024999999999 | N17: 4X4 | O17: =+(E17+G17+I17+K17)/(4) -> 1385.7269000000001
A18: 8 | B18: BACO FARUK YILDIZ | C18: TR 78518 | D18: 49 | E18: 1396.3848 | F18: 2 | G18: 1368.7849000000001 | H18: 120 | I18: 1332.3240000000001 | J18: 50 | K18: 1438.8661999999999 | N18: 4X4 | O18: =+(E18+G18+I18+K18)/(4) -> 1384.0899750000003
A19: 9 | B19: SANATCI HACI SEVINC | C19: TR 246707 | D19: 66 | E19: 1392.0273999999999 | F19: 35 | G19: 1340.2692 | H19: 66 | I19: 1378.1885 | J19: 73 | K19: 1409.9401 | N19: 4X4 | O19: =+(E19+G19+I19+K19)/(4) -> 1380.1062999999999
A20: 10 | B20: KENAN YURDEM | C20: TR 97222 | D20: 116 | E20: 1370.6452999999999 | F20: 39 | G20: 1339.9475 | H20: 122 | I20: 1331.8629000000001 | J20: 29 | K20: 1470.3815999999999 | N20: 4X4 | O20: =+(E20+G20+I20+K20)/(4) -> 1378.209325
A21: 11 | B21: MEHMET BULDUK | C21: TR 77314 | D21: 86 | E21: 1381.3649 | F21: 235 | G21: 1259.9798000000001 | H21: 39 | I21: 1401.3542 | J21: 39 | K21: 1463.1446000000001 | N21: 4X4 | O21: =+(E21+G21+I21+K21)/(4) -> 1376.4608750000002
A22: 12 | B22: ONDER KARDESLER | C22: TR 100582 | D22: 73 | E22: 1388.6895999999999 | F22: 133 | G22: 1287.5934 | H22: 94 | I22: 1341.9489000000001 | J22: 35 | K22: 1464.3647000000001 | N22: 4X4 | O22: =+(E22+G22+I22+K22)/(4) -> 1370.64915
A23: 13 | B23: TAMER ERHAN YAY | C23: TR 95403 | D23: 323 | E23: 1322.7047 | F23: 137 | G23: 1287.1065000000001 | H23: 33 | I23: 1404.6333999999999 | J23: 43 | K23: 1460.9038 | N23: 4X4 | O23: =+(E23+G23+I23+K23)/(4) -> 1368.8371
A24: 14 | B24: BABUSLAR | C24: TR 85706 | D24: 110 | E24: 1372.0745999999999 | F24: 112 | G24: 1292.4802 | H24: 89 | I24: 1348.0735999999999 | J24: 41 | K24: 1462.0916 | N24: 4X4 | O24: =+(E24+G24+I24+K24)/(4) -> 1368.68
A25: 15 | B25: CEMALETTIN DAG | C25: TR 90732 | D25: 65 | E25: 1392.79 | F25: 72 | G25: 1309.0576000000001 | H25: 129 | I25: 1331.1578 | J25: 61 | K25: 1422.1391000000001 | N25: 4X4 | O25: =+(E25+G25+I25+K25)/(4) -> 1363.7861250000001
A26: 16 | B26: SEYIT MUSTAFA YILDIZ | C26: TR 93205 | D26: 310 | E26: 1326.7497000000001 | F26: 51 | G26: 1339.0485000000001 | H26: 131 | I26: 1330.8154999999999 | J26: 45 | K26: 1453.7372 | N26: 4X4 | O26: =+(E26+G26+I26+K26)/(4) -> 1362.5877249999999
A27: 17 | B27: EDIP BEKIL BULENT YILMAZ | C27: TR 11008 | D27: 82 | E27: 1385.2526 | F27: 69 | G27: 1312.3951999999999 | H27: 7 | I27: 1412.0486000000001 | J27: 91 | K27: 1337.7877000000001 | N27: 4X4 | O27: =+(E27+G27+I27+K27)/(4) -> 1361.8710249999999
A28: 18 | B28: GUNEY KEBAP MURAT YILDIRIM | C28: TR 102422 | D28: 105 | E28: 1373.5698 | F28: 114 | G28: 1292.4558 | H28: 63 | I28: 1379.5020999999999 | J28: 87 | K28: 1398.0061000000001 | N28: 4X4 | O28: =+(E28+G28+I28+K28)/(4) -> 1360.8834499999998
A29: 19 | B29: KIRKPINAR ARENA | C29: TR 63027 | D29: 505 | E29: 1203.9248 | F29: 6 | G29: 1362.9065000000001 | H29: 14 | I29: 1410.1569999999999 | J29: 34 | K29: 1464.7579000000001 | N29: 4X4 | O29: =+(E29+G29+I29+K29)/(4) -> 1360.4365499999999
A30: 20 | B30: BAKI SEKER | C30: TR 7941 | D30: 503 | E30: 1204.2293 | F30: 18 | G30: 1351.9584 | H30: 8 | I30: 1411.3661999999999 | J30: 37 | K30: 1464.1312 | N30: 4X4 | O30: =+(E30+G30+I30+K30)/(4) -> 1357.9212749999999
A31: 21 | B31: BACO FARUK YILDIZ | C31: TR 78504 | D31: 295 | E31: 1328.73 | F31: 107 | G31: 1295.2896000000001 | H31: 61 | I31: 1379.5669 | J31: 56 | K31: 1427.0911000000001 | N31: 4X4 | O31: =+(E31+G31+I31+K31)/(4) -> 1357.6694000000002
A32: 22 | B32: MEHMET KIR | C32: TR 9913 | D32: 296 | E32: 1328.6034999999999 | F32: 110 | G32: 1292.6994999999999 | H32: 22 | I32: 1407.7102 | J32: 86 | K32: 1398.8154999999999 | N32: 4X4 | O32: =+(E32+G32+I32+K32)/(4) -> 1356.957175
A33: 23 | B33: NIYAZI AYDIN | C33: TR 157562 | D33: 504 | E33: 1203.9585999999999 | F33: 22 | G33: 1349.8843999999999 | H33: 105 | I33: 1338.9570000000001 | J33: 12 | K33: 1529.0715 | N33: 4X4 | O33: =+(E33+G33+I33+K33)/(4) -> 1355.467875
A34: 24 | B34: RECEP OZTURK | C34: TR 225089 | D34: 230 | E34: 1340.1413 | F34: 225 | G34: 1266.3822 | H34: 9 | I34: 1411.2636 | J34: 84 | K34: 1400.9385 | N34: 4X4 | O34: =+(E34+G34+I34+K34)/(4) -> 1354.6814000000002
A35: 25 | B35: MALAZGIRT BORU TEAM | C35: TR 90114 | D35: 30 | E35: 1403.4628 | F35: 46 | G35: 1339.4875 | H35: 101 | I35: 1340.0893000000001 | J35: 98 | K35: 1319.9036000000001 | N35: 4X4 | O35: =+(E35+G35+I35+K35)/(4) -> 1350.7357999999999
A36: 26 | B36: MUSTAFA ENSOY | C36: TR 557 | D36: 135 | E36: 1364.1293000000001 | F36: 244 | G36: 1256.7978000000001 | H36: 253 | I36: 1291.8897999999999 | J36: 20 | K36: 1488.5432000000001 | N36: 4X4 | O36: =+(E36+G36+I36+K36)/(4) -> 1350.340025
A37: 27 | B37: TURGUTLU - TUR SUT MANDIRA | C37: TR 155033 | D37: 448 | E37: 1277.1066000000001 | F37: 34 | G37: 1340.2879 | H37: 180 | I37: 1319.3443 | J37: 36 | K37: 1464.2003 | N37: 4X4 | O37: =+(E37+G37+I37+K37)/(4) -> 1350.2347749999999
A38: 28 | B38: SULEYMAN OZTURK | C38: TR 212450 | D38: 195 | E38: 1344.6794 | F38: 109 | G38: 1293.5302999999999 | H38: 304 | I38: 1264.9991 | J38: 18 | K38: 1489.3622 | N38: 4X4 | O38: =+(E38+G38+I38+K38)/(4) -> 1348.14275
A39: 29 | B39: TAMER SANLI | C39: TR 50061 | D39: 278 | E39: 1331.8831 | F39: 13 | G39: 1358.5784000000001 | H39: 250 | I39: 1295.6483000000001 | J39: 81 | K39: 1406.2114999999999 | N39: 4X4 | O39: =+(E39+G39+I39+K39)/(4) -> 1348.0803249999999
A40: 30 | B40: ONER KAHRAMAN | C40: TR 59030 | D40: 229 | E40: 1340.2311 | F40: 236 | G40: 1259.4342999999999 | H40: 83 | I40: 1349.6739 | J40: 52 | K40: 1437.2635 | N40: 4X4 | O40: =+(E40+G40+I40+K40)/(4) -> 1346.6506999999999
A41: 31 | B41: MUHARREM IBRAHIM SEN KARDESLER | C41: TR 199904 | D41: 55 | E41: 1394.8978999999999 | F41: 140 | G41: 1286.4304 | H41: 317 | I41: 1255.9657999999999 | J41: 48 | K41: 1447.3421000000001 | N41: 4X4 | O41: =+(E41+G41+I41+K41)/(4) -> 1346.15905
A42: 32 | B42: SINAN KARATAS | C42: TR 228704 | D42: 481 | E42: 1249.3077000000001 | F42: 152 | G42: 1284.8653999999999 | H42: 52 | I42: 1387.4466 | J42: 42 | K42: 1462.0464999999999 | N42: 4X4 | O42: =+(E42+G42+I42+K42)/(4) -> 1345.9165499999999
A43: 33 | B43: GUNOL & FATIH AYAS YILMAZ | C43: TR 271548 | D43: 85 | E43: 1382.6764000000001 | F43: 168 | G43: 1283.8619000000001 | H43: 263 | I43: 1288.4132999999999 | J43: 62 | K43: 1422.0132000000001 | N43: 4X4 | O43: =+(E43+G43+I43+K43)/(4) -> 1344.2412000000002
A44: 34 | B44: ISA KIRTAY | C44: TR 90003 | D44: 143 | E44: 1358.5295000000001 | F44: 213 | G44: 1275.9154000000001 | H44: 187 | I44: 1318.6351999999999 | J44: 57 | K44: 1423.6587 | N44: 4X4 | O44: =+(E44+G44+I44+K44)/(4) -> 1344.1847
A45: 35 | B45: MALAZGIRT BORU TEAM | C45: TR 90101 | D45: 215 | E45: 1342.1226999999999 | F45: 86 | G45: 1304.0041000000001 | H45: 29 | I45: 1406.4952000000001 | J45: 96 | K45: 1320.0817 | N45: 4X4 | O45: =+(E45+G45+I45+K45)/(4) -> 1343.175925
A46: 36 | B46: ISMAIL UNALDI | C46: TR 98388 | D46: 346 | E46: 1314.7083 | F46: 139 | G46: 1286.7253000000001 | H46: 188 | I46: 1318.5009 | J46: 47 | K46: 1449.021 | N46: 4X4 | O46: =+(E46+G46+I46+K46)/(4) -> 1342.238875
A47: 37 | B47: CEM MERKOZLU | C47: TR 260000 | D47: 487 | E47: 1239.8923 | F47: 55 | G47: 1338.4548 | H47: 20 | I47: 1408.1232 | J47: 89 | K47: 1381.2271000000001 | N47: 4X4 | O47: =+(E47+G47+I47+K47)/(4) -> 1341.92435
A48: 38 | B48: GULUM KARDESLER | C48: TR 258022 | D48: 213 | E48: 1342.393 | F48: 249 | G48: 1253.7760000000001 | H48: 234 | I48: 1301.6532 | J48: 31 | K48: 1467.8133 | N48: 4X4 | O48: =+(E48+G48+I48+K48)/(4) -> 1341.4088749999999
A49: 39 | B49: YUNUS CIRMAN | C49: TR 97708 | D49: 232 | E49: 1339.8510000000001 | F49: 180 | G49: 1282.7074 | H49: 227 | I49: 1305.5424 | J49: 51 | K49: 1437.5160000000001 | N49: 4X4 | O49: =+(E49+G49+I49+K49)/(4) -> 1341.4041999999999
A50: 40 | B50: SULEYMAN OZTURK | C50: TR 212441 | D50: 387 | E50: 1300.5987 | F50: 270 | G50: 1229.4042999999999 | H50: 297 | I50: 1269.7557999999999 | J50: 3 | K50: 1562.3684000000001 | N50: 4X4 | O50: =+(E50+G50+I50+K50)/(4) -> 1340.5318
A51: 41 | B51: TAYYAR BASARAN | C51: TR 206915 | D51: 132 | E51: 1364.4892 | F51: 60 | G51: 1337.6528000000001 | H51: 56 | I51: 1381.4337 | J51: 120 | K51: 1272.3429000000001 | N51: 4X4 | O51: =+(E51+G51+I51+K51)/(4) -> 1338.97965
A52: 42 | B52: RECEP OZTURK | C52: TR 225094 | D52: 496 | E52: 1223.2191 | F52: 77 | G52: 1306.1953000000001 | H52: 112 | I52: 1336.0824 | J52: 24 | K52: 1486.6487 | N52: 4X4 | O52: =+(E52+G52+I52+K52)/(4) -> 1338.0363749999999
A53: 43 | B53: HUSEYIN NURCAN | C53: TR 163950 | D53: 34 | E53: 1402.318 | F53: 130 | G53: 1288.2239999999999 | H53: 27 | I53: 1407.326 | J53: 132 | K53: 1252.5075999999999 | N53: 4X4 | O53: =+(E53+G53+I53+K53)/(4) -> 1337.5939000000001
A54: 44 | B54: ERKAN SIMSEK | C54: TR 82518 | D54: 3 | E54: 1423.9267 | F54: 298 | G54: 1184.9599000000001 | H54: 179 | I54: 1319.4564 | J54: 76 | K54: 1409.7733000000001 | N54: 4X4 | O54: =+(E54+G54+I54+K54)/(4) -> 1334.5290749999999
A55: 45 | B55: YILDIRAY RECEP | C55: TR 96511 | D55: 294 | E55: 1329.0391 | F55: 143 | G55: 1285.9893 | H55: 205 | I55: 1312.1442 | J55: 79 | K55: 1409.1706999999999 | N55: 4X4 | O55: =+(E55+G55+I55+K55)/(4) -> 1334.0858249999999
A56: 46 | B56: BOYABATLI SAIM | C56: TR 37947 | D56: 151 | E56: 1356.9073000000001 | F56: 333 | G56: 1162.0278000000001 | H56: 175 | I56: 1319.6687999999999 | J56: 23 | K56: 1487.3317 | N56: 4X4 | O56: =+(E56+G56+I56+K56)/(4) -> 1331.4838999999999
A57: 47 | B57: IHSAN SARIYER | C57: TR 90131 | D57: 332 | E57: 1319.0581999999999 | F57: 341 | G57: 1141.3788 | H57: 159 | I57: 1322.5751 | J57: 6 | K57: 1541.0814 | N57: 4X4 | O57: =+(E57+G57+I57+K57)/(4) -> 1331.023375
A58: 48 | B58: IBRAHIM UZUN | C58: TR 89312 | D58: 106 | E58: 1373.5445999999999 | F58: 217 | G58: 1275.2035000000001 | H58: 36 | I58: 1402.2727 | J58: 124 | K58: 1264.0733 | N58: 4X4 | O58: =+(E58+G58+I58+K58)/(4) -> 1328.7735250000001
A59: 49 | B59: ZAFER ZAFER | C59: TR 7001 | D59: 239 | E59: 1339.3605 | F59: 198 | G59: 1280.087 | H59: 55 | I59: 1381.6433999999999 | J59: 105 | K59: 1312.9744000000001 | N59: 4X4 | O59: =+(E59+G59+I59+K59)/(4) -> 1328.5163250000001
A60: 50 | B60: NEVZAT CILENTI | C60: TR 270310 | D60: 172 | E60: 1347.9511 | F60: 226 | G60: 1264.7004999999999 | H60: 283 | I60: 1275.1849 | J60: 58 | K60: 1423.6204 | N60: 4X4 | O60: =+(E60+G60+I60+K60)/(4) -> 1327.864225
A61: 51 | B61: CAGLAYAN INSAAT | C61: TR 114317 | D61: 165 | E61: 1349.8039000000001 | F61: 158 | G61: 1284.4648 | H61: 51 | I61: 1389.3172 | J61: 122 | K61: 1271.7602999999999 | N61: 4X4 | O61: =+(E61+G61+I61+K61)/(4) -> 1323.83655
A62: 52 | B62: IBRAHIM HUSEYIN | C62: TR 161141 | D62: 19 | E62: 1408.5300999999999 | F62: 326 | G62: 1172.3715999999999 | H62: 23 | I62: 1407.6516999999999 | J62: 110 | K62: 1297.2047 | N62: 4X4 | O62: =+(E62+G62+I62+K62)/(4) -> 1321.439525
A63: 53 | B63: MUSTAFA ISMET | C63: TR 96108 | D63: 1 | E63: 1426.5640000000001 | F63: 272 | G63: 1222.8131000000001 | H63: 164 | I63: 1321.5382999999999 | J63: 108 | K63: 1308.7738999999999 | N63: 4X4 | O63: =+(E63+G63+I63+K63)/(4) -> 1319.922325
A64: 54 | B64: MURAT OYNAR | C64: TR 212528 | D64: 299 | E64: 1328.2447 | F64: 199 | G64: 1280.0631000000001 | H64: 318 | I64: 1255.7388000000001 | J64: 80 | K64: 1408.809 | N64: 4X4 | O64: =+(E64+G64+I64+K64)/(4) -> 1318.2139
A65: 55 | B65: SERDAR AYDIN EGE POSTA | C65: TR 141880 | D65: 170 | E65: 1349.0391 | F65: 170 | G65: 1283.7623000000001 | H65: 183 | I65: 1318.788 | J65: 94 | K65: 1320.6181999999999 | N65: 4X4 | O65: =+(E65+G65+I65+K65)/(4) -> 1318.0518999999999
A66: 56 | B66: KAMET GIDA | C66: TR 49168 | D66: 5 | E66: 1419.0369000000001 | F66: 42 | G66: 1339.8127999999999 | H66: 133 | I66: 1330.6519000000001 | J66: 163 | K66: 1181.6366 | N66: 4X4 | O66: =+(E66+G66+I66+K66)/(4) -> 1317.7845499999999
A67: 57 | B67: ENGIN KAPTAN | C67: TR 270403 | D67: 88 | E67: 1380.9580000000001 | F67: 178 | G67: 1282.8598999999999 | H67: 150 | I67: 1325.4368999999999 | J67: 119 | K67: 1281.0156999999999 | N67: 4X4 | O67: =+(E67+G67+I67+K67)/(4) -> 1317.5676249999999
A68: 58 | B68: KIVILCIM 1 | C68: TR 90171 | D68: 186 | E68: 1345.6143 | F68: 157 | G68: 1284.5542 | H68: 222 | I68: 1307.3967 | J68: 95 | K68: 1320.2113999999999 | N68: 4X4 | O68: =+(E68+G68+I68+K68)/(4) -> 1314.44415
A69: 59 | B69: BATIN ERAY & TASKAN TENEKE | C69: TR 270529 | D69: 42 | E69: 1399.1591000000001 | F69: 340 | G69: 1147.3167000000001 | H69: 1 | I69: 1422.748 | J69: 114 | K69: 1284.7058 | N69: 4X4 | O69: =+(E69+G69+I69+K69)/(4) -> 1313.4824000000001
A70: 60 | B70: NECO YILDIZ | C70: TR 95018 | D70: 459 | E70: 1272.3995 | F70: 240 | G70: 1258.2655999999999 | H70: 362 | I70: 1134.6776 | J70: 1 | K70: 1587.2862 | N70: 4X4 | O70: =+(E70+G70+I70+K70)/(4) -> 1313.1572249999999
A71: 61 | B71: MEHMET DAVAZ | C71: TR 202016 | D71: 90 | E71: 1380.6148000000001 | F71: 176 | G71: 1283.0245 | H71: 77 | I71: 1353.1356000000001 | J71: 135 | K71: 1229.0314000000001 | N71: 4X4 | O71: =+(E71+G71+I71+K71)/(4) -> 1311.451575
A72: 62 | B72: CAN KARDESLER KADIR | C72: TR 119062 | D72: 54 | E72: 1395.0600999999999 | F72: 122 | G72: 1291.0306 | H72: 140 | I72: 1329.7953 | J72: 137 | K72: 1228.7058 | N72: 4X4 | O72: =+(E72+G72+I72+K72)/(4) -> 1311.1479499999998
A73: 63 | B73: SOSYETE KUAFOR | C73: TR 163158 | D73: 219 | E73: 1341.4926 | F73: 328 | G73: 1167.8008 | H73: 174 | I73: 1319.8495 | J73: 75 | K73: 1409.9014 | N73: 4X4 | O73: =+(E73+G73+I73+K73)/(4) -> 1309.7610749999999
A74: 64 | B74: BAYRAKLI ASMEL | C74: TR 216164 | D74: 309 | E74: 1326.9081000000001 | F74: 164 | G74: 1284.0936999999999 | H74: 192 | I74: 1317.9637 | J74: 107 | K74: 1308.9824000000001 | N74: 4X4 | O74: =+(E74+G74+I74+K74)/(4) -> 1309.486975
A75: 65 | B75: GUNEY KEBAP MURAT YILDIRIM | C75: TR 102413 | D75: 236 | E75: 1339.6745000000001 | F75: 397 | G75: 956.49639999999999 | H75: 43 | I75: 1398.3879999999999 | J75: 9 | K75: 1538.3656000000001 | N75: 4X4 | O75: =+(E75+G75+I75+K75)/(4) -> 1308.231125
A76: 66 | B76: ADEM AHMET | C76: TR 166243 | D76: 128 | E76: 1365.9522999999999 | F76: 172 | G76: 1283.6334999999999 | H76: 78 | I76: 1352.5545999999999 | J76: 136 | K76: 1228.8711000000001 | N76: 4X4 | O76: =+(E76+G76+I76+K76)/(4) -> 1307.7528749999999
A77: 67 | B77: ONBASI POSTA | C77: TR 16871 | D77: 356 | E77: 1310.9482 | F77: 182 | G77: 1282.6027999999999 | H77: 338 | I77: 1217.8064999999999 | J77: 67 | K77: 1419.4431 | N77: 4X4 | O77: =+(E77+G77+I77+K77)/(4) -> 1307.7001500000001
A78: 68 | B78: MEHMET BULDUK | C78: TR 77309 | D78: 524 | E78: 1107.2275999999999 | F78: 12 | G78: 1360.5404000000001 | H78: 106 | I78: 1338.4966999999999 | J78: 66 | K78: 1421.1319000000001 | N78: 4X4 | O78: =+(E78+G78+I78+K78)/(4) -> 1306.84915
A79: 69 | B79: SERKAN AYDOGAN | C79: TR 155103 | D79: 463 | E79: 1270.1692 | F79: 289 | G79: 1198.3149000000001 | H79: 143 | I79: 1328.9572000000001 | J79: 55 | K79: 1428.9842000000001 | N79: 4X4 | O79: =+(E79+G79+I79+K79)/(4) -> 1306.6063750000001
A80: 70 | B80: IHSAN SARIYER | C80: TR 90177 | D80: 225 | E80: 1340.89 | F80: 84 | G80: 1304.8194000000001 | H80: 307 | I80: 1263.3658 | J80: 106 | K80: 1312.7168999999999 | N80: 4X4 | O80: =+(E80+G80+I80+K80)/(4) -> 1305.4480250000001
A81: 71 | B81: MEKKELI MEHMET GUCLU | C81: TR 92213 | D81: 431 | E81: 1284.626 | F81: 320 | G81: 1174.6438000000001 | H81: 251 | I81: 1295.2655999999999 | J81: 33 | K81: 1465.6380999999999 | N81: 4X4 | O81: =+(E81+G81+I81+K81)/(4) -> 1305.043375
A82: 72 | B82: UC KARDESLER | C82: TR 78803 | D82: 415 | E82: 1290.4697000000001 | F82: 173 | G82: 1283.3263999999999 | H82: 149 | I82: 1325.8829000000001 | J82: 103 | K82: 1317.9996000000001 | N82: 4X4 | O82: =+(E82+G82+I82+K82)/(4) -> 1304.41965
A83: 73 | B83: SALIH CALISKAN | C83: TR 115513 | D83: 449 | E83: 1277.0441000000001 | F83: 321 | G83: 1174.3535999999999 | H83: 287 | I83: 1272.5651 | J83: 16 | K83: 1491.2093 | N83: 4X4 | O83: =+(E83+G83+I83+K83)/(4) -> 1303.7930249999999
A84: 74 | B84: HUSEYIN NURCAN | C84: TR 163978 | D84: 187 | E84: 1345.6052999999999 | F84: 4 | G84: 1367.1202000000001 | H84: 221 | I84: 1307.5884000000001 | J84: 162 | K84: 1182.4004 | N84: 4X4 | O84: =+(E84+G84+I84+K84)/(4) -> 1300.6785749999999
A85: 75 | B85: ISMAIL YUNUS TASCI | C85: TR 91611 | D85: 426 | E85: 1286.4991 | F85: 195 | G85: 1280.6267 | H85: 82 | I85: 1350.0287000000001 | J85: 117 | K85: 1283.7163 | N85: 4X4 | O85: =+(E85+G85+I85+K85)/(4) -> 1300.2176999999999
A86: 76 | B86: KASAP OSMAN | C86: TR 66505 | D86: 169 | E86: 1349.2272 | F86: 293 | G86: 1197.8842 | H86: 141 | I86: 1329.2382 | J86: 102 | K86: 1318.1174000000001 | N86: 4X4 | O86: =+(E86+G86+I86+K86)/(4) -> 1298.6167499999999
A87: 77 | B87: MEHMET BULDUK | C87: TR 77326 | D87: 308 | E87: 1326.961 | F87: 121 | G87: 1291.3015 | H87: 6 | I87: 1415.0473 | J87: 168 | K87: 1160.6980000000001 | N87: 4X4 | O87: =+(E87+G87+I87+K87)/(4) -> 1298.5019500000001
A88: 78 | B88: FATIH ISMAIL OZPIRINCI | C88: TR 113102 | D88: 395 | E88: 1297.9456 | F88: 336 | G88: 1151.5057999999999 | H88: 302 | I88: 1266.0632000000001 | J88: 28 | K88: 1470.5198 | N88: 4X4 | O88: =+(E88+G88+I88+K88)/(4) -> 1296.5086000000001
A89: 79 | B89: YUNUS DEMIR | C89: TR 93202 | D89: 418 | E89: 1289.0528999999999 | F89: 129 | G89: 1289.2967000000001 | H89: 74 | I89: 1371.5369000000001 | J89: 134 | K89: 1235.5017 | N89: 4X4 | O89: =+(E89+G89+I89+K89)/(4) -> 1296.3470500000001
A90: 80 | B90: SERDAR AYDIN EGE POSTA | C90: TR 141868 | D90: 520 | E90: 1148.0968 | F90: 245 | G90: 1256.0791999999999 | H90: 266 | I90: 1288.2095999999999 | J90: 19 | K90: 1489.2637 | N90: 4X4 | O90: =+(E90+G90+I90+K90)/(4) -> 1295.4123249999998
A91: 81 | B91: TEK ATAR ETEM | C91: TR 33417 | D91: 212 | E91: 1342.3989999999999 | F91: 188 | G91: 1281.5721000000001 | H91: 110 | I91: 1336.376 | J91: 150 | K91: 1221.2257 | N91: 4X4 | O91: =+(E91+G91+I91+K91)/(4) -> 1295.3932
A92: 82 | B92: TAYYAR BASARAN | C92: TR 206909 | D92: 31 | E92: 1402.5736999999999 | F92: 57 | G92: 1338.1823999999999 | H92: 213 | I92: 1309.6953000000001 | J92: 172 | K92: 1123.4384 | N92: 4X4 | O92: =+(E92+G92+I92+K92)/(4) -> 1293.47245
A93: 83 | B93: EMRE KARAN | C93: TR 93584 | D93: 305 | E93: 1327.1283000000001 | F93: 163 | G93: 1284.1487 | H93: 371 | I93: 1067.6925000000001 | J93: 15 | K93: 1494.9185 | N93: 4X4 | O93: =+(E93+G93+I93+K93)/(4) -> 1293.472
A94: 84 | B94: YUSUF KARAKURT | C94: TR 27165 | D94: 302 | E94: 1327.6597999999999 | F94: 228 | G94: 1262.5117 | H94: 165 | I94: 1321.4866999999999 | J94: 130 | K94: 1262.134 | N94: 4X4 | O94: =+(E94+G94+I94+K94)/(4) -> 1293.44805
A95: 85 | B95: BULENT SAFAK CIT | C95: TR 115867 | D95: 122 | E95: 1369.1159 | F95: 150 | G95: 1285.2557999999999 | H95: 117 | I95: 1332.8594000000001 | J95: 158 | K95: 1184.6602 | N95: 4X4 | O95: =+(E95+G95+I95+K95)/(4) -> 1292.9728250000001
A96: 86 | B96: KIVANC KARDESLER | C96: TR 170441 | D96: 276 | E96: 1332.1492000000001 | F96: 205 | G96: 1278.8984 | H96: 264 | I96: 1288.3264999999999 | J96: 125 | K96: 1263.2173 | N96: 4X4 | O96: =+(E96+G96+I96+K96)/(4) -> 1290.6478500000001
A97: 87 | B97: ERCAN KOC | C97: TR 74605 | D97: 111 | E97: 1372.0244 | F97: 125 | G97: 1289.8909000000001 | H97: 276 | I97: 1285.4009000000001 | J97: 152 | K97: 1213.5193999999999 | N97: 4X4 | O97: =+(E97+G97+I97+K97)/(4) -> 1290.2089000000001
A98: 88 | B98: DEVRIM AZMAN | C98: TR 76681 | D98: 450 | E98: 1276.9843000000001 | F98: 102 | G98: 1296.5771999999999 | H98: 308 | I98: 1262.4536000000001 | J98: 99 | K98: 1319.8794 | N98: 4X4 | O98: =+(E98+G98+I98+K98)/(4) -> 1288.9736249999999
A99: 89 | B99: NATURAL YEM | C99: TR 73336 | D99: 120 | E99: 1369.4159 | F99: 214 | G99: 1275.6712 | H99: 352 | I99: 1186.9595999999999 | J99: 104 | K99: 1317.7227 | N99: 4X4 | O99: =+(E99+G99+I99+K99)/(4) -> 1287.44235
A100: 90 | B100: HIMER GIDA | C100: TR 64404 | D100: 251 | E100: 1336.7285999999999 | F100: 248 | G100: 1253.9087 | H100: 271 | I100: 1287.0716 | J100: 121 | K100: 1272.0282 | N100: 4X4 | O100: =+(E100+G100+I100+K100)/(4) -> 1287.4342749999998
A101: 91 | B101: TRAKYA POSTA OGUN CEM KOSE | C101: TR 207083 | D101: 269 | E101: 1333.5673999999999 | F101: 352 | G101: 1120.6207999999999 | H101: 15 | I101: 1409.8949 | J101: 115 | K101: 1284.1916000000001 | N101: 4X4 | O101: =+(E101+G101+I101+K101)/(4) -> 1287.068675
A102: 92 | B102: CAKIR NIHAT | C102: TR 95502 | D102: 178 | E102: 1347.2308 | F102: 358 | G102: 1086.4792 | H102: 218 | I102: 1308.3855000000001 | J102: 82 | K102: 1405.9314999999999 | N102: 4X4 | O102: =+(E102+G102+I102+K102)/(4) -> 1287.00675
A103: 93 | B103: KENAN YIRAL | C103: TR 272201 | D103: 401 | E103: 1294.6772000000001 | F103: 312 | G103: 1176.7806 | H103: 290 | I103: 1272.1531 | J103: 83 | K103: 1401.6519000000001 | N103: 4X4 | O103: =+(E103+G103+I103+K103)/(4) -> 1286.3157000000001
A104: 94 | B104: TASKAN TENEKE | C104: TR 10902 | D104: 150 | E104: 1357.3279 | F104: 181 | G104: 1282.7057 | H104: 155 | I104: 1323.0841 | J104: 164 | K104: 1180.0346 | N104: 4X4 | O104: =+(E104+G104+I104+K104)/(4) -> 1285.7880749999999
A105: 95 | B105: BEYKOZ ARENA POSTA TAHIR AK | C105: TR 137002 | D105: 360 | E105: 1309.4861000000001 | F105: 59 | G105: 1337.7759000000001 | H105: 125 | I105: 1331.3081 | J105: 170 | K105: 1160.3589999999999 | N105: 4X4 | O105: =+(E105+G105+I105+K105)/(4) -> 1284.7322749999998
A106: 96 | B106: ZAFER ZAFER | C106: TR 7060 | D106: 306 | E106: 1327.0197000000001 | F106: 264 | G106: 1233.4338 | H106: 313 | I106: 1260.0145 | J106: 101 | K106: 1318.1251 | N106: 4X4 | O106: =+(E106+G106+I106+K106)/(4) -> 1284.648275
A107: 97 | B107: HUSEYIN DEMIR KIRAZ | C107: TR 162108 | D107: 173 | E107: 1347.8571999999999 | F107: 357 | G107: 1089.3098 | H107: 294 | I107: 1270.3692000000001 | J107: 54 | K107: 1429.5858000000001 | N107: 4X4 | O107: =+(E107+G107+I107+K107)/(4) -> 1284.2805000000001
A108: 98 | B108: SEYIT MUSTAFA YILDIZ | C108: TR 136147 | D108: 297 | E108: 1328.4917 | F108: 257 | G108: 1242.6927000000001 | H108: 72 | I108: 1374.8753999999999 | J108: 157 | K108: 1190.9393 | N108: 4X4 | O108: =+(E108+G108+I108+K108)/(4) -> 1284.249775
A109: 99 | B109: ISMAIL TOLON | C109: TR 210558 | D109: 348 | E109: 1314.1208999999999 | F109: 197 | G109: 1280.3022000000001 | H109: 170 | I109: 1320.6392000000001 | J109: 149 | K109: 1221.3914 | N109: 4X4 | O109: =+(E109+G109+I109+K109)/(4) -> 1284.113425
A110: 100 | B110: IBRAHIM TOPCU | C110: TR 9885 | D110: 18 | E110: 1409.0461 | F110: 100 | G110: 1297.8778 | H110: 80 | I110: 1350.4527 | J110: 177 | K110: 1077.0227 | N110: 4X4 | O110: =+(E110+G110+I110+K110)/(4) -> 1283.5998249999998
A111: 101 | B111: ERKAN DORUK | C111: TR 217148 | D111: 393 | E111: 1298.3584000000001 | F111: 379 | G111: 987.73159999999996 | H111: 243 | I111: 1297.5880999999999 | J111: 8 | K111: 1538.9087 | N111: 4X4 | O111: =+(E111+G111+I111+K111)/(4) -> 1280.6467
A112: 102 | B112: SINAN KARATAS | C112: TR 228701 | D112: 102 | E112: 1376.2446 | F112: 211 | G112: 1276.7706000000001 | H112: 223 | I112: 1307.2076999999999 | J112: 167 | K112: 1161.1907000000001 | N112: 4X4 | O112: =+(E112+G112+I112+K112)/(4) -> 1280.3534
A113: 103 | B113: YUSUF KARAKURT | C113: TR 27230 | D113: 80 | E113: 1385.9277999999999 | F113: 131 | G113: 1287.9682 | H113: 145 | I113: 1327.5832 | J113: 174 | K113: 1113.6614999999999 | N113: 4X4 | O113: =+(E113+G113+I113+K113)/(4) -> 1278.785175
A114: 104 | B114: DADAS 1453 | C114: TR 51812 | D114: 72 | E114: 1388.6959999999999 | F114: 348 | G114: 1123.9322999999999 | H114: 216 | I114: 1309.1965 | J114: 112 | K114: 1290.3198 | N114: 4X4 | O114: =+(E114+G114+I114+K114)/(4) -> 1278.0361499999999
A115: 105 | B115: AKUCU HUSEYIN | C115: TR 96284 | D115: 497 | E115: 1217.8142 | F115: 308 | G115: 1177.7465 | H115: 324 | I115: 1247.1489999999999 | J115: 32 | K115: 1466.8791000000001 | N115: 4X4 | O115: =+(E115+G115+I115+K115)/(4) -> 1277.3971999999999
A116: 106 | B116: MAHMUT MADEN | C116: TR 162342 | D116: 443 | E116: 1280.6748 | F116: 194 | G116: 1280.9582 | H116: 193 | I116: 1317.6441 | J116: 140 | K116: 1226.0019 | N116: 4X4 | O116: =+(E116+G116+I116+K116)/(4) -> 1276.3197499999999
A117: 107 | B117: NECO YILDIZ | C117: TR 95020 | D117: 277 | E117: 1332.0072 | F117: 237 | G117: 1259.4326000000001 | H117: 231 | I117: 1302.9367 | J117: 154 | K117: 1207.7351000000001 | N117: 4X4 | O117: =+(E117+G117+I117+K117)/(4) -> 1275.5279
A118: 108 | B118: OMER DURAK MAHMUT AKKOYUN | C118: TR 222468 | D118: 507 | E118: 1203.4853000000001 | F118: 167 | G118: 1283.922 | H118: 65 | I118: 1378.3957 | J118: 138 | K118: 1228.6086 | N118: 4X4 | O118: =+(E118+G118+I118+K118)/(4) -> 1273.6028999999999
A119: 109 | B119: ISIK PETROL | C119: TR 166001 | D119: 438 | E119: 1282.1252999999999 | F119: 253 | G119: 1250.7784999999999 | H119: 238 | I119: 1299.8880999999999 | J119: 131 | K119: 1260.4088999999999 | N119: 4X4 | O119: =+(E119+G119+I119+K119)/(4) -> 1273.3002000000001
A120: 110 | B120: SEDAT CERIT | C120: TR 64112 | D120: 228 | E120: 1340.3417999999999 | F120: 390 | G120: 975.42439999999999 | H120: 230 | I120: 1303.7642000000001 | J120: 30 | K120: 1469.0352 | N120: 4X4 | O120: =+(E120+G120+I120+K120)/(4) -> 1272.1414
A121: 111 | B121: BATIN ERAY & TASKAN TENEKE | C121: TR 10907 | D121: 109 | E121: 1372.4575 | F121: 373 | G121: 999.35770000000002 | H121: 358 | I121: 1163.7985000000001 | J121: 4 | K121: 1551.4940999999999 | N121: 4X4 | O121: =+(E121+G121+I121+K121)/(4) -> 1271.7769499999999
A122: 112 | B122: DURALI BALIM | C122: TR 211900 | D122: 84 | E122: 1383.4384 | F122: 262 | G122: 1236.0509999999999 | H122: 90 | I122: 1347.4915000000001 | J122: 173 | K122: 1119.0425 | N122: 4X4 | O122: =+(E122+G122+I122+K122)/(4) -> 1271.50585
A123: 113 | B123: MUSTAFA YILDIRIM | C123: TR 64203 | D123: 154 | E123: 1354.57 | F123: 362 | G123: 1051.2874999999999 | H123: 135 | I123: 1330.4358999999999 | J123: 93 | K123: 1324.8815999999999 | N123: 4X4 | O123: =+(E123+G123+I123+K123)/(4) -> 1265.29375
A124: 114 | B124: KENAN USLU | C124: TR 214135 | D124: 100 | E124: 1377.7299 | F124: 166 | G124: 1283.9631999999999 | H124: 380 | I124: 994.83510000000001 | J124: 85 | K124: 1400.7248 | N124: 4X4 | O124: =+(E124+G124+I124+K124)/(4) -> 1264.3132499999999
A125: 115 | B125: MUSTAFA HALIL IBO TEAM | C125: TR 65601 | D125: 495 | E125: 1228.5893000000001 | F125: 85 | G125: 1304.3514 | H125: 168 | I125: 1321.0039999999999 | J125: 156 | K125: 1193.3143 | N125: 4X4 | O125: =+(E125+G125+I125+K125)/(4) -> 1261.81475
A126: 116 | B126: CIMBOMLU SECO | C126: TR 172514 | D126: 283 | E126: 1330.6660999999999 | F126: 389 | G126: 976.62710000000004 | H126: 212 | I126: 1310.3570999999999 | J126: 60 | K126: 1422.5414000000001 | N126: 4X4 | O126: =+(E126+G126+I126+K126)/(4) -> 1260.0479250000001
A127: 117 | B127: MUHARREM HUSEYIN | C127: TR 40002 | D127: 265 | E127: 1334.665 | F127: 385 | G127: 979.59879999999998 | H127: 229 | I127: 1304.2575999999999 | J127: 64 | K127: 1421.4989 | N127: 4X4 | O127: =+(E127+G127+I127+K127)/(4) -> 1260.005075
A128: 118 | B128: OMER DURAK MAHMUT AKKOYUN | C128: TR 222467 | D128: 359 | E128: 1309.489 | F128: 284 | G128: 1206.3969 | H128: 315 | I128: 1258.0043000000001 | J128: 129 | K128: 1262.1659 | N128: 4X4 | O128: =+(E128+G128+I128+K128)/(4) -> 1259.0140249999999
A129: 119 | B129: TEK ATAR ETEM | C129: TR 33430 | D129: 243 | E129: 1338.1059 | F129: 108 | G129: 1294.6904 | H129: 384 | I129: 946.0806 | J129: 49 | K129: 1446.7674 | N129: 4X4 | O129: =+(E129+G129+I129+K129)/(4) -> 1256.411075
A130: 120 | B130: F.CANKAYA E.ALTAN E.FIDAN | C130: TR 202155 | D130: 375 | E130: 1304.6626000000001 | F130: 200 | G130: 1279.8891000000001 | H130: 327 | I130: 1245.357 | J130: 161 | K130: 1182.5363 | N130: 4X4 | O130: =+(E130+G130+I130+K130)/(4) -> 1253.1112499999999
A131: 121 | B131: TRAKYA POSTA OGUN CEM KOSE | C131: TR 207102 | D131: 140 | E131: 1359.9121 | F131: 382 | G131: 982.68830000000003 | H131: 331 | I131: 1241.0482 | J131: 68 | K131: 1419.4060999999999 | N131: 4X4 | O131: =+(E131+G131+I131+K131)/(4) -> 1250.7636750000001
A132: 122 | B132: ERCAN KOC | C132: TR 74606 | D132: 315 | E132: 1325.2844 | F132: 96 | G132: 1298.8507 | H132: 62 | I132: 1379.5641000000001 | J132: 182 | K132: 998.2962 | N132: 4X4 | O132: =+(E132+G132+I132+K132)/(4) -> 1250.4988499999999
A133: 123 | B133: NEVZAT CILENTI | C133: TR 270313 | D133: 457 | E133: 1272.6424 | F133: 370 | G133: 1012.5119 | H133: 319 | I133: 1255.6433 | J133: 44 | K133: 1459.7605000000001 | N133: 4X4 | O133: =+(E133+G133+I133+K133)/(4) -> 1250.139525
A134: 124 | B134: 15 RECION FRANCE OZKAN KRDSLR | C134: FR 148803 | D134: 289 | E134: 1329.3777 | F134: 354 | G134: 1109.1585 | H134: 274 | I134: 1286.0156999999999 | J134: 127 | K134: 1263.0054 | N134: 4X4 | O134: =+(E134+G134+I134+K134)/(4) -> 1246.8893250000001
A135: 125 | B135: FERIT DEMIR | C135: TR 92722 | D135: 11 | E135: 1410.8716999999999 | F135: 399 | G135: 955.13930000000005 | H135: 244 | I135: 1297.5562 | J135: 97 | K135: 1320.0003999999999 | N135: 4X4 | O135: =+(E135+G135+I135+K135)/(4) -> 1245.8919000000001
A136: 126 | B136: SANATCI HACI SEVINC | C136: TR 246713 | D136: 502 | E136: 1205.3905 | F136: 64 | G136: 1317.3441 | H136: 88 | I136: 1348.2334000000001 | J136: 175 | K136: 1106.7184 | N136: 4X4 | O136: =+(E136+G136+I136+K136)/(4) -> 1244.4215999999999
A137: 127 | B137: AYDIN ARENA FATIH | C137: TR 265620 | D137: 366 | E137: 1308.1899000000001 | F137: 412 | G137: 865.69159999999999 | H137: 153 | I137: 1324.7665 | J137: 40 | K137: 1462.9591 | N137: 4X4 | O137: =+(E137+G137+I137+K137)/(4) -> 1240.401775
A138: 128 | B138: KASAP OSMAN | C138: TR 66508 | D138: 161 | E138: 1351.3543999999999 | F138: 303 | G138: 1182.1146000000001 | H138: 357 | I138: 1163.8087 | J138: 123 | K138: 1264.2384999999999 | N138: 4X4 | O138: =+(E138+G138+I138+K138)/(4) -> 1240.37905
A139: 129 | B139: BURHAN BILIR | C139: TR 271502 | D139: 368 | E139: 1307.3462 | F139: 323 | G139: 1173.4808 | H139: 178 | I139: 1319.5065 | J139: 171 | K139: 1158.8485000000001 | N139: 4X4 | O139: =+(E139+G139+I139+K139)/(4) -> 1239.7955000000002
A140: 130 | B140: SANATCI HACI SEVINC | C140: TR 246704 | D140: 164 | E140: 1349.9619 | F140: 383 | G140: 982.50120000000004 | H140: 278 | I140: 1284.9829 | J140: 109 | K140: 1308.4086 | N140: 4X4 | O140: =+(E140+G140+I140+K140)/(4) -> 1231.4636499999999
A141: 131 | B141: YILDIRAY RECEP | C141: TR 96506 | D141: 410 | E141: 1292.4014999999999 | F141: 290 | G141: 1198.2491 | H141: 323 | I141: 1247.3576 | J141: 165 | K141: 1165.5101999999999 | N141: 4X4 | O141: =+(E141+G141+I141+K141)/(4) -> 1225.8796
A142: 132 | B142: ERCAN KOC | C142: TR 74602 | D142: 475 | E142: 1257.3897999999999 | F142: 148 | G142: 1285.4951000000001 | H142: 93 | I142: 1342.6410000000001 | J142: 181 | K142: 1008.2712 | N142: 4X4 | O142: =+(E142+G142+I142+K142)/(4) -> 1223.4492749999999
A143: 133 | B143: FATIH CAGLAR | C143: TR 135378 | D143: 4 | E143: 1422.5932 | F143: 119 | G143: 1291.7340999999999 | H143: 325 | I143: 1245.7425000000001 | J143: 186 | K143: 916.44749999999999 | N143: 4X4 | O143: =+(E143+G143+I143+K143)/(4) -> 1219.1293250000001
A144: 134 | B144: BY CULIYAS GUZELDEMIRCI KRDSLR | C144: TR 200330 | D144: 91 | E144: 1380.4401 | F144: 386 | G144: 979.52089999999998 | H144: 267 | I144: 1288.1416999999999 | J144: 148 | K144: 1221.5853999999999 | N144: 4X4 | O144: =+(E144+G144+I144+K144)/(4) -> 1217.4220250000001
A145: 135 | B145: ISMAIL MURAT OLGUNER | C145: TR 271968 | D145: 133 | E145: 1364.3216 | F145: 229 | G145: 1262.4369999999999 | H145: 348 | I145: 1195.9425000000001 | J145: 178 | K145: 1039.4626000000001 | N145: 4X4 | O145: =+(E145+G145+I145+K145)/(4) -> 1215.540925
A146: 136 | B146: ENGIN KAPTAN | C146: TR 270408 | D146: 284 | E146: 1330.6070999999999 | F146: 367 | G146: 1045.64 | H146: 172 | I146: 1320.1294 | J146: 166 | K146: 1165.3284000000001 | N146: 4X4 | O146: =+(E146+G146+I146+K146)/(4) -> 1215.4262250000002
A147: 137 | B147: AHMET MALTAS | C147: TR 92525 | D147: 493 | E147: 1229.5535 | F147: 369 | G147: 1015.3079 | H147: 130 | I147: 1331.0316 | J147: 116 | K147: 1284.0643 | N147: 4X4 | O147: =+(E147+G147+I147+K147)/(4) -> 1214.989325
A148: 138 | B148: UMUT YILMAZ | C148: TR 99601 | D148: 14 | E148: 1410.4671000000001 | F148: 353 | G148: 1109.5546999999999 | H148: 142 | I148: 1328.9946 | J148: 183 | K148: 998.09529999999995 | N148: 4X4 | O148: =+(E148+G148+I148+K148)/(4) -> 1211.7779249999999
A149: 139 | B149: GUNOL & FATIH AYAS YILMAZ | C149: TR 271554 | D149: 337 | E149: 1317.9802999999999 | F149: 105 | G149: 1296.4091000000001 | H149: 201 | I149: 1314.6808000000001 | J149: 187 | K149: 915.84550000000002 | N149: 4X4 | O149: =+(E149+G149+I149+K149)/(4) -> 1211.2289250000001
A150: 140 | B150: ERCAN KOC | C150: TR 74604 | D150: 95 | E150: 1379.4974 | F150: 427 | G150: 637.75210000000004 | H150: 246 | I150: 1296.7900999999999 | J150: 21 | K150: 1487.7681 | N150: 4X4 | O150: =+(E150+G150+I150+K150)/(4) -> 1200.4519250000001
A151: 141 | B151: KENAN SIMSEK | C151: TR 137937 | D151: 259 | E151: 1335.4730999999999 | F151: 405 | G151: 902.8768 | H151: 99 | I151: 1340.5492999999999 | J151: 146 | K151: 1222.1768 | N151: 4X4 | O151: =+(E151+G151+I151+K151)/(4) -> 1200.269
A152: 142 | B152: YUSUF KARAKURT | C152: TR 27216 | D152: 28 | E152: 1403.7879 | F152: 365 | G152: 1050.0123000000001 | H152: 176 | I152: 1319.6186 | J152: 179 | K152: 1021.7247 | N152: 4X4 | O152: =+(E152+G152+I152+K152)/(4) -> 1198.785875
A153: 143 | B153: NECO YILDIZ | C153: TR 95017 | D153: 185 | E153: 1345.7018 | F153: 395 | G153: 957.56590000000006 | H153: 305 | I153: 1263.9380000000001 | J153: 143 | K153: 1225.2574999999999 | N153: 4X4 | O153: =+(E153+G153+I153+K153)/(4) -> 1198.1158
A154: 144 | B154: RIDVAN MOLLAOGLU | C154: TR 211641 | D154: 197 | E154: 1344.4052999999999 | F154: 404 | G154: 903.51919999999996 | H154: 163 | I154: 1321.6971000000001 | J154: 147 | K154: 1221.6294 | N154: 4X4 | O154: =+(E154+G154+I154+K154)/(4) -> 1197.8127500000001
A155: 145 | B155: MALAZGIRT BORU TEAM | C155: TR 90113 | D155: 89 | E155: 1380.7927 | F155: 154 | G155: 1284.8035 | H155: 322 | I155: 1247.9613999999999 | J155: 191 | K155: 812.15309999999999 | N155: 4X4 | O155: =+(E155+G155+I155+K155)/(4) -> 1181.4276749999999
A156: 146 | B156: ARIF KARADAGLAR BULENT SAFAK CIT | C156: TR 113013 | D156: 286 | E156: 1329.8786 | F156: 254 | G156: 1250.3403000000001 | H156: 228 | I156: 1305.4766 | J156: 190 | K156: 826.13490000000002 | N156: 4X4 | O156: =+(E156+G156+I156+K156)/(4) -> 1177.9576
A157: 147 | B157: FESIH UNAL | C157: TR 127506 | D157: 389 | E157: 1299.9816000000001 | F157: 292 | G157: 1197.9604999999999 | H157: 206 | I157: 1311.9434000000001 | J157: 188 | K157: 875.42380000000003 | N157: 4X4 | O157: =+(E157+G157+I157+K157)/(4) -> 1171.3273250000002
A158: 148 | B158: KIRKPINAR ARENA | C158: TR 63014 | D158: 160 | E158: 1351.4609 | F158: 413 | G158: 860.87459999999999 | H158: 334 | I158: 1235.7548999999999 | J158: 144 | K158: 1224.0309999999999 | N158: 4X4 | O158: =+(E158+G158+I158+K158)/(4) -> 1168.03035
A159: 149 | B159: TANER DERBY 17 | C159: TR 16122 | D159: 27 | E159: 1404.3892000000001 | F159: 118 | G159: 1291.8418999999999 | H159: 225 | I159: 1307.0252 | J159: 192 | K159: 662.93340000000001 | N159: 4X4 | O159: =+(E159+G159+I159+K159)/(4) -> 1166.547425
A160: 150 | B160: YUSUF KARAKURT | C160: TR 27101 | D160: 373 | E160: 1305.9888000000001 | F160: 418 | G160: 756.18179999999995 | H160: 189 | I160: 1318.4586999999999 | J160: 128 | K160: 1262.7909999999999 | N160: 4X4 | O160: =+(E160+G160+I160+K160)/(4) -> 1160.8550749999999
A161: 151 | B161: OSMAN ALTAS | C161: TR 34810 | D161: 45 | E161: 1398.2624000000001 | F161: 9 | G161: 1361.9571000000001 | H161: 45 | I161: 1397.0353 | J161: 199 | K161: 429.92489999999998 | N161: 4X4 | O161: =+(E161+G161+I161+K161)/(4) -> 1146.7949250000001
A162: 152 | B162: CAN KARDESLER KADIR | C162: TR 172307 | D162: 468 | E162: 1263.2748999999999 | F162: 393 | G162: 958.97490000000005 | H162: 303 | I162: 1265.4781 | J162: 176 | K162: 1085.4822999999999 | N162: 4X4 | O162: =+(E162+G162+I162+K162)/(4) -> 1143.3025499999999
A163: 153 | B163: ENGIN YILDIZ | C163: TR 216012 | D163: 241 | E163: 1338.8076000000001 | F163: 78 | G163: 1306.1918000000001 | H163: 385 | I163: 895.77700000000004 | J163: 184 | K163: 992.2133 | N163: 4X4 | O163: =+(E163+G163+I163+K163)/(4) -> 1133.247425
A164: 154 | B164: EMRE KARAN | C164: TR 93582 | D164: 224 | E164: 1340.9319 | F164: 411 | G164: 882.93240000000003 | H164: 373 | I164: 1063.9464 | J164: 141 | K164: 1225.6846 | N164: 4X4 | O164: =+(E164+G164+I164+K164)/(4) -> 1128.3738250000001
A165: 155 | B165: HASAN GUNDOGAN | C165: TR 270979 | D165: 273 | E165: 1332.9038 | F165: 433 | G165: 590.4633 | H165: 232 | I165: 1302.9072000000001 | J165: 113 | K165: 1285.4453000000001 | N165: 4X4 | O165: =+(E165+G165+I165+K165)/(4) -> 1127.9299000000001
A166: 156 | B166: SAMPIYON GOKHAN TUNCA MIKI | C166: TR 42830 | D166: 36 | E166: 1402.2720999999999 | F166: 54 | G166: 1338.7198000000001 | H166: 103 | I166: 1339.1932999999999 | J166: 201 | K166: 426.1078 | N166: 4X4 | O166: =+(E166+G166+I166+K166)/(4) -> 1126.5732499999999
A167: 157 | B167: TEK ATAR ETEM | C167: TR 33423 | D167: 98 | E167: 1378.116 | F167: 99 | G167: 1297.9445000000001 | H167: 69 | I167: 1376.9837 | J167: 198 | K167: 438.56479999999999 | N167: 4X4 | O167: =+(E167+G167+I167+K167)/(4) -> 1122.9022500000001
A168: 158 | B168: CAN KARDESLER KADIR | C168: TR 119075 | D168: 362 | E168: 1309.289 | F168: 346 | G168: 1124.6802 | H168: 388 | I168: 842.9 | J168: 153 | K168: 1210.3493000000001 | N168: 4X4 | O168: =+(E168+G168+I168+K168)/(4) -> 1121.804625
A169: 159 | B169: SERKAN CIFTCI | C169: TR 114842 | D169: 345 | E169: 1315.0482999999999 | F169: 52 | G169: 1338.8991000000001 | H169: 97 | I169: 1341.0328 | J169: 197 | K169: 486.28550000000001 | N169: 4X4 | O169: =+(E169+G169+I169+K169)/(4) -> 1120.316425
A170: 160 | B170: YILDIRAY RECEP | C170: TR 96507 | D170: 499 | E170: 1213.3835999999999 | F170: 425 | G170: 652.78679999999997 | H170: 347 | I170: 1196.7122999999999 | J170: 78 | K170: 1409.3262999999999 | N170: 4X4 | O170: =+(E170+G170+I170+K170)/(4) -> 1118.05225
A171: 161 | B171: SENER KAYACAN | C171: TR 170452 | D171: 363 | E171: 1309.0433 | F171: 441 | G171: 397.05369999999999 | H171: 353 | I171: 1186.6907000000001 | J171: 5 | K171: 1547.0708999999999 | N171: 4X4 | O171: =+(E171+G171+I171+K171)/(4) -> 1109.9646499999999
A172: 162 | B172: FERIT DEMIR | C172: TR 92723 | D172: 518 | E172: 1162.1826000000001 | F172: 24 | G172: 1349.5219999999999 | H172: 86 | I172: 1348.3215 | J172: 194 | K172: 510.06920000000002 | N172: 4X4 | O172: =+(E172+G172+I172+K172)/(4) -> 1092.523825
A173: 163 | B173: GOKHAN SOYTURK | C173: TR 34415 | D173: 211 | E173: 1342.4349999999999 | F173: 426 | G173: 639.50890000000004 | H173: 383 | I173: 963.04250000000002 | J173: 77 | K173: 1409.7336 | N173: 4X4 | O173: =+(E173+G173+I173+K173)/(4) -> 1088.68
A174: 164 | B174: ZAFER ZAFER | C174: TR 7055 | D174: 202 | E174: 1343.1984 | F174: 149 | G174: 1285.4933000000001 | H174: 268 | I174: 1287.7973 | J174: 200 | K174: 426.4658 | N174: 4X4 | O174: =+(E174+G174+I174+K174)/(4) -> 1085.7387000000001
A175: 165 | B175: OSMAN ALTAS | C175: TR 34802 | D175: 166 | E175: 1349.6096 | F175: 135 | G175: 1287.4449 | H175: 156 | I175: 1323.0072 | J175: 213 | K175: 372.0335 | N175: 4X4 | O175: =+(E175+G175+I175+K175)/(4) -> 1083.0237999999999
A176: 166 | B176: ONER KAHRAMAN | C176: TR 59029 | D176: 317 | E176: 1324.3162 | F176: 179 | G176: 1282.7228 | H176: 202 | I176: 1314.5381 | J176: 208 | K176: 394.81639999999999 | N176: 4X4 | O176: =+(E176+G176+I176+K176)/(4) -> 1079.0983749999998
A177: 167 | B177: ISMAIL UNALDI | C177: TR 98385 | D177: 488 | E177: 1236.5958000000001 | F177: 92 | G177: 1300.9151999999999 | H177: 407 | I177: 336.91649999999998 | J177: 59 | K177: 1422.9193 | N177: 4X4 | O177: =+(E177+G177+I177+K177)/(4) -> 1074.3366999999998
A178: 168 | B178: MUSTAFA ENSOY | C178: TR 534 | D178: 354 | E178: 1311.2089000000001 | F178: 215 | G178: 1275.3882000000001 | H178: 109 | I178: 1336.6858 | J178: 212 | K178: 373.71350000000001 | N178: 4X4 | O178: =+(E178+G178+I178+K178)/(4) -> 1074.2491
A179: 169 | B179: HALIL TANSEL HOCA | C179: TR 114003 | D179: 441 | E179: 1281.3422 | F179: 177 | G179: 1282.9131 | H179: 237 | I179: 1300.6668999999999 | J179: 205 | K179: 409.32569999999998 | N179: 4X4 | O179: =+(E179+G179+I179+K179)/(4) -> 1068.5619750000001
A180: 170 | B180: MIKAIL KARDESLER | C180: TR 101632 | D180: 287 | E180: 1329.8757000000001 | F180: 448 | G180: 246.12979999999999 | H180: 272 | I180: 1287.0603000000001 | J180: 92 | K180: 1337.1506999999999 | N180: 4X4 | O180: =+(E180+G180+I180+K180)/(4) -> 1050.0541250000001
A181: 171 | B181: TRAKYA POSTA OGUN CEM KOSE | C181: TR 207187 | D181: 280 | E181: 1331.038 | F181: 15 | G181: 1356.9864 | H181: 413 | I181: 275.2602 | J181: 139 | K181: 1228.3604 | N181: 4X4 | O181: =+(E181+G181+I181+K181)/(4) -> 1047.9112500000001
A182: 172 | B182: ELEKTRIKCI OZCAN | C182: TR 188646 | D182: 222 | E182: 1341.2257 | F182: 315 | G182: 1176.2745 | H182: 289 | I182: 1272.2891999999999 | J182: 209 | K182: 391.5505 | N182: 4X4 | O182: =+(E182+G182+I182+K182)/(4) -> 1045.334975
A183: 173 | B183: TEAM OZKAN EYMEN | C183: TR 16217 | D183: 512 | E183: 1191.6537000000001 | F183: 165 | G183: 1284.0283999999999 | H183: 300 | I183: 1269.2893999999999 | J183: 207 | K183: 398.52820000000003 | N183: 4X4 | O183: =+(E183+G183+I183+K183)/(4) -> 1035.8749249999998
A184: 174 | B184: CIMBOMLU SECO | C184: TR 172516 | D184: 386 | E184: 1300.6832999999999 | F184: 407 | G184: 890.25480000000005 | H184: 406 | I184: 341.9513 | J184: 2 | K184: 1566.2892999999999 | N184: 4X4 | O184: =+(E184+G184+I184+K184)/(4) -> 1024.7946750000001
A185: 175 | B185: ESREF METIN | C185: TR 57585 | D185: 311 | E185: 1326.7497000000001 | F185: 459 | G185: 189.42920000000001 | H185: 329 | I185: 1244.3661999999999 | J185: 126 | K185: 1263.1792 | N185: 4X4 | O185: =+(E185+G185+I185+K185)/(4) -> 1005.9310750000001
A186: 176 | B186: RIDVAN MOLLAOGLU ISMAIL HACIOGLU | C186: TR 233387 | D186: 432 | E186: 1284.4802999999999 | F186: 394 | G186: 958.745 | H186: 312 | I186: 1260.9340999999999 | J186: 196 | K186: 499.82940000000002 | N186: 4X4 | O186: =+(E186+G186+I186+K186)/(4) -> 1000.9972
A187: 177 | B187: AHMET KILICARSLAN | C187: TR 73512 | D187: 465 | E187: 1266.9078999999999 | F187: 450 | G187: 227.83500000000001 | H187: 361 | I187: 1149.2932000000001 | J187: 90 | K187: 1350.0034000000001 | N187: 4X4 | O187: =+(E187+G187+I187+K187)/(4) -> 998.50987500000008
A188: 178 | B188: RESUL APO | C188: TR 89543 | D188: 252 | E188: 1336.6660999999999 | F188: 408 | G188: 889.97170000000006 | H188: 98 | I188: 1340.8856000000001 | J188: 203 | K188: 414.04939999999999 | N188: 4X4 | O188: =+(E188+G188+I188+K188)/(4) -> 995.39319999999998
A189: 179 | B189: BACO FARUK YILDIZ | C189: TR 78519 | D189: 547 | E189: 352.2441 | F189: 81 | G189: 1305.9217000000001 | H189: 400 | I189: 546.21789999999999 | J189: 27 | K189: 1470.7769000000001 | N189: 4X4 | O189: =+(E189+G189+I189+K189)/(4) -> 918.79015000000004
A190: 180 | B190: ERKAN SIMSEK | C190: TR 82515 | D190: 522 | E190: 1121.4555 | F190: 338 | G190: 1147.9628 | H190: 379 | I190: 996.06780000000003 | J190: 206 | K190: 406.15780000000001 | N190: 4X4 | O190: =+(E190+G190+I190+K190)/(4) -> 917.91097500000001
A191: 181 | B191: TEK CINAR INSAAT GOKHAN | C191: TR 46001 | D191: 264 | E191: 1334.9293 | F191: 423 | G191: 667.41840000000002 | H191: 299 | I191: 1269.4554000000001 | J191: 211 | K191: 391.08769999999998 | N191: 4X4 | O191: =+(E191+G191+I191+K191)/(4) -> 915.72270000000003
A192: 182 | B192: ERKAN BAYRAK | C192: TR 55529 | D192: 529 | E192: 931.92740000000003 | F192: 381 | G192: 982.79899999999998 | H192: 414 | I192: 268.39569999999998 | J192: 63 | K192: 1421.9739 | N192: 4X4 | O192: =+(E192+G192+I192+K192)/(4) -> 901.274
A193: 183 | B193: ERKAN BAYRAK | C193: TR 55531 | D193: 546 | E193: 357.25729999999999 | F193: 439 | G193: 418.68490000000003 | H193: 70 | I193: 1376.5142000000001 | J193: 69 | K193: 1419.2583999999999 | N193: 4X4 | O193: =+(E193+G193+I193+K193)/(4) -> 892.92869999999994
A194: 184 | B194: TAMER ERHAN YAY | C194: TR 95404 | D194: 514 | E194: 1185.0798 | F194: 95 | G194: 1299.3341 | H194: 403 | I194: 394.75510000000003 | J194: 202 | K194: 420.60930000000002 | N194: 4X4 | O194: =+(E194+G194+I194+K194)/(4) -> 824.94457499999999
A195: 185 | B195: MUSTAFA POLAT | C195: TR 269808 | D195: 542 | E195: 445.85230000000001 | F195: 460 | G195: 186.95419999999999 | H195: 310 | I195: 1261.5499 | J195: 142 | K195: 1225.5803000000001 | N195: 4X4 | O195: =+(E195+G195+I195+K195)/(4) -> 779.98417500000005
A196: 186 | B196: KARA MURAT | C196: TR 90150 | D196: 554 | E196: 154.68270000000001 | F196: 391 | G196: 962.45809999999994 | H196: 38 | I196: 1401.5834 | J196: 204 | K196: 413.73910000000001 | N196: 4X4 | O196: =+(E196+G196+I196+K196)/(4) -> 733.11582499999986
A197: 187 | B197: AYDOGAN MENGUL | C197: TR 96906 | D197: 540 | E197: 674.97260000000006 | F197: 444 | G197: 322.62529999999998 | H197: 408 | I197: 328.52659999999997 | J197: 210 | K197: 391.45710000000003 | N197: 4X4 | O197: =+(E197+G197+I197+K197)/(4) -> 429.3954