A1: PROFESYONEL DERBY 45 KLASMAN LÝSTESÝ
A7: BENZING SÝSTEMÝNDE UÇUM HIZI ÝLE YAPILAN KLASMAN HESAPLAMASINDA 1 GÜNLÜK - 2 GÜNLÜK VE 3 GÜNLÜK YARIÞLARDA LÝSTEYE GÝREN BÜTÜN KUÞLAR DEÐERLENDÝRMEYE ALINIR
D8: 1 GÜNLÜK | F8: 1 GÜNLÜK | H8: 1 GÜNLÜK | J8: 1 GÜNLÜK | L8: 2 GÜNLÜK
D9: KULA | F9: UÞAK | H9: DUMLUPINAR | J9: AFYON ÇOBANLAR | L9: CÝHANBEYLÝ FÝNAL | N9: ETAP | O9: ORTALAMA HIZ
A10: NO | B10: AD SOYAD | C10: KÜNYE | D10: SIRA | E10: HIZ | F10: SIRA | G10: HIZ | H10: SIRA | I10: HIZ | J10: SIRA | K10: HIZ | L10: SIRA | M10: HIZ
A11: 1 | B11: TURGUTLU - TUR SUT MANDIRA | C11: TR 155033 | D11: 448 | E11: 1277.1066000000001 | F11: 34 | G11: 1340.2879 | H11: 180 | I11: 1319.3443 | J11: 36 | K11: 1464.2003 | L11: 2 | M11: 1431.3523 | N11: 5X5 | O11: =+(E11+G11+I11+K11+M11)/(5) -> 1366.4582800000001
A12: 2 | B12: SEDAT AYDIN | C12: TR 95502 | D12: 178 | E12: 1347.2308 | F12: 358 | G12: 1086.4792 | H12: 218 | I12: 1308.3855000000001 | J12: 82 | K12: 1405.9314999999999 | L12: 3 | M12: 1430.9949999999999 | N12: 5X5 | O12: =+(E12+G12+I12+K12+M12)/(5) -> 1315.8044
A13: 3 | B13: BACO FARUK YILDIZ | C13: TR 78518 | D13: 49 | E13: 1396.3848 | F13: 2 | G13: 1368.7849000000001 | H13: 120 | I13: 1332.3240000000001 | J13: 50 | K13: 1438.8661999999999 | L13: 8 | M13: 733.00890000000004 | N13: 5X5 | O13: =+(E13+G13+I13+K13+M13)/(5) -> 1253.8737600000002
A14: 4 | B14: ERCAN KOC | C14: TR 74605 | D14: 111 | E14: 1372.0244 | F14: 125 | G14: 1289.8909000000001 | H14: 276 | I14: 1285.4009000000001 | J14: 152 | K14: 1213.5193999999999 | L14: 5 | M14: 901.75450000000001 | N14: 5X5 | O14: =+(E14+G14+I14+K14+M14)/(5) -> 1212.51802
A15: 5 | B15: ERCAN KOC | C15: TR 74606 | D15: 315 | E15: 1325.2844 | F15: 96 | G15: 1298.8507 | H15: 62 | I15: 1379.5641000000001 | J15: 182 | K15: 998.2962 | L15: 4 | M15: 902.02750000000003 | N15: 5X5 | O15: =+(E15+G15+I15+K15+M15)/(5) -> 1180.80458
A16: 6 | B16: UMIT ZEYBEK | C16: TR 270694 | D16: 104 | E16: 1373.8590999999999 | F16: 101 | G16: 1296.7926 | H16: 26 | I16: 1407.4024999999999 | J16: 7 | K16: 1539.6958999999999 | L16: 34 | M16: 285.51229999999998 | N16: 5X5 | O16: =+(E16+G16+I16+K16+M16)/(5) -> 1180.65248
A17: 7 | B17: SANATCI HACI SEVINC | C17: TR 246701 | D17: 10 | E17: 1411.0574999999999 | F17: 83 | G17: 1305.231 | H17: 21 | I17: 1407.9579000000001 | J17: 38 | K17: 1463.1957 | L17: 20 | M17: 296.06689999999998 | N17: 5X5 | O17: =+(E17+G17+I17+K17+M17)/(5) -> 1176.7018
A18: 8 | B18: IHSAN SARIYER | C18: TR 90129 | D18: 275 | E18: 1332.2527 | F18: 98 | G18: 1298.0217 | H18: 5 | I18: 1419.5182 | J18: 13 | K18: 1527.8683000000001 | L18: 13 | M18: 303.93060000000003 | N18: 5X5 | O18: =+(E18+G18+I18+K18+M18)/(5) -> 1176.3183000000001
A19: 9 | B19: MEHMET TUNCAY | C19: TR 135274 | D19: 121 | E19: 1369.2940000000001 | F19: 5 | G19: 1363.1696999999999 | H19: 12 | I19: 1410.7431999999999 | J19: 46 | K19: 1450.4771000000001 | L19: 37 | M19: 282.39670000000001 | N19: 5X5 | O19: =+(E19+G19+I19+K19+M19)/(5) -> 1175.21614
A20: 10 | B20: TAMER SEMERCILER | C20: TR 172004 | D20: 127 | E20: 1366.0175999999999 | F20: 8 | G20: 1362.1369 | H20: 10 | I20: 1411.1986999999999 | J20: 71 | K20: 1410.2647999999999 | L20: 77 | M20: 263.43099999999998 | N20: 5X5 | O20: =+(E20+G20+I20+K20+M20)/(5) -> 1162.6097999999997
A21: 11 | B21: MEHMET BULDUK | C21: TR 77314 | D21: 86 | E21: 1381.3649 | F21: 235 | G21: 1259.9798000000001 | H21: 39 | I21: 1401.3542 | J21: 39 | K21: 1463.1446000000001 | L21: 28 | M21: 289.08030000000002 | N21: 5X5 | O21: =+(E21+G21+I21+K21+M21)/(5) -> 1158.9847600000001
A22: 12 | B22: ONDER KARDESLER | C22: TR 100582 | D22: 73 | E22: 1388.6895999999999 | F22: 133 | G22: 1287.5934 | H22: 94 | I22: 1341.9489000000001 | J22: 35 | K22: 1464.3647000000001 | L22: 48 | M22: 276.15780000000001 | N22: 5X5 | O22: =+(E22+G22+I22+K22+M22)/(5) -> 1151.7508800000001
A23: 13 | B23: BABUSLAR | C23: TR 85706 | D23: 110 | E23: 1372.0745999999999 | F23: 112 | G23: 1292.4802 | H23: 89 | I23: 1348.0735999999999 | J23: 41 | K23: 1462.0916 | L23: 76 | M23: 263.44029999999998 | N23: 5X5 | O23: =+(E23+G23+I23+K23+M23)/(5) -> 1147.6320599999999
A24: 14 | B24: SANATCI HACI SEVINC | C24: TR 246707 | D24: 66 | E24: 1392.0273999999999 | F24: 35 | G24: 1340.2692 | H24: 66 | I24: 1378.1885 | J24: 73 | K24: 1409.9401 | L24: 98 | M24: 212.45359999999999 | N24: 5X5 | O24: =+(E24+G24+I24+K24+M24)/(5) -> 1146.5757599999999
A25: 15 | B25: EDIP BEKIL BULENT YILMAZ | C25: TR 11008 | D25: 82 | E25: 1385.2526 | F25: 69 | G25: 1312.3951999999999 | H25: 7 | I25: 1412.0486000000001 | J25: 91 | K25: 1337.7877000000001 | L25: 43 | M25: 280.33640000000003 | N25: 5X5 | O25: =+(E25+G25+I25+K25+M25)/(5) -> 1145.5641000000001
A26: 16 | B26: CEMALETTIN DAG | C26: TR 90732 | D26: 65 | E26: 1392.79 | F26: 72 | G26: 1309.0576000000001 | H26: 129 | I26: 1331.1578 | J26: 61 | K26: 1422.1391000000001 | L26: 88 | M26: 247.26429999999999 | N26: 5X5 | O26: =+(E26+G26+I26+K26+M26)/(5) -> 1140.4817600000001
A27: 17 | B27: MEHMET KIR | C27: TR 9913 | D27: 296 | E27: 1328.6034999999999 | F27: 110 | G27: 1292.6994999999999 | H27: 22 | I27: 1407.7102 | J27: 86 | K27: 1398.8154999999999 | L27: 61 | M27: 271.24400000000003 | N27: 5X5 | O27: =+(E27+G27+I27+K27+M27)/(5) -> 1139.8145399999999
A28: 18 | B28: RECEP OZTURK | C28: TR 225089 | D28: 230 | E28: 1340.1413 | F28: 225 | G28: 1266.3822 | H28: 9 | I28: 1411.2636 | J28: 84 | K28: 1400.9385 | L28: 51 | M28: 274.73820000000001 | N28: 5X5 | O28: =+(E28+G28+I28+K28+M28)/(5) -> 1138.6927600000001
A29: 19 | B29: SINAN KARATAS | C29: TR 228704 | D29: 481 | E29: 1249.3077000000001 | F29: 152 | G29: 1284.8653999999999 | H29: 52 | I29: 1387.4466 | J29: 42 | K29: 1462.0464999999999 | L29: 21 | M29: 296.04259999999999 | N29: 5X5 | O29: =+(E29+G29+I29+K29+M29)/(5) -> 1135.9417599999999
A30: 20 | B30: TAMER SANLI | C30: TR 50061 | D30: 278 | E30: 1331.8831 | F30: 13 | G30: 1358.5784000000001 | H30: 250 | I30: 1295.6483000000001 | J30: 81 | K30: 1406.2114999999999 | L30: 67 | M30: 267.91469999999998 | N30: 5X5 | O30: =+(E30+G30+I30+K30+M30)/(5) -> 1132.0472
A31: 21 | B31: MALAZGIRT BORU TEAM | C31: TR 90114 | D31: 30 | E31: 1403.4628 | F31: 46 | G31: 1339.4875 | H31: 101 | I31: 1340.0893000000001 | J31: 98 | K31: 1319.9036000000001 | L31: 93 | M31: 229.79079999999999 | N31: 5X5 | O31: =+(E31+G31+I31+K31+M31)/(5) -> 1126.5467999999998
A32: 22 | B32: GULUM KARDESLER | C32: TR 258022 | D32: 213 | E32: 1342.393 | F32: 249 | G32: 1253.7760000000001 | H32: 234 | I32: 1301.6532 | J32: 31 | K32: 1467.8133 | L32: 75 | M32: 263.52229999999997 | N32: 5X5 | O32: =+(E32+G32+I32+K32+M32)/(5) -> 1125.8315599999999
A33: 23 | B33: CEM MERKOZLU | C33: TR 260000 | D33: 487 | E33: 1239.8923 | F33: 55 | G33: 1338.4548 | H33: 20 | I33: 1408.1232 | J33: 89 | K33: 1381.2271000000001 | L33: 81 | M33: 259.85550000000001 | N33: 5X5 | O33: =+(E33+G33+I33+K33+M33)/(5) -> 1125.5105799999999
A34: 24 | B34: HUSEYIN NURCAN | C34: TR 163950 | D34: 34 | E34: 1402.318 | F34: 130 | G34: 1288.2239999999999 | H34: 27 | I34: 1407.326 | J34: 132 | K34: 1252.5075999999999 | L34: 87 | M34: 252.2621 | N34: 5X5 | O34: =+(E34+G34+I34+K34+M34)/(5) -> 1120.52754
A35: 25 | B35: ZAFER ZAFER | C35: TR 7001 | D35: 239 | E35: 1339.3605 | F35: 198 | G35: 1280.087 | H35: 55 | I35: 1381.6433999999999 | J35: 105 | K35: 1312.9744000000001 | L35: 69 | M35: 267.39210000000003 | N35: 5X5 | O35: =+(E35+G35+I35+K35+M35)/(5) -> 1116.2914800000001
A36: 26 | B36: MURAT OYNAR | C36: TR 212528 | D36: 299 | E36: 1328.2447 | F36: 199 | G36: 1280.0631000000001 | H36: 318 | I36: 1255.7388000000001 | J36: 80 | K36: 1408.809 | L36: 47 | M36: 276.67450000000002 | N36: 5X5 | O36: =+(E36+G36+I36+K36+M36)/(5) -> 1109.9060199999999
A37: 27 | B37: NECO YILDIZ | C37: TR 95018 | D37: 459 | E37: 1272.3995 | F37: 240 | G37: 1258.2655999999999 | H37: 362 | I37: 1134.6776 | J37: 1 | K37: 1587.2862 | L37: 60 | M37: 271.29 | N37: 5X5 | O37: =+(E37+G37+I37+K37+M37)/(5) -> 1104.78378
A38: 28 | B38: IBRAHIM HUSEYIN | C38: TR 161141 | D38: 19 | E38: 1408.5300999999999 | F38: 326 | G38: 1172.3715999999999 | H38: 23 | I38: 1407.6516999999999 | J38: 110 | K38: 1297.2047 | L38: 92 | M38: 230.80709999999999 | N38: 5X5 | O38: =+(E38+G38+I38+K38+M38)/(5) -> 1103.31304
A39: 29 | B39: UC KARDESLER | C39: TR 78803 | D39: 415 | E39: 1290.4697000000001 | F39: 173 | G39: 1283.3263999999999 | H39: 149 | I39: 1325.8829000000001 | J39: 103 | K39: 1317.9996000000001 | L39: 24 | M39: 293.4151 | N39: 5X5 | O39: =+(E39+G39+I39+K39+M39)/(5) -> 1102.21874
A40: 30 | B40: ADEM AHMET | C40: TR 166243 | D40: 128 | E40: 1365.9522999999999 | F40: 172 | G40: 1283.6334999999999 | H40: 78 | I40: 1352.5545999999999 | J40: 136 | K40: 1228.8711000000001 | L40: 54 | M40: 273.04250000000002 | N40: 5X5 | O40: =+(E40+G40+I40+K40+M40)/(5) -> 1100.8108
A41: 31 | B41: MEHMET BULDUK | C41: TR 77309 | D41: 524 | E41: 1107.2275999999999 | F41: 12 | G41: 1360.5404000000001 | H41: 106 | I41: 1338.4966999999999 | J41: 66 | K41: 1421.1319000000001 | L41: 74 | M41: 265.08030000000002 | N41: 5X5 | O41: =+(E41+G41+I41+K41+M41)/(5) -> 1098.4953799999998
A42: 32 | B42: SERDAR AYDIN EGE POSTA | C42: TR 141880 | D42: 170 | E42: 1349.0391 | F42: 170 | G42: 1283.7623000000001 | H42: 183 | I42: 1318.788 | J42: 94 | K42: 1320.6181999999999 | L42: 96 | M42: 218.23099999999999 | N42: 5X5 | O42: =+(E42+G42+I42+K42+M42)/(5) -> 1098.08772
A43: 33 | B43: ISMAIL YUNUS TASCI | C43: TR 91611 | D43: 426 | E43: 1286.4991 | F43: 195 | G43: 1280.6267 | H43: 82 | I43: 1350.0287000000001 | J43: 117 | K43: 1283.7163 | L43: 36 | M43: 282.59989999999999 | N43: 5X5 | O43: =+(E43+G43+I43+K43+M43)/(5) -> 1096.6941400000001
A44: 34 | B44: YUSUF KARAKURT | C44: TR 27165 | D44: 302 | E44: 1327.6597999999999 | F44: 228 | G44: 1262.5117 | H44: 165 | I44: 1321.4866999999999 | J44: 130 | K44: 1262.134 | L44: 17 | M44: 296.57889999999998 | N44: 5X5 | O44: =+(E44+G44+I44+K44+M44)/(5) -> 1094.07422
A45: 35 | B45: KASAP OSMAN | C45: TR 66505 | D45: 169 | E45: 1349.2272 | F45: 293 | G45: 1197.8842 | H45: 141 | I45: 1329.2382 | J45: 102 | K45: 1318.1174000000001 | L45: 55 | M45: 272.61169999999998 | N45: 5X5 | O45: =+(E45+G45+I45+K45+M45)/(5) -> 1093.4157399999999
A46: 36 | B46: YUNUS DEMIR | C46: TR 93202 | D46: 418 | E46: 1289.0528999999999 | F46: 129 | G46: 1289.2967000000001 | H46: 74 | I46: 1371.5369000000001 | J46: 134 | K46: 1235.5017 | L46: 46 | M46: 277.64429999999999 | N46: 5X5 | O46: =+(E46+G46+I46+K46+M46)/(5) -> 1092.6065000000001
A47: 37 | B47: KIVANC KARDESLER | C47: TR 170441 | D47: 276 | E47: 1332.1492000000001 | F47: 205 | G47: 1278.8984 | H47: 264 | I47: 1288.3264999999999 | J47: 125 | K47: 1263.2173 | L47: 14 | M47: 297.57409999999999 | N47: 5X5 | O47: =+(E47+G47+I47+K47+M47)/(5) -> 1092.0331000000001
A48: 38 | B48: SERDAR AYDIN EGE POSTA | C48: TR 141868 | D48: 520 | E48: 1148.0968 | F48: 245 | G48: 1256.0791999999999 | H48: 266 | I48: 1288.2095999999999 | J48: 19 | K48: 1489.2637 | L48: 65 | M48: 268.61989999999997 | N48: 5X5 | O48: =+(E48+G48+I48+K48+M48)/(5) -> 1090.0538399999998
A49: 39 | B49: HUSEYIN DEMIR KIRAZ | C49: TR 162108 | D49: 173 | E49: 1347.8571999999999 | F49: 357 | G49: 1089.3098 | H49: 294 | I49: 1270.3692000000001 | J49: 54 | K49: 1429.5858000000001 | L49: 25 | M49: 293.4008 | N49: 5X5 | O49: =+(E49+G49+I49+K49+M49)/(5) -> 1086.1045600000002
A50: 40 | B50: TASKAN TENEKE | C50: TR 10902 | D50: 150 | E50: 1357.3279 | F50: 181 | G50: 1282.7057 | H50: 155 | I50: 1323.0841 | J50: 164 | K50: 1180.0346 | L50: 38 | M50: 282.38260000000002 | N50: 5X5 | O50: =+(E50+G50+I50+K50+M50)/(5) -> 1085.10698
A51: 41 | B51: TRAKYA POSTA OGUN CEM KOSE | C51: TR 207083 | D51: 269 | E51: 1333.5673999999999 | F51: 352 | G51: 1120.6207999999999 | H51: 15 | I51: 1409.8949 | J51: 115 | K51: 1284.1916000000001 | L51: 71 | M51: 266.10579999999999 | N51: 5X5 | O51: =+(E51+G51+I51+K51+M51)/(5) -> 1082.8761
A52: 42 | B52: KENAN YIRAL | C52: TR 272201 | D52: 401 | E52: 1294.6772000000001 | F52: 312 | G52: 1176.7806 | H52: 290 | I52: 1272.1531 | J52: 83 | K52: 1401.6519000000001 | L52: 79 | M52: 260.7527 | N52: 5X5 | O52: =+(E52+G52+I52+K52+M52)/(5) -> 1081.2031000000002
A53: 43 | B53: ISMAIL TOLON | C53: TR 210558 | D53: 348 | E53: 1314.1208999999999 | F53: 197 | G53: 1280.3022000000001 | H53: 170 | I53: 1320.6392000000001 | J53: 149 | K53: 1221.3914 | L53: 84 | M53: 256.87979999999999 | N53: 5X5 | O53: =+(E53+G53+I53+K53+M53)/(5) -> 1078.6667
A54: 44 | B54: NECO YILDIZ | C54: TR 95020 | D54: 277 | E54: 1332.0072 | F54: 237 | G54: 1259.4326000000001 | H54: 231 | I54: 1302.9367 | J54: 154 | K54: 1207.7351000000001 | L54: 59 | M54: 271.5034 | N54: 5X5 | O54: =+(E54+G54+I54+K54+M54)/(5) -> 1074.723
A55: 45 | B55: OMER DURAK MAHMUT AKKOYUN | C55: TR 222468 | D55: 507 | E55: 1203.4853000000001 | F55: 167 | G55: 1283.922 | H55: 65 | I55: 1378.3957 | J55: 138 | K55: 1228.6086 | L55: 58 | M55: 272.58269999999999 | N55: 5X5 | O55: =+(E55+G55+I55+K55+M55)/(5) -> 1073.3988599999998
A56: 46 | B56: ZAFER ZAFER | C56: TR 7060 | D56: 306 | E56: 1327.0197000000001 | F56: 264 | G56: 1233.4338 | H56: 313 | I56: 1260.0145 | J56: 101 | K56: 1318.1251 | L56: 95 | M56: 225.22200000000001 | N56: 5X5 | O56: =+(E56+G56+I56+K56+M56)/(5) -> 1072.7630199999999
A57: 47 | B57: DURALI BALIM | C57: TR 211900 | D57: 84 | E57: 1383.4384 | F57: 262 | G57: 1236.0509999999999 | H57: 90 | I57: 1347.4915000000001 | J57: 173 | K57: 1119.0425 | L57: 57 | M57: 272.60199999999998 | N57: 5X5 | O57: =+(E57+G57+I57+K57+M57)/(5) -> 1071.7250799999999
A58: 48 | B58: KENAN USLU | C58: TR 214135 | D58: 100 | E58: 1377.7299 | F58: 166 | G58: 1283.9631999999999 | H58: 380 | I58: 994.83510000000001 | J58: 85 | K58: 1400.7248 | L58: 72 | M58: 265.61869999999999 | N58: 5X5 | O58: =+(E58+G58+I58+K58+M58)/(5) -> 1064.5743399999999
A59: 49 | B59: ISIK PETROL | C59: TR 166001 | D59: 438 | E59: 1282.1252999999999 | F59: 253 | G59: 1250.7784999999999 | H59: 238 | I59: 1299.8880999999999 | J59: 131 | K59: 1260.4088999999999 | L59: 97 | M59: 216.97489999999999 | N59: 5X5 | O59: =+(E59+G59+I59+K59+M59)/(5) -> 1062.0351400000002
A60: 50 | B60: OMER DURAK MAHMUT AKKOYUN | C60: TR 222467 | D60: 359 | E60: 1309.489 | F60: 284 | G60: 1206.3969 | H60: 315 | I60: 1258.0043000000001 | J60: 129 | K60: 1262.1659 | L60: 68 | M60: 267.41629999999998 | N60: 5X5 | O60: =+(E60+G60+I60+K60+M60)/(5) -> 1060.6944799999999
A61: 51 | B61: F.CANKAYA E.ALTAN E.FIDAN | C61: TR 202155 | D61: 375 | E61: 1304.6626000000001 | F61: 200 | G61: 1279.8891000000001 | H61: 327 | I61: 1245.357 | J61: 161 | K61: 1182.5363 | L61: 64 | M61: 269.79590000000002 | N61: 5X5 | O61: =+(E61+G61+I61+K61+M61)/(5) -> 1056.4481799999999
A62: 52 | B62: MUHARREM HUSEYIN | C62: TR 40002 | D62: 265 | E62: 1334.665 | F62: 385 | G62: 979.59879999999998 | H62: 229 | I62: 1304.2575999999999 | J62: 64 | K62: 1421.4989 | L62: 91 | M62: 232.5591 | N62: 5X5 | O62: =+(E62+G62+I62+K62+M62)/(5) -> 1054.5158800000002
A63: 53 | B63: TRAKYA POSTA OGUN CEM KOSE | C63: TR 207102 | D63: 140 | E63: 1359.9121 | F63: 382 | G63: 982.68830000000003 | H63: 331 | I63: 1241.0482 | J63: 68 | K63: 1419.4060999999999 | L63: 80 | M63: 260.5711 | N63: 5X5 | O63: =+(E63+G63+I63+K63+M63)/(5) -> 1052.7251600000002
A64: 54 | B64: SANATCI HACI SEVINC | C64: TR 246704 | D64: 164 | E64: 1349.9619 | F64: 383 | G64: 982.50120000000004 | H64: 278 | I64: 1284.9829 | J64: 109 | K64: 1308.4086 | L64: 49 | M64: 275.57830000000001 | N64: 5X5 | O64: =+(E64+G64+I64+K64+M64)/(5) -> 1040.28658
A65: 55 | B65: BY CULIYAS GUZELDEMIRCI KRDSLR | C65: TR 200330 | D65: 91 | E65: 1380.4401 | F65: 386 | G65: 979.52089999999998 | H65: 267 | I65: 1288.1416999999999 | J65: 148 | K65: 1221.5853999999999 | L65: 15 | M65: 297.15730000000002 | N65: 5X5 | O65: =+(E65+G65+I65+K65+M65)/(5) -> 1033.3690799999999
A66: 56 | B66: ENGIN KAPTAN | C66: TR 270408 | D66: 284 | E66: 1330.6070999999999 | F66: 367 | G66: 1045.64 | H66: 172 | I66: 1320.1294 | J66: 166 | K66: 1165.3284000000001 | L66: 18 | M66: 296.5539 | N66: 5X5 | O66: =+(E66+G66+I66+K66+M66)/(5) -> 1031.6517600000002
A67: 57 | B67: KENAN SIMSEK | C67: TR 137937 | D67: 259 | E67: 1335.4730999999999 | F67: 405 | G67: 902.8768 | H67: 99 | I67: 1340.5492999999999 | J67: 146 | K67: 1222.1768 | L67: 44 | M67: 279.51 | N67: 5X5 | O67: =+(E67+G67+I67+K67+M67)/(5) -> 1016.1172
A68: 58 | B68: NECO YILDIZ | C68: TR 95017 | D68: 185 | E68: 1345.7018 | F68: 395 | G68: 957.56590000000006 | H68: 305 | I68: 1263.9380000000001 | J68: 143 | K68: 1225.2574999999999 | L68: 45 | M68: 278.62860000000001 | N68: 5X5 | O68: =+(E68+G68+I68+K68+M68)/(5) -> 1014.2183600000001
A69: 59 | B69: YUSUF KARAKURT | C69: TR 27216 | D69: 28 | E69: 1403.7879 | F69: 365 | G69: 1050.0123000000001 | H69: 176 | I69: 1319.6186 | J69: 179 | K69: 1021.7247 | L69: 90 | M69: 239.78479999999999 | N69: 5X5 | O69: =+(E69+G69+I69+K69+M69)/(5) -> 1006.9856600000001
A70: 60 | B70: FESIH UNAL | C70: TR 127506 | D70: 389 | E70: 1299.9816000000001 | F70: 292 | G70: 1197.9604999999999 | H70: 206 | I70: 1311.9434000000001 | J70: 188 | K70: 875.42380000000003 | L70: 35 | M70: 284.16730000000001 | N70: 5X5 | O70: =+(E70+G70+I70+K70+M70)/(5) -> 993.8953200000002
A71: 61 | B71: KIRKPINAR ARENA | C71: TR 63014 | D71: 160 | E71: 1351.4609 | F71: 413 | G71: 860.87459999999999 | H71: 334 | I71: 1235.7548999999999 | J71: 144 | K71: 1224.0309999999999 | L71: 56 | M71: 272.60849999999999 | N71: 5X5 | O71: =+(E71+G71+I71+K71+M71)/(5) -> 988.94598000000008
A72: 62 | B72: OSMAN ALTAS | C72: TR 34810 | D72: 45 | E72: 1398.2624000000001 | F72: 9 | G72: 1361.9571000000001 | H72: 45 | I72: 1397.0353 | J72: 199 | K72: 429.92489999999998 | L72: 27 | M72: 291.60730000000001 | N72: 5X5 | O72: =+(E72+G72+I72+K72+M72)/(5) -> 975.75740000000008
A73: 63 | B73: SAMPIYON GOKHAN TUNCA MIKI | C73: TR 42830 | D73: 36 | E73: 1402.2720999999999 | F73: 54 | G73: 1338.7198000000001 | H73: 103 | I73: 1339.1932999999999 | J73: 201 | K73: 426.1078 | L73: 19 | M73: 296.53519999999997 | N73: 5X5 | O73: =+(E73+G73+I73+K73+M73)/(5) -> 960.56564000000003
A74: 64 | B74: SERKAN CIFTCI | C74: TR 114842 | D74: 345 | E74: 1315.0482999999999 | F74: 52 | G74: 1338.8991000000001 | H74: 97 | I74: 1341.0328 | J74: 197 | K74: 486.28550000000001 | L74: 16 | M74: 296.70819999999998 | N74: 5X5 | O74: =+(E74+G74+I74+K74+M74)/(5) -> 955.59478000000001
A75: 65 | B75: FERIT DEMIR | C75: TR 92723 | D75: 518 | E75: 1162.1826000000001 | F75: 24 | G75: 1349.5219999999999 | H75: 86 | I75: 1348.3215 | J75: 194 | K75: 510.06920000000002 | L75: 66 | M75: 268.21749999999997 | N75: 5X5 | O75: =+(E75+G75+I75+K75+M75)/(5) -> 927.66255999999998
A76: 66 | B76: GOKHAN SOYTURK | C76: TR 34415 | D76: 211 | E76: 1342.4349999999999 | F76: 426 | G76: 639.50890000000004 | H76: 383 | I76: 963.04250000000002 | J76: 77 | K76: 1409.7336 | L76: 52 | M76: 274.35840000000002 | N76: 5X5 | O76: =+(E76+G76+I76+K76+M76)/(5) -> 925.81567999999993
A77: 67 | B77: MIKAIL KARDESLER | C77: TR 101632 | D77: 287 | E77: 1329.8757000000001 | F77: 448 | G77: 246.12979999999999 | H77: 272 | I77: 1287.0603000000001 | J77: 92 | K77: 1337.1506999999999 | L77: 32 | M77: 286.5446 | N77: 5X5 | O77: =+(E77+G77+I77+K77+M77)/(5) -> 897.3522200000001
A78: 68 | B78: RESUL APO | C78: TR 89543 | D78: 252 | E78: 1336.6660999999999 | F78: 408 | G78: 889.97170000000006 | H78: 98 | I78: 1340.8856000000001 | J78: 203 | K78: 414.04939999999999 | L78: 53 | M78: 273.46449999999999 | N78: 5X5 | O78: =+(E78+G78+I78+K78+M78)/(5) -> 851.00746000000004
A79: 69 | B79: ERKAN SIMSEK | C79: TR 82515 | D79: 522 | E79: 1121.4555 | F79: 338 | G79: 1147.9628 | H79: 379 | I79: 996.06780000000003 | J79: 206 | K79: 406.15780000000001 | L79: 50 | M79: 274.87459999999999 | N79: 5X5 | O79: =+(E79+G79+I79+K79+M79)/(5) -> 789.30370000000005
A80: 70 | B80: TEK CINAR INSAAT GOKHAN | C80: TR 46001 | D80: 264 | E80: 1334.9293 | F80: 423 | G80: 667.41840000000002 | H80: 299 | I80: 1269.4554000000001 | J80: 211 | K80: 391.08769999999998 | L80: 94 | M80: 225.7654 | N80: 5X5 | O80: =+(E80+G80+I80+K80+M80)/(5) -> 777.73124000000007
A81: 71 | B81: ERKAN BAYRAK | C81: TR 55529 | D81: 529 | E81: 931.92740000000003 | F81: 381 | G81: 982.79899999999998 | H81: 414 | I81: 268.39569999999998 | J81: 63 | K81: 1421.9739 | L81: 83 | M81: 258.34160000000003 | N81: 5X5 | O81: =+(E81+G81+I81+K81+M81)/(5) -> 772.68752000000006
A82: 72 | B82: ERKAN BAYRAK | C82: TR 55531 | D82: 546 | E82: 357.25729999999999 | F82: 439 | G82: 418.68490000000003 | H82: 70 | I82: 1376.5142000000001 | J82: 69 | K82: 1419.2583999999999 | L82: 42 | M82: 280.35809999999998 | N82: 5X5 | O82: =+(E82+G82+I82+K82+M82)/(5) -> 770.41457999999989
A83: 73 | B83: TAMER ERHAN YAY | C83: TR 95404 | D83: 514 | E83: 1185.0798 | F83: 95 | G83: 1299.3341 | H83: 403 | I83: 394.75510000000003 | J83: 202 | K83: 420.60930000000002 | L83: 23 | M83: 293.4529 | N83: 5X5 | O83: =+(E83+G83+I83+K83+M83)/(5) -> 718.64624000000003
A84: 74 | B84: KARA MURAT | C84: TR 90150 | D84: 554 | E84: 154.68270000000001 | F84: 391 | G84: 962.45809999999994 | H84: 38 | I84: 1401.5834 | J84: 204 | K84: 413.73910000000001 | L84: 82 | M84: 258.48950000000002 | N84: 5X5 | O84: =+(E84+G84+I84+K84+M84)/(5) -> 638.19055999999989